Date,News Title
2023-01-20,Internet analysts are focusing on one big stock as their favorite 2023 comeback story
2023-01-20,"Overconfidence can be ‘a pathway to poor portfolio performance,’ says chief investment officer. How to ..."
2023-01-19,"Here are Thursday’s biggest analyst calls: Netflix, Meta, Apple, Tesla, Charles Schwab, Roblox, Amazon & ..."
2023-01-19,Hertz is bringing thousands of EVs and chargers to the city of Denver in a ...
2023-01-19,Davos crypto crowd distance themselves from FTX and Sam Bankman-Fried: “It’s fraud”
2023-01-19,China tightens media control with tiny stakes in two Alibaba units
2023-01-19,"Google, Meta, Amazon and other tech companies have laid off more than 104,000 employees in ..."
2023-01-18,Winners and losers in electric vehicles as Tesla possibly ignites a price war
2023-01-18,Greenlight’s David Einhorn is shorting innovation stocks like those held by Cathie Wood
2023-01-17,"Jim Cramer’s top 10 things to watch in the market Tuesday: Morgan Stanley beat, Goldman ..."
2023-01-17,"Cramer sees bullish signs starting to emerge in the stock market, just not in the ..."
2023-01-14,Earnings stars: Stocks expected to post the biggest profit growth of 2023
2023-01-13,"Jim Cramer’s top 10 things to watch in the market Friday: Banks swoon, Tesla cuts ..."
2023-01-13,"Guggenheim downgrades Tesla to sell, says fourth-quarter estimates are too optimistic"
2023-01-13,"Stocks making the biggest moves midday: Cognizant, American Airlines, Logitech and more"
2023-01-12,"Here are Thursday’s biggest analyst calls: Meta, Apple, Tesla, Netflix, Roku, Disney, Exxon & more"
2023-01-12,FTX founder Sam Bankman-Fried denies stealing user funds and repeats claims of solvency in new ...
2023-01-11,"Here are Wednesday’s biggest analyst calls: Apple, Tesla, Netflix, Amazon, Salesforce, Levi’s & more"
2023-01-11,"Stocks making the biggest moves premarket: CarMax, Salesforce, Coinbase and more"
2023-01-11,"Goldman Sachs downgrades this stock as auto market faces a tough macro outlook, names Tesla ..."
2023-01-10,Nasdaq registra su segundo día de ganancias a medida que Wall Street compra acciones tecnológicas
2023-01-09,"Stocks making the biggest moves premarket: Lululemon, Duck Creek, Mastercard, Uber and more"
2023-01-09,India is learning to love electric vehicles — but they’re not cars
2023-01-07,Did the market already show its hand in the first week of 2023? What we’ve ...
2023-01-07,Think you’ve got investing skill? Your overconfidence may be costly
2023-01-06,"Jim Cramer’s top 10 things to watch in the market Friday: Goldilocks jobs, mega-caps, Costco"
2023-01-06,Goldman Sachs says these stocks could see strong earnings growth this year
2023-01-06,"Amazon’s 18,000 job cuts don’t go far enough. We expect more layoffs are on the ..."
2023-01-05,Ford pickup truck sales in December help narrow overall sales decline in 2022
2023-01-05,Amazon’s Alexa will soon help EV drivers find a charger
2023-01-05,"Here are Thursday’s biggest analyst calls: Tesla, Meta, Disney, Amazon, Nvidia, Coinbase, Uber & more"
2023-01-05,Microsoft drops after UBS analysts warn of weakness in the cloud
2023-01-04,"Cramer on recent tech layoffs, earnings and big tech’s recent rebound"
2023-01-04,"Jim Cramer’s top 10 things to watch in the market Wednesday: Tech layoffs, bank double ..."
2023-01-04,"Stocks making the biggest moves premarket: General Electric, Salesforce, Alibaba and more"
2023-01-04,Upstart Chinese electric car brand delivered more cars than Nio in 2022
2023-01-04,"Wall Street is bullish on this chip giant, with Morgan Stanley giving it 55% upside"
2023-01-04,This is the year that all stocks will be measured by the same yardstick
2023-01-04,"Goldman’s top stocks to play the Inflation Reduction Act, including some with 50% upside"
2023-01-03,Tesla shares tumble more than 12% following deliveries report
2023-01-03,"Jim Cramer’s top 10 things to watch in the market Tuesday: Wages too high, China ..."
2022-12-31,China December manufacturing contracts at sharpest pace in almost 3 years
2022-12-31,Nasdaq closes out its first four-quarter slump since dot-com crash
2022-12-31,Bitcoin still has a big opportunity in payments despite 60% drop this year and choppy ...
2022-12-31,"The S&P 500′s best and worst stocks of 2022, and where they will go from ..."
2022-12-31,"Investors intend to buy these tech stocks in 2023, CNBC survey shows"
2022-12-30,"Stocks making the biggest moves premarket: Shaw Communications, Li Auto, Southwest and others"
2022-12-30,"Stocks making the biggest moves midday: Netflix, Cal-Maine Foods, Southwest and more"
2022-12-30,Baird’s top stock picks for 2023 include Tesla and this favorite retailer
2022-12-29,"The Investing Club’s top 5 things to watch in the market Thursday: Stocks, oil, Tesla"
2022-12-29,Amazon lost half its value this year as tech stocks got crushed and recession fears ...
2022-12-29,Top analyst cuts Tesla price target while projecting it will ‘widen its lead’ in EVs
2022-12-29,"Stocks making the biggest moves premarket: Tesla, Cal-Maine, Southwest and others"
2022-12-29,Tesla or Rivian? The pros predict what 2023 will look like for the two stocks
2022-12-28,"The Investing Club’s top 5 things to watch in the market Wednesday: Equities, oil, China"
2022-12-28,"Tech stocks got whacked in 2022 — but one server maker soared almost 90%, beating ..."
2022-12-28,The fintech reckoning is upon us. Here’s what to expect next year
2022-12-28,"Stocks making the biggest moves premarket: Tesla, AMC, Southwest and others"
2022-12-28,"Tesla made headlines in 2022, but the top-performing auto stock had nothing to do with ..."
2022-12-28,Pro Picks: Watch all of Tuesday’s big stock calls on CNBC
2022-12-28,El S&P 500 cierra a la baja a medida que aumentan los rendimientos de los ...
2022-12-28,"Tesla’s stock is headed for its worst month, quarter and year on record"
2022-12-27,"The Investing Club’s top 5 things to watch in the market Tuesday: Stocks edge up, ..."
2022-12-27,IBM beat all its large-cap tech peers in 2022 as investors shunned growth for safety
2022-12-27,"Stocks making the biggest moves premarket: Southwest, Tesla, Peloton and others"
2022-12-24,"EV stocks face another turbulent year, but some names are set for big gains, analysts ..."
2022-12-24,Cramer warns investors not to repeat this year’s mistakes when it comes to tech stocks
2022-12-24,Investors play defense heading into final trading days of year but still hope for a ...
2022-12-24,"Analysts expect these Nasdaq stocks to rally in 2023, with some forecast to double"
2022-12-23,"Jim Cramer’s top 10 things to watch in the market Friday: Inflation, natural gas plunge, ..."
2022-12-23,"Stocks making the biggest moves premarket: Tesla, Nutanix, Meta and more"
2022-12-23,Dow cierra más de 300 puntos a la baja a medida que se reanuda la ...
2022-12-22,"New bill will force Twitter, TikTok and other social media platforms to increase transparency by ..."
2022-12-22,Pro Picks: Watch all of Wednesday’s big stock calls on CNBC
2022-12-22,"Semiconductor maker Micron announces 10% staff reduction, suspends bonuses"
2022-12-21,Jim Cramer’s top 10 things to watch in the market Wednesday: Santa coming? Nike pops.
2022-12-21,Elon Musk tries to explain why Tesla shares are tanking
2022-12-21,Wall Street’s ‘free lunch’? A simple holiday trade that tends to beat the market
2022-12-20,"Jim Cramer’s top 10 things to watch in the market Tuesday: Wells Fargo, 3M, Meta"
2022-12-20,"Here are Tuesday’s biggest analyst calls: Apple, Tesla, Hostess, Home Depot, Rivian, Netflix & more"
2022-12-20,Three stocks this week will give us a better idea about the overall earnings outlook
2022-12-20,Evercore ISI slashes Tesla target by $100 after stock fails at critical level
2022-12-20,Pro Picks: Watch all of Monday’s big stock calls on CNBC
2022-12-20,Amazon stock gives up last of its pandemic gains after almost 50% slump in 2022
2022-12-19,"Jim Cramer’s top 10 things to watch in the market Monday: Stocks, Elon Musk, Amazon"
2022-12-19,"Here are Monday’s biggest analyst calls: Tesla, Amazon, Netflix, Moderna, Nike, Coinbase & more"
2022-12-19,"Stocks making the biggest moves premarket: Aerojet Rocketdyne, Tesla, Mesa Air and others"
2022-12-19,"Oppenheimer downgrades Tesla, says Elon Musk’s handling of Twitter could hurt electric vehicle maker"
2022-12-19,Twitter says it will no longer allow ‘free promotion’ of other social media platforms
2022-12-18,FTX flameout showed investors bought crypto for the wrong reasons. Why most are hoping that’ll ...
2022-12-17,Rooftop solar: How homeowners should do the math on the climate change investment
2022-12-17,Musk says he will restore recently suspended journalists’ Twitter accounts
2022-12-16,EU threatens Elon Musk with sanctions after Twitter’s suspension of journalists
2022-12-16,California cuts payments to homeowners for solar panels feeding energy back to the grid
2022-12-15,"Here are Thursday’s biggest analyst calls: Tesla, Amazon, Nike, Nio, Verizon, Disney, Snap & more"
2022-12-15,"Stocks making the biggest moves premarket: Tesla, Warner Bros. Discovery, Lennar and more"
2022-12-15,Elon Musk sells another huge chunk of Tesla shares
2022-12-15,"Stocks making the biggest moves midday: SoFi Technologies, Charter Communications, Delta and more"
2022-12-14,"Jim Cramer’s top 10 things to watch in the market Wednesday: Fed day, crypto hearings, ..."
2022-12-14,Twitter suspends account dedicated to tracking Elon Musk’s private jet
2022-12-14,"Here are Wednesday’s biggest analyst calls: Tesla, Apple, Amazon, Exxon Mobil, Nike, Best Buy & ..."
2022-12-14,"Stocks making the biggest moves premarket: Delta, Tesla, Moderna and others"
2022-12-14,"Elon Musk says he can stop child exploitation on Twitter. So far, he’s axed jobs ..."
2022-12-13,"GM, Stellantis rank as worst automakers for fuel efficiency, even amid EV push, EPA says"
2022-12-13,"Twitter Blue relaunches, now costs $11 per month if you subscribe from an iPhone"
2022-12-10,"Stocks making the biggest moves midday: Netflix, Lululemon, DocuSign and more"
2022-12-10,"Naughty list: 10 stocks to short into the end of the year, according to a ..."
2022-12-08,"ETFs tied to emerging markets, Tesla and inverse strategies are bucking a slowdown in trading ..."
2022-12-08,"Jim Cramer’s top 10 things to watch in the market Thursday: War cloud, Salesforce downgrade, ..."
2022-12-08,Is Apple a stock to buy or avoid? Two asset managers face off
2022-12-07,Jim Cramer’s top 10 things to watch in the market Wednesday: China reopening fails to ...
2022-12-06,Jack Dorsey’s Block backs bitcoin mining company that wants to bring 25-cent electricity to rural ...
2022-12-06,Ford CEO says 65% of U.S. dealers agree to sell EVs under company’s investment programs
2022-12-06,Las acciones terminan a la baja por preocupaciones de nuevas alzas de tasas de la ...
2022-12-06,Tax credits for EU electric vehicles to dominate U.S. trade talks
2022-12-05,"Here are Monday’s biggest analyst calls: Apple, Amazon, Tesla, Netflix, Coinbase, Costco, Etsy & more"
2022-12-05,"Tim Draper predicts bitcoin will reach $250,000 next year despite FTX collapse: ’The dam is ..."
2022-12-02,"Jim Cramer’s top 10 things to watch in the market Friday: Hot jobs, chip trouble, ..."
2022-12-02,Toyota secures funding to develop hydrogen fuel cell version of its Hilux pickup in the ...
2022-12-02,Why Silicon Valley is so hot on nuclear energy and what it means for the ...
2022-12-02,Elon Musk suspends Ye’s Twitter account after swastika post
2022-12-02,Ford CEO surprised by F-150 Lightning backup power popularity. It’s a game changer
2022-12-01,Tesla makes up 10% of the average retail portfolio as Main Street keeps faith in ...
2022-12-01,Elon Musk shows off updates to his brain chips and says he’s going to install ...
2022-12-01,It’s been a bad year for tech. But top investor Paul Meeks is betting on ...
2022-11-30,Elon Musk says the Fed must cut rates ‘immediately’ to stop a severe recession
2022-11-29,"Twitter stops policing Covid misinformation under CEO Elon Musk and reportedly restores 62,000 suspended accounts"
2022-11-29,"Here are Tuesday’s biggest analyst calls: Apple, Amazon, Tesla, Disney, Roku, Boeing, UPS & more"
2022-11-29,"Tesla’s valuation is looking more reasonable, but stock still isn’t a buy, Bernstein says"
2022-11-29,Elon Musk claims Apple has threatened to remove the Twitter app
2022-11-29,Beware of these stocks in your portfolio with the biggest China risks as Covid protests ...
2022-11-26,It’s about to be way easier to make a smart home. Here’s what you need ...
2022-11-25,Tech’s reality check: How the industry lost $7.4 trillion in one year
2022-11-25,"Stocks making the biggest moves premarket: Activision Blizzard, Tesla, Manchester United and others"
2022-11-25,CNBC Stock World Cup: LVMH vs. Exxon — who wins?
2022-11-24,CNBC Stock World Cup: SoftBank vs. BHP — who wins?
2022-11-24,Las acciones cierran más altos por segundo día mientras los minutos de la Reserva Federal ...
2022-11-23,"What the Club is watching Wednesday — Disney’s big China win, an iPhone warning, oil ..."
2022-11-23,Russia relaunches Soviet-era Moskvich car brand using a former Renault plant
2022-11-23,"Stocks making the biggest moves premarket: Deere, HP, Nordstrom and others"
2022-11-23,CNBC Stock World Cup: Nintendo vs. Visa — who wins?
2022-11-23,UBS says self-driving cars could become a $100 billion market in China — and names ...
2022-11-22,How AMD became a chip giant and leapfrogged Intel after years of playing catch-up
2022-11-22,CNBC Stock World Cup: Google vs. Disney — who wins?
2022-11-22,Bob Iger’s return may not boost Disney’s shares as market sends mixed signals to media ...
2022-11-21,Civil rights leaders condemn Musk decision to lift Trump Twitter ban
2022-11-21,CNBC Stock World Cup: Berkshire Hathaway vs Walmart — who wins?
2022-11-19,Informe CNBC: viernes 18 de noviembre
2022-11-18,"A year out from Nasdaq’s peak, it’s been brutal for tech stocks and the pain’s ..."
2022-11-18,CNBC Stock World Cup: JPMorgan vs Apple — who wins?
2022-11-17,"GM expects EV profits to be comparable to gas vehicles by 2025, years ahead of ..."
2022-11-17,CNBC Stock World Cup: Meta vs Nintendo and Walmart vs Home Depot — who wins?
2022-11-17,CNBC Stock World Cup: Berkshire Hathaway vs Reliance Industries — who wins?
2022-11-16,Elon Musk demands Twitter staff commit to ‘long hours’ or leave: Read the email
2022-11-15,"What the Club is watching Tuesday — more cooler inflation, Dow stock earnings, price target ..."
2022-11-15,CNBC Stock World Cup: Nvidia or TSMC — who wins?
2022-11-14,Twitter cuts a large number of contract workers without giving internal teams a heads up
2022-11-14,Sen. Ed Markey hits back at Elon Musk after his response to questions about impersonation
2022-11-13,"Ford vs. GM: Same industry, two increasingly different companies"
2022-11-12,"Elon Musk is now working out of Twitter headquarters, thanks employees for long hours"
2022-11-12,SpaceX shakes up Starship leadership in Texas as push for the rocket’s next milestone intensifies
2022-11-11,Cathie Wood’s Innovation ETF draws $1 billion despite a 60% loss. Here’s why investors are ...
2022-11-11,Twitter pauses paid verifications after users abuse service to impersonate brands and people
2022-11-11,Analysts love these EV-related stocks — and give one upside of more than 100%
2022-11-11,"El Dow aumenta casi 1,200 puntos, el S&P 500 salta un 5% en el repunte ..."
2022-11-10,"What Cramer is watching Thursday — cooler inflation, FTX crypto fallout, TJX upgrade"
2022-11-10,Elon Musk brainstorms plans for how payments could work on Twitter
2022-11-10,Here’s a rundown of tech companies that have announced layoffs in 2022
2022-11-10,"Tesla sinks to almost two-year low on Elon Musk stock sales, Twitter distraction"
2022-11-10,"Elon Musk reverses course, kills new ‘official’ designation for big-name tweeters"
2022-11-09,"Volvo reveals new $80,000 electric SUV with Luminar lidar"
2022-11-09,"What Cramer is watching Wednesday — Disney CEO must go, no Red wave, Meta job ..."
2022-11-09,"Stocks making the biggest moves premarket: Tesla, Meta, DR Horton and more"
2022-11-09,Want to play rising copper prices? Analysts give these 2 stocks more than 200% upside
2022-11-09,"Oreo maker Mondelez pulls ads off Twitter, citing hate speech, CEO says"
2022-11-09,"Stocks making the biggest moves midday: Lyft, Tripadvisor, Take-Two Interactive and more"
2022-11-08,Musk reportedly considers locking all of Twitter behind a paywall
2022-11-07,Barry Diller says Twitter is a toy for Elon Musk
2022-11-07,Elon Musk bans impersonation without parody label on Twitter raising questions about free speech commitment
2022-11-07,Morgan Stanley says this Tesla-supplying global battery material stock could soar by 81%
2022-11-05,Twitter co-founder Dorsey apologizes for growing the company ‘too quickly’ in wake of mass layoffs
2022-11-05,"Twitter cut more than 950 California employees after Elon Musk took over, WARN notice shows"
2022-11-05,Opinion: Ron Baron explains his investing philosophy with goal of doubling his money every 5 ...
2022-11-05,Civil rights leaders call for all advertisers to stop spending on Twitter
2022-11-04,Web inventor Tim Berners-Lee wants us to ‘ignore’ Web3: ’Web3 is not the web at ...
2022-11-04,Here’s how Twitter and Elon Musk can prevent racist ‘raids’ on the social network
2022-11-03,El Dow cierra 500 puntos más bajo mientras el Presidente Powell señala la intención de ...
2022-11-03,Twitter owner Elon Musk met with civil rights leaders Tuesday — here’s what happened
2022-11-03,Goldman says humanoid robots will be a $6 billion market in 10 years – How ...
2022-11-02,"What Cramer is watching Wednesday — Fed day, AMD signs of life, China hits Estee ..."
2022-11-02,EV battery firm Britishvolt averts immediate collapse with short-term funding
2022-11-02,Xpeng electric car deliveries drop in October to half of Nio’s
2022-11-02,Twitter reportedly limits employee access to content moderation tools as midterm election nears
2022-11-01,"This Chinese electric carmaker’s stock could rally by more than 260%, Citi says"
2022-11-01,"‘Hold your nose and sell’ to brace for a possible market downturn, Jim Cramer says"
2022-10-31,Stellantis says Jeep joint venture in China to file for bankruptcy
2022-10-30,The fear of missing out can be a killer for investors. Here’s how top-ranked financial ...
2022-10-29,Ukraine questions Twitter takeover amid precarious ties with Musk
2022-10-29,Twitter is now owned by Elon Musk — here’s a brief history from the app’s ...
2022-10-29,Elon Musk plans Twitter content moderation council as questions about Trump return loom
2022-10-29,Elon Musk’s first day owning Twitter leads to havoc and a possible hoax about layoffs
2022-10-28,EU official warns Musk he’ll have to ‘fly by our rules’ as he buys Twitter
2022-10-28,Is Exxon the new ‘FANG’? The value rotation is starting to look more real
2022-10-28,Earnings season is the first big test for single-stock ETFs after a slow start in ...
2022-10-28,Facebook used to be a Big Tech giant — now Meta isn’t even in the ...
2022-10-27,"Twitter ‘cannot become a free-for-all hellscape,’ Musk tells advertisers"
2022-10-27,Elon Musk carried a sink into Twitter on Wednesday as deal nears close
2022-10-26,Portfolio manager names 3 investing themes to back and what to buy in a choppy ...
2022-10-26,"Twitter is losing its most active users, internal documents show"
2022-10-26,"South Korea, U.S. in ‘intense conversation’ over EV tax credits, ambassador says"
2022-10-25,"Stocks making the biggest moves midday: Avis, Pinduoduo, Starbucks, Alibaba and more"
2022-10-25,Inflation is dominating the conversation on earnings calls. Here’s what execs are saying
2022-10-24,"Nio, BYD and other Chinese EV stocks fell sharply amid sell-off"
2022-10-24,Facebook and Google face skeptics on Wall Street this week amid digital ads collapse
2022-10-24,"Stocks making the biggest moves in the premarket: Tesla, WeWork, Alibaba and more"
2022-10-22,"Stocks making the biggest moves midday: Snap, American Express, Verizon, Twitter and more"
2022-10-21,"What Cramer is watching Friday — a new wild card for Musk and Twitter, more ..."
2022-10-21,Las acciones cierra más bajos por segundo día mientras los rendimientos del Tesoro continúan a ...
2022-10-20,"What Cramer is watching Thursday — Tesla slides, IBM surprises, Danaher rolls on"
2022-10-20,"Stocks making the biggest moves premarket: AT&T, American Airlines, Blackstone and more"
2022-10-20,Analysts are split over where Tesla goes from here after its latest quarterly results
2022-10-20,Hyundai says Biden’s new EV tax credit rules deal ‘astronomical’ blow to business
2022-10-20,Wall Street eyes auto industry earnings for signs of ‘demand destruction’
2022-10-19,"Here are Wednesday’s biggest analyst calls: Tesla, Netflix, Apple, Exxon, Robinhood, Alphabet & more"
2022-10-19,"Elon Musk’s SpaceX could spin off Starlink as public company by 2025, analysts predict"
2022-10-19,This stock market rally has some staying power but there’s one big obstacle
2022-10-18,"What Cramer is watching Tuesday — J&J beat, Salesforce gets an activist, stocks surge"
2022-10-18,Warren Buffett-backed BYD pops more than 5% after Chinese EV maker forecasts surging profits
2022-10-18,Dow cierra con un alza de 550 puntos a medida que las sólidas ganancias bancarias ...
2022-10-17,"Kanye West, who now goes by Ye, agrees to buy conservative social media platform Parler, ..."
2022-10-17,"Stellantis debuts pure-electric Jeep, pledges new target on energy self-sufficiency"
2022-10-16,Earnings playbook: How to trade a big week of results including Netflix and Goldman Sachs
2022-10-16,‘The hell with it’: Elon Musk tweets SpaceX will ‘keep funding Ukraine govt for free’ ...
2022-10-15,"The ‘bummer’ of the $7,500 electric vehicle tax credit: Its full value may be hard ..."
2022-10-15,Cramer’s week ahead: Take any chance to sell stocks during a busy week of earnings
2022-10-15,Dow cierra 400 puntos a la baja para terminar una semana volátil de operaciones
2022-10-15,"Investing Club: The week in review, the week ahead — Oct. 14, 2022"
2022-10-14,"Here are Friday’s biggest analyst calls: Micron, Tesla, Apple, Sunrun, Netflix, Delta, Amazon & more"
2022-10-14,"Wells Fargo cuts Tesla price target, cites rising interest rates"
2022-10-14,Musk says SpaceX cannot fund Starlink in Ukraine ‘indefinitely’ after report he asked Pentagon to ...
2022-10-14,Sony and Honda plan to start U.S. deliveries of their electric vehicle in 2026
2022-10-14,Twitter seeking documents related to federal investigation of Elon Musk
2022-10-14,Don’t let the volatility ‘scare you out of stocks’: Market veteran reveals what to buy ...
2022-10-13,Volkswagen to take 60% stake in $2 billion tech joint venture with China’s Horizon Robotics
2022-10-13,Goldman Sachs favors Tesla and another big automaker even during an economic slowdown
2022-10-13,"Polestar unveils a new $84,000 electric SUV it’s hoping will help cement its foothold in ..."
2022-10-12,"Former Google ads boss launches ‘Web3’ search startup with backing from Coinbase, top VCs"
2022-10-11,The software used in bitcoin mining is getting its first big makeover in more than ...
2022-10-11,Google selects Coinbase to take cloud payments with cryptocurrencies and will use its custody tool
2022-10-11,Lyft exec was wrong about driverless vehicles — but he still believes in their potential
2022-10-11,"GM is launching a new business to connect homes and businesses with EV chargers, energy ..."
2022-10-11,"Auto giant Stellantis looks to Australian materials, including nickel, for its EVs"
2022-10-10,Goldman says retail investors are near capitulation as they flood billions into cash
2022-10-10,Cramer: The worry over Big Tech is overblown. Here’s my view on each FAANG stock
2022-10-10,"Stocks making the biggest moves in the premarket: Ford, General Motors, Rivian and more"
2022-10-10,Musk’s proposal for China-Taiwan relations gets slammed: Our freedom is ‘not for sale’
2022-10-08,Evaluating when and how this bear market may end
2022-10-07,"U.S. stock market is taking hits, but we’re still doing better than the rest of ..."
2022-10-07,Here’s what Musk’s potential takeover of Twitter could mean for Trump
2022-10-07,"Tesla or Nvidia? One will dominate in A.I., analyst says, giving it 50% upside"
2022-10-06,"Here are Thursday’s biggest analyst calls: Apple, Tesla, Pinterest, Target, Verizon & more"
2022-10-06,"‘There’s lots to buy in China,’ fund manager says and names these 2 EV stocks"
2022-10-05,Banks financing Musk’s Twitter deal face hefty losses
2022-10-05,"Elon Musk, Twitter have yet to reach deal to end litigation — sources"
2022-10-05,Florida hedge fund could reap around $200 million from big arbitrage bet on Twitter
2022-10-05,Elon Musk’s plans for Twitter may take inspiration from Chinese super apps
2022-10-04,"What Cramer is watching Tuesday — October rally; Wall Street likes banks, mixed on tech"
2022-10-03,"What Cramer is watching Monday — back to 2020 on S&P 500, possible major OPEC+ ..."
2022-10-03,"Stocks making the biggest moves in the premarket: Credit Suisse, Tesla, Myovant Sciences and more"
2022-10-02,How John Deere plans to build a world of fully autonomous farming by 2030
2022-10-02,Here’s how Wall Street’s biggest investors performed during the third quarter’s extreme volatility
2022-10-02,Toyota CEO Akio Toyoda talks about why he isn’t all-in on EVs — and what ...
