Date,News Title
2024-05-09,A port-in-the-storm trade if the consumer continues to get pinched by rates and inflation
2024-05-09,Climate crisis brings high school friends together to back startups overlooked by other VCs
2024-05-09,Chinese EV maker Nio to launch its lower-priced brand Onvo on May 15
2024-05-09,"Megacap tech may be the ultimate ‘quality’ play in an uncertain economy, The ETF Store ..."
2024-05-09,"Wall Street analyst jumps to Disney’s defense — plus, why Broadcom is bucking the chip ..."
2024-05-08,Chinese officials reportedly welcome Tesla’s robotaxi tests
2024-05-08,"Justice Dept. examining if Tesla committed wire, securities fraud in self-driving claims: Reuters"
2024-05-08,"China would welcome Tesla’s robotaxi tests in the country, state media report says"
2024-05-08,"In Tesla Autopilot probe, U.S. prosecutors focus on securities, wire fraud, Reuters reports"
2024-05-08,Generative AI is speeding up human-like robot development. What that means for jobs
