Date,News Title
6/19/2018,"Stocks making the biggest moves premarket: VZ, TSLA, AAPL, WFC, T, SIRI & more"
6/30/2017,Loup’s Munster on Tesla’s ‘huge shift’ to autonomous
7/2/2018,"Stocks making the biggest moves in the premarket: DVMT, VMW, TSLA, KKR, FB & more"
7/6/2018,"Stocks making the biggest moves premarket: NOC, LMT, SATS, F, TSLA, BIIB, BA & more"
7/11/2018,"Stocks making the biggest moves premarket: FOXA, NFLX, PFE, GOOGL, TSLA & more"
7/20/2018,"Stocks making the biggest moves premarket: GE, HON, MSFT, CMCSA, TSLA & more"
8/2/2018,"Stocks making the biggest moves premarket: DWDP, TSLA, NKE, SBUX, YUM & more"
11/28/2023,"2023 was the auto industry’s year of EV investment, but consumers still prefer hybrids"
1/11/2024,GM’s McNeill on EV market: Headlines are disconnected from the data
1/11/2024,"Avoid these possible earnings blowups as reporting season begins, Wolfe Research says"
1/11/2024,Malaysia is doubling down on the chip industry to capture growth in EVs
1/11/2024,China’s EV stocks start 2024 in reverse gear as price wars pressure profitability
1/11/2024,Watch CNBC’s full interview with ARK Invest CEO Cathie Wood
1/11/2024,ARK Invest CEO Cathie Wood: We believe that bitcoin is a public good
1/11/2024,"ARK Invest CEO Cathie Wood: Our base case for bitcoin is $600,000, bull case $1.5 ..."
1/12/2024,Big Tech had a huge 2023. Why it may be time to part with some ...
1/13/2024,Jim Cramer compares NFL playoff teams to stock picks
3/5/2024,CNBC Daily Open: Will the Fed not cut rates in 2024?
3/5/2024,Here are the top AI picks for 2024 from Baird
3/6/2024,Dodge Charger will live on as a new EV and a gas-powered muscle car
3/6/2024,Musk’s OpenAI lawsuit is ‘good advertisement for the benefit of Elon Musk’ but may have ...
3/6/2024,5 things to know before the stock market opens Wednesday
3/7/2024,"Stocks making the biggest moves midday: CrowdStrike, Palantir, Super Micro Computer, Brown-Forman and more"
3/7/2024,"These 3 restaurant stocks are breaking out, according to the charts"
3/7/2024,Democrat Dean Phillips drops out of 2024 presidential race
