Date,News Title
2022-06-02,GM slashes prices of Chevy Bolt electric vehicles despite rising commodity costs
2022-06-01,Chinese electric car start-up WM Motor files to go public in Hong Kong
2022-06-01,Credit Suisse analysts believe better days are ahead for these cheap growth stocks
2022-05-27,"Here are Friday’s biggest analyst calls: Gap, Apple, Tesla, CVS, Citigroup, Ulta & more"
2022-05-27,"Stocks making the biggest moves midday: Twitter, Macy’s, Nvidia, Lululemon and more"
2022-05-26,"Twitter jumps after Musk increases commitment in takeover bid to $33.5 billion, in talks for ..."
2022-05-25,Booster is making renewable fuels accessible in ways a gas station cannot
2022-05-25,"Here are Wednesday’s biggest analyst calls: Tesla, Best Buy, Apple, Amazon, Air Products & more"
2022-05-25,Andreessen Horowitz raises $4.5 billion crypto fund to take advantage of bargains in down market
2022-05-25,"These ports are causing the most congestion in the global supply chain, new CNBC charts ..."
2022-05-24,"Here are Tuesday’s biggest analyst calls of the day: Apple, Roblox, DoorDash, Netflix, Disney & ..."
2022-05-21,"Stocks head for another potentially treacherous week, as a slew of retailers report earnings"
2022-05-20,The CEO of the world’s second-largest alternatives firm is optimistic about a light recession
2022-05-20,"What Cramer is watching Friday — China’s $5.3 trillion boost, beats by Palo Alto, Deere"
2022-05-20,Report says SpaceX paid woman over Musk sex misconduct claim – he denies ‘wild accusations’
2022-05-20,Best trades on CNBC Thursday: Pros on how to play this market downturn as the ...
2022-05-19,"What Cramer is watching Thursday — Cisco’s China problem, Kohl’s follows retailers down"
2022-05-18,EV battery costs could spike 22% by 2026 as raw material shortages drag on
2022-05-18,What Cramer is watching Wednesday — why Home Depot thrives while Target and Walmart stumble
2022-05-18,"Here are Wednesday’s biggest analyst calls: Netflix, Tesla, Visa, Warby Parker, Penn, Disney & more"
2022-05-18,"Expect a rally Wednesday if there’s good news from retail giants and China, Jim Cramer ..."
2022-05-18,Elon Musk calls on SEC to evaluate Twitter user numbers
2022-05-17,Options traders skeptical that Elon Musk’s Twitter deal will cross the finish line
2022-05-17,New filing reveals the full story behind Musk’s bid to buy Twitter
2022-05-17,What to watch today: Stock futures jump as two Dow stocks move in opposite directions
2022-05-17,"Here are Tuesday’s biggest analyst calls of the day: Rivian, Amazon, Apple, AMD, Maxar, Fisker ..."
2022-05-17,"Stocks making the biggest moves in the premarket: Walmart, Home Depot, Citigroup and more"
2022-05-17,The ETF flowdown: Loading up on commodities but not ditching bonds yet
2022-05-17,Michael Burry of ‘The Big Short’ reveals a bet against Apple
2022-05-17,How Carvana went from a Wall Street top pick to trading with meme stocks
2022-05-17,Twitter CEO explains how the company actually fights spambots in rebuttal to Musk
2022-05-17,"Stocks making the biggest moves midday: Spirit Airlines, Eli Lilly, Signature Bank and more"
2022-05-16,"Uber’s big new update lets you book party buses, electric vehicles and more — here’s ..."
2022-05-16,"What Cramer is watching Monday — McDonald’s is leaving Russia, China lockdowns slam tech"
2022-05-16,What to watch today: Dow set to open slightly higher after 7 straight weeks of ...
2022-05-16,"After the ‘hippie’ bus and the Beetle, VW has its eyes on America once again"
2022-05-16,"S&P 500 falls as market struggles to recover from multiple weeks of losses, Nasdaq down ..."
2022-05-15,How to buy stocks on the brink of a bear market
2022-05-15,Lithium’s vital role in the energy transition sends prices to record highs. How to play ...
2022-05-14,Twitter CEO expects Musk deal to close but is preparing for other scenarios
2022-05-13,Elon Musk can’t just walk away from his Twitter deal by paying a $1 billion ...
2022-05-13,"What Cramer is watching Friday — Elon saves Tesla, Cathie saves Coinbase, Sam saves Robinhood"
2022-05-13,What to watch today: Dow to pop after the 30-stock average’s six-session losing streak
2022-05-13,"Nasdaq pops 3%, Dow jumps 400 points in comeback rally following steep losses earlier in ..."
2022-05-12,MicroStrategy’s bitcoin bet looks shaky as crypto market encounters turbulence
2022-05-12,"Here are Thursday’s biggest analyst calls of the day: Tesla, Zoom, Beyond Meat, Ford, Disney ..."
2022-05-11,Toyota warns ‘unprecedented’ raw materials costs could cut profits by 20%
2022-05-11,"What Cramer is watching Wednesday — Coinbase collapse, peak inflation, Peloton’s cash burn"
2022-05-11,CNBC Pro Talks: Where one fund manager is putting his money during the market madness
2022-05-11,VW is looking to bring back the Scout brand as an electric vehicle
2022-05-11,Elon Musk says he would lift Twitter ban on Donald Trump after deal closes
2022-05-11,Here are five things investors can watch for signs of when to buy stocks again
2022-05-10,"Toyota to slash production plan, suspend some domestic operations due to Covid lockdown in China"
2022-05-10,What to watch today: Wall Street set to rise after S&P 500 hits lowest level ...
2022-05-10,Tech giants lost more than $1 trillion in value in the last three trading days
2022-05-10,Rivian reports earnings Wednesday. Here’s what we learned after 3 rivals reported last week
2022-05-10,Why Apple’s stock performance could decide when and where the market hits bottom
2022-05-09,"Dow falls more than 600 points, S&P 500 tumbles below 4,000 to the lowest level ..."
2022-05-07,Judge dismisses Trump lawsuit seeking to lift Twitter ban
2022-05-05,"Binance is backing Elon Musk’s Twitter bid, boosting crypto believers’ vision of a ‘decentralized’ web"
2022-05-05,Elon Musk secures over $7 billion in funding from investors including Larry Ellison
2022-05-05,Op-ed: Stocks have been a horror show. Here’s how to tell when the market is ...
2022-05-04,Here’s what a former Twitter engineering head thinks about Elon Musk’s plan
2022-05-04,"The Salton Sea could produce the world’s greenest lithium, if new extraction technologies work"
2022-05-04,"What to watch today: Wall Street set to rise ahead of Fed decision, after weaker ..."
2022-05-04,Elon Musk invited to discuss $44 billion Twitter deal in UK Parliament
2022-05-04,Fund manager believes FAANG is dead — says now it’s all about MANTA
2022-05-04,"These ETFs offer protection to investors worried about a recession, Citi says"
2022-05-03,Chrysler parent Stellantis plans $2.8 billion overhaul of two Canadian factories to build EVs
2022-04-30,"Robotaxis haven’t taken over the streets, but that doesn’t mean self-driving cars are all hype"
2022-04-30,China factory activity contracts in April at steeper pace as lockdowns bite
2022-04-30,FAA delays environmental review of SpaceX’s Starship launches from Texas for a fourth time
2022-04-30,"Stocks making the biggest moves midday: Amazon, Verisign, Honeywell and more"
2022-04-29,What to watch today: Tech pressures Wall Street premarket; data shows inflation still high
2022-04-29,The market just posted an unhealthy AOL-Time Warner bubble comparison
2022-04-29,Chinese leaders stick to Covid controls as the virus spreads and forces a Beijing luxury ...
2022-04-29,Elon Musk sold around $8.4 billion worth of Tesla shares this week as he moved ...
2022-04-29,Elon Musk will be the most indebted CEO in America if the Twitter deal goes ...
2022-04-28,"From $10,000 to $2 million: This 27-year-old entrepreneur shares how she did it"
2022-04-28,Musk is not supposed to disparage Twitter while trying to buy it. He’s doing it ...
2022-04-27,"What Cramer is watching Wednesday — Microsoft nearly flawless, Chipotle best in show"
2022-04-27,What to watch today: Wall Street to open higher after Nasdaq’s nearly 4% plunge
2022-04-27,Twitter says mass deactivations after Musk news were ‘organic’
2022-04-27,Elon Musk will owe Twitter $1 billion if he can’t secure financing
2022-04-26,"Musk’s Twitter takeover may boost Facebook, Google and Snap ad revenues"
2022-04-26,Elon Musk’s Twitter takeover sets him on a collision course with Europe
2022-04-26,What to watch today: Stock futures fail to follow through on Wall Street’s comeback
2022-04-26,"Nasdaq loses nearly 4%, hits fresh low for 2022"
2022-04-26,Donald Trump says he won’t return to Twitter if Elon Musk reverses ban
2022-04-26,What a Musk Twitter acquisition could mean for the social media stocks that are left
2022-04-25,Ford beefs up F-150 Lightning production in a forceful bid to dominate the electric pickup ...
2022-04-25,"Twitter may want to finalize Musk deal before reporting disappointing quarter, analysts speculate"
2022-04-25,What Cramer is watching Monday — the 3 things driving the global sell-off in stocks
2022-04-25,GM says it will produce electric Chevrolet Corvettes
2022-04-25,What to watch today: Wall Street set to open lower after Friday’s sharp declines
2022-04-25,Twitter shares rise as company announces it approved Musk’s $44 billion acquisition bid
2022-04-23,Almost none of the Berkshire Hathaway analysts recommend buying the conglomerate’s stock
2022-04-23,Morgan Stanley theorizes how Elon Musk’s tunnel company will one day work together with Tesla
2022-04-22,House Republicans demand Twitter’s board preserve all records about Musk’s bid to buy the company
2022-04-22,Fintech giant Stripe jumps into crypto with a feature that lets Twitter users get paid ...
2022-04-22,"Many factory workers in Shanghai can’t get back to work, even after Covid controls ease"
2022-04-22,"Santoli: Market is indecisive as traders weigh good-enough earnings, Powell evoking Volcker"
2022-04-21,We’re bulking up on this health insurance stock that we added recently from our watch ...
2022-04-21,"What Cramer is watching Thursday — Tesla up big, airlines bounce back, Disney’s dilemma"
2022-04-21,"Musk to explore potential tender offer for Twitter, has $46.5B in committed financing for deal"
2022-04-21,"Here are Thursday’s biggest analyst calls of the day: Tesla, Exxon, Coinbase, Apple, Amazon & ..."
2022-04-21,Michael Saylor says investing in MicroStrategy is the closest you’ll get to a bitcoin spot ...
2022-04-21,"Stocks making the biggest moves premarket: American Airlines, Blackstone, AT&T and more"
2022-04-21,Analysts call Tesla a ‘must own’ and ‘core holding’ following blowout first-quarter earnings
2022-04-21,European stocks close higher as traders track earnings and Ukraine developments
2022-04-20,What to watch today: Wall Street looks higher despite Netflix’s stock plunge
2022-04-20,Op-ed: U.S. Democrats press Congress to pass China tech competition bill to create jobs and ...
2022-04-20,"BMW adds an electric i7 sedan to its flagship 7-Series lineup, starting at $119,300"
2022-04-20,What is ‘Web3’? Here’s the vision for the future of the internet from the man ...
2022-04-20,"Dow jumps 249 points on Wednesday, but the Nasdaq is dragged down by a big ..."
2022-04-19,"Elon Musk buying Twitter could have ‘grave implications’ for civil rights, says Urban League"
2022-04-19,Faber: It seems unlikely anyone will bid against Musk to take Twitter private
2022-04-19,Mercedes-Benz unveils its new electric EQS SUV built in the U.S.
2022-04-19,"Apollo Global Management is willing to finance a Twitter buyout, sources say"
2022-04-18,Musk says Twitter board will be paid nothing if he acquires the company
2022-04-18,What the Investing Club is watching Monday — including Musk’s ‘Love Me Tender’ and BofA’s ...
2022-04-18,What to watch today: Stock futures fall as the 10-year Treasury yield tops a 3-year ...
2022-04-18,"Stocks making the biggest moves in the premarket: Twitter, Sirius XM, Nektar Therapeutics and more"
2022-04-18,Elon Musk tweet hints at possible tender offer to Twitter shareholders
2022-04-18,"Stocks fall slightly on Monday as investors brace for earnings reports, impact from higher rates"
2022-04-17,Top Wall Street analysts like these stocks for the long-run amid market jitters
2022-04-17,"Earnings playbook: Your guide to trading a huge week of reports from Tesla, Netflix and ..."
2022-04-17,"Shanghai targets lockdown turning point by Wednesday, sources say"
2022-04-17,China’s Covid policy locks down a city three times the size of New York
2022-04-16,Buyout firm Thoma Bravo approaches Twitter with acquisition interest
2022-04-15,"China’s lockdowns are a greater threat to inflation today than in 2020, Bernstein says"
2022-04-15,Cramer’s week ahead: Keep an eye on bonds and Ukraine as earnings season picks up
2022-04-15,"Investing Club: The week in review, the week ahead — April 14, 2022"
2022-04-15,"Despite inflation, consumers may be stronger than investors expect"
2022-04-15,Tesla shares dip after CEO Elon Musk makes bid to buy Twitter
2022-04-14,"Sell Twitter stock on this ‘full blown Elon circus,’ Stifel says"
2022-04-14,"What Cramer is watching Thursday — Musk’s takeover bid for Twitter, Morgan Stanley’s big beat"
2022-04-14,What to watch today: Stock futures are basically flat as major banks report earnings
2022-04-14,"Stocks making the biggest moves premarket: Twitter, Goldman Sachs, UnitedHealth and others"
2022-04-14,"S&P 500, Nasdaq fall Thursday, notch weekly losses as investors assess earnings, inflation"
2022-04-14,Making sense of the multiples approach to valuing stocks
2022-04-13,How Google plans to use 100% carbon-free energy in its data centers by 2030
2022-04-13,Twitter investors sue Elon Musk for failing to promptly disclose the size of his stake
2022-04-13,"Japanese car giant Honda targets EV expansion, earmarks billions for R&D"
2022-04-12,Bitcoin investors are more bullish than ever after big Miami conference dedicated to the cryptocurrency
2022-04-11,Musk backing off Twitter board opens door to hostile takeover
2022-04-11,"Investing Club: What Cramer is watching Monday — Musk backs off Twitter board, China lockdowns, ..."
2022-04-11,"Shopify plans a 10-for-1 stock split, eyes ‘founder share’ to protect CEO’s voting power"
2022-04-11,Twitter shares up at close after Elon Musk abandons plan to join board
2022-04-11,"Chinese electric car company Nio hikes prices, suspends production"
2022-04-11,Another Chinese city has overtaken New York for number of billionaires
2022-04-10,Elon Musk suggests people who subscribe to Twitter Blue should be able to pay with ...
2022-04-09,"‘We need batteries,’ says Morgan Stanley. Here are stocks to ride the capital spending boom"
2022-04-08,What to watch today: Stock futures lose steam as 10-year Treasury yield hits a three-year ...
2022-04-08,"Here are Friday’s biggest analyst calls of the day: Robinhood, UPS, HP, Peloton, Amazon & ..."
2022-04-08,"Dow climbs 100 points Friday, stocks post weekly losses after Fed comments"
2022-04-08,"Charts show stocks are at a pivotal point as spring comeback fades and earnings, rate ..."
2022-04-07,What to watch today: Wall Street looks steady after two days of Fed-driven selling
2022-04-07,These global stocks were first-quarter winners and Wall Street sees more upside ahead
2022-04-07,S&P 500 bounces back following two straight days of losses tied to Fed
2022-04-07,"CNBC Pro Talks: Investor Sarat Sethi shares long-term stock picks, talks ’growth at a reasonable ..."
2022-04-06,What to watch today: Stock futures sink in what would add to Tuesday’s drop on ...
2022-04-06,Twitter confirms it is testing edit button after Elon Musk polls followers
2022-04-06,"Stocks fall for a second day, Nasdaq slides another 2% as Fed gives policy tightening ..."
2022-04-06,"Stocks making the biggest moves midday: Twitter, Carnival, First Solar and more"
2022-04-05,There’s a new way to quickly send U.S. dollars around the world with bitcoin
2022-04-05,"Stocks making the biggest moves in the premarket: Carvana, First Solar, Generac and more"
2022-04-05,Jim Cramer on how 9 ‘pandemic plays’ that rallied Monday will perform going forward
2022-04-05,Elon Musk thumbs his nose at the SEC again with Twitter stake
2022-04-05,Electric and hybrid vehicles will account for nearly half the cars on the road by ...
2022-04-04,Tesla first-quarter deliveries miss Wall Street expectations slightly. Here’s what analysts think
2022-04-04,What Cramer is watching Monday — Musk takes big Twitter stake and Starbucks axes buybacks
2022-04-04,What to watch today: Wall Street looks higher; Twitter soars on Elon Musk stake
2022-04-04,"Stocks making the biggest moves in the premarket: Twitter, Tesla, Starbucks and more"
2022-04-04,"S&P 500 rises to start week, Nasdaq gains 1.9% on tech comeback"
2022-04-03,A new stablecoin issuer is buying billions of dollars in bitcoin. What crypto investors need ...
2022-04-01,"Morningstar cuts rating on Cathie Wood’s ARK Innovation ETF, cites ‘perilous approach’"
2022-04-01,Biden administration finalizes tougher fuel economy rules
2022-04-01,"Chinese EV players Xpeng, Nio and Li Auto see car deliveries surge in March"
2022-04-01,"Santoli: In late-March run-up, the S&P 500 has built up a cushion to soften a ..."
2022-03-31,"Investing Club: What Cramer is watching Thursday — April bounce, AMD downgrade, Apple streak ends"
2022-03-31,"Jim Cramer says to own secular stocks, approach cyclical names with skepticism"
2022-03-29,"Investing Club: What Cramer is watching Tuesday — new Russia-Ukraine talks, consumer staples hit"
2022-03-29,"Cathie Wood has been a magnet for criticism. She blames her contrarian views, not her ..."
2022-03-29,SEC charges Twilio engineers with insider trading during early days of pandemic
2022-03-29,Goldman says retail investors are buying this market dip. Here are their favorite stocks
2022-03-28,Chinese EV maker Nio delivers its first ET7 electric sedans
2022-03-28,"Monday, Mar. 28, 2022: Jim Cramer on AMC, AAPL, AMD, and other stocks"
2022-03-28,"Investing Club: What Cramer is watching — Apple cut, Tesla split, ‘war changes everything’ for ..."
2022-03-28,What to watch today: Wall Street looks steady after two-week winning streak
2022-03-28,"Here are Monday’s biggest analyst calls of the day: Apple, Tesla, Amazon, Roku, Roblox & ..."
2022-03-28,"Stocks making the biggest moves in the premarket: Tesla, Beyond Meat, Coinbase and more"
2022-03-28,China is shutting down Shanghai in two phases to control Covid
2022-03-26,Exxon is mining bitcoin in North Dakota as part of its plan to slash emissions
2022-03-26,"Stocks could take their cue from oil, inflation and interest rates in the week ahead"
2022-03-25,"Investing Club: What Cramer is watching Friday — ‘MANGO,’ pot stocks soar, homebuilders slump"
2022-03-25,Wall Street analysts say sustainable investing is being shaken up — and name the stocks ...
2022-03-25,Santoli: Traders eye a key level for the S&P 500 but hold off on trusting ...
2022-03-24,Electric vehicle start-up Nikola has begun production of its first battery-electric semitruck
2022-03-24,"Here’s why stocks can still go higher, even with the Fed’s aggressive rate-hiking stance"
2022-03-24,SpaceX raises prices for rocket launches and Starlink satellite internet as inflation hits raw materials
2022-03-24,Retail investors were big buyers of the post-Fed rally. What they are adding
2022-03-23,MacKenzie Scott donates $3.8 billion to 465 organizations
2022-03-23,"Crypto investor Katie Haun raises $1.5 billion, the largest debut fund ever by a female ..."
2022-03-22,"Tuesday, Mar. 22, 2022: Jim Cramer’s favorite financials right now"
2022-03-22,"Investing Club: What Cramer is watching Tuesday — Nike wows, nickel’s collapse, Nvidia investor day"
2022-03-22,What to watch today: Wall Street looks higher after breaking multiday win streaks
2022-03-22,"Ford F-150 Lightning’s 320-mile range beats available Rivian electric pickups, but lags GMC"
2022-03-22,"Stocks making the biggest moves midday: Boeing, Disney, Berkshire Hathaway and more"
2022-03-21,What to watch today: Wall Street looks relatively steady after best week since November 2020
2022-03-21,U.S. private equity giant pays $10.7 billion for SAP rival started in an English barn
2022-03-21,"Stocks making the biggest moves premarket: Boeing, Anaplan, Nielsen Holdings and more"
2022-03-19,Investors come off a strong week looking for more gains now that they have some ...
2022-03-17,China’s elevated Covid cases may not hit the economy as hard as feared
2022-03-16,"GM will begin production next week on the Cadillac Lyriq, the brand’s first EV model"
2022-03-15,Volkswagen says high demand is helping its EVs turn a profit sooner than expected
2022-03-15,"Investing Club: What Cramer is watching Tuesday — Russia-Ukraine talks, China shutdown crimps commodities"
2022-03-15,"What to watch today: Stock futures are higher, oil prices fall again"
2022-03-14,"What to watch today: Dow futures rise as Russia-Ukraine war, Fed stay in focus"
2022-03-14,"Ford to ramp up EV offering in Europe, plans major battery facility in Turkey"
2022-03-13,Wall Street’s top analysts are bullish on these stocks amid market volatility
2022-03-12,Ford to address dealer concerns about separating its EV and legacy businesses
2022-03-12,The high-beta five: These stocks may jump the most if the market bounces
2022-03-11,U.S. clears way for truly driverless vehicles without steering wheels
2022-03-11,Amazon stock has its second-best day of 2022 on planned 20-for-1 split
2022-03-11,BMW says 2021 profit surged as it favored higher-margin vehicles during chip shortage
2022-03-11,History shows Amazon could be the next tech stock to beat the market after its ...
2022-03-10,Here’s what investors should look for in Rivian’s quarterly results after the bell
2022-03-10,"Best trades on CNBC Wednesday: Dan Niles is holding 25% cash, but is still investing ..."
2022-03-10,Analyst picks his top global tech stocks to navigate Russia-Ukraine conflict
2022-03-10,S&P 500 falls on Thursday as stocks resume their downward move from Russia-Ukraine war
2022-03-10,"Amazon announces 20-for-1 stock split, $10 billion buyback"
2022-03-07,Aston Martin inks deal to develop EV batteries with UK start-up Britishvolt
2022-03-07,What to watch today: Dow futures cut sharp losses as $130 crude comes a bit ...
2022-03-05,How car safety became a major selling point
2022-03-04,What to watch today: Stock futures fall on Ukraine nuclear plant worries
2022-03-04,"Stocks making the biggest moves in the premarket: Tesla, Sweetgreen, Gap and more"
2022-03-04,Here’s why Ford didn’t spin off its electric vehicle business
2022-03-03,"Investing Club: What Cramer is watching Thursday — Putin’s unwinnable war, American Eagle flops, Chevron ..."
2022-03-03,"What to watch today: Wall Street looks steady, oil spikes to near 14-year highs"
2022-03-03,"Nasdaq drops 1.5%, Dow off nearly 100 points in choppy session as traders monitor Russia-Ukraine ..."
2022-03-03,Investing Club: Cramer calls Ford split the ‘destroy Tesla plan’ — here’s why he says ...
2022-03-02,"Ford plans to produce 2 million EVs annually, generate 10% operating profit by 2026"
2022-03-02,"Investing Club: What Cramer is watching Wednesday — oil producers’ next move, Ford splits, Salesforce ..."
2022-03-02,What to watch today: Wall Street set to bounce higher after Tuesday’s decline
2022-03-02,"Ukraine accepts dogecoin, other cryptocurrencies for donations as funding rises to $35 million"
2022-03-02,Ford will split EVs and legacy autos into separate units as it spends $50 billion ...
2022-03-01,"Jeep, Dodge maker Stellantis aims to double revenue to $335 billion by 2030"
2022-03-01,"Stocks making the biggest moves midday: Raytheon, Block, Tesla, Foot Locker and more"
2022-02-28,"Google, Facebook work to stop spread of Russian anti-Ukraine disinformation with new changes"
2022-02-28,Investing Club: What Cramer is watching Monday — oil stocks make headlines as Russia-Ukraine war ...
2022-02-28,"Bernstein’s Sacconaghi hikes price target on Tesla, but still sees 44% downside"
2022-02-28,Supreme Court takes up EPA’s power to limit greenhouse gas emissions
2022-02-28,"Dow falls 170 points, but Nasdaq rallies late for slight gain as investors monitor Ukraine ..."
2022-02-25,"Investing Club: What Cramer is watching Friday — Russia targets Kyiv, oil rolls over, Etsy ..."
2022-02-25,U.S. regulator probes 1.7 million Honda vehicles over unexpected braking complaints
2022-02-24,Ford CEO says automaker has no plans to spin off its electric vehicle business
2022-02-23,"Stocks look set to test January lows this week, chart analysts say"
2022-02-23,"What to watch today: Wall Street set to open higher, breaking a multiday losing streak"
2022-02-23,Crypto companies are tempting top talent away from Big Tech to build ‘Web3’
2022-02-23,"Jack Nicklaus, Justin Thomas team up to launch ultra luxury Florida golf community"
2022-02-23,"Dow closes at its lowest level of 2022 so far, S&P 500 drops further into ..."
2022-02-22,Toyota and Yamaha are developing a hydrogen-fueled V8 engine
2022-02-22,What to watch today: Stocks set to open lower on Wall Street but way off ...
2022-02-20,Chip shortage is forcing automakers to cut popular features
2022-02-18,Why the U.S. government plans to spend billions to keep money-losing nuclear plants open
2022-02-18,Cathie Wood says her innovation stocks are ‘way undervalued’ and recent fund losses temporary
2022-02-17,What to watch today: Stocks set to drop as Russia-Ukraine situation gets muddy again
2022-02-17,"Charlie Munger calls inflation the No. 1 danger apart from nuclear war, pans crypto and ..."
2022-02-17,Philippe Laffont’s Coatue bets big on Rivian and Pfizer during the fourth quarter
2022-02-17,"Expect a return to more ‘normal’ investing where stock picking is rewarded, Goldman Sachs says"
