Date,News Title
2022-10-01,Will Dodge’s electric muscle car satisfy its die-hard fans?
2022-10-01,Silicon Valley billionaires square off over support for Trump and the MAGA movement
2022-10-01,"Stocks making the biggest moves midday: Nike, Rent-A-Center, Carnival Cruise"
2022-09-30,"Here are Friday’s biggest analyst calls: Tesla, Nike, Generac, Microsoft, Disney, Micron & more"
2022-09-30,Jack Dorsey tried to get Elon Musk on Twitter’s board but directors were too ’risk ...
2022-09-30,"Apple downgrade sparks tech sell-off, sending Alphabet and Microsoft to one-year lows"
2022-09-29,"Here are Thursday’s biggest analyst calls: Apple, Exxon, Coinbase, Alphabet, Amazon, Marvell & more"
2022-09-29,"U.S., South Korea are working to ‘rectify the problems’ on EV subsidies, South Korea trade ..."
2022-09-27,Hertz is teaming up with oil giant BP to install thousands of EV chargers in ...
2022-09-27,China’s flood of new electric cars cost 20% more to insure than fuel-powered cars
2022-09-26,Asset manager says one FAANG stock looks ‘very attractive’ in the medium term
2022-09-24,Wall Street milestone: ETF popularity hits record number
2022-09-24,Feared stock market bottom retest is now underway
2022-09-24,Convertibles drive into the sunset as automakers invest in electric vehicles
2022-09-22,"Market’s retreat to June lows ‘might be faster than many anticipate,’ says BTIG"
2022-09-21,Want to play the EV sector? This lithium stock has jumped over 40% this year ...
2022-09-21,Higher rates are leaving investors around the world with nowhere to hide
2022-09-20,JPMorgan says this company could become a leader in autonomous vehicle technology
2022-09-20,Here’s Bret Taylor’s first big technical move at Salesforce since becoming co-CEO last year
2022-09-20,Crypto’s bear market is unlike others before it. This time the Fed’s steering the ship
2022-09-17,"Stocks making the biggest moves midday: FedEx, Adobe, Boeing and more"
2022-09-16,"Stocks making the biggest moves midday: Netflix, Adobe, Wynn Resorts, Humana and more"
2022-09-15,The one ESG issue that Americans agree isn’t politically polarizing
2022-09-15,"Here are Thursday’s biggest analyst calls: Tesla, Wynn, Netflix, Nordstrom, Marriott, Fisker & more"
2022-09-15,"What Cramer is watching Thursday — rail strike avoided, deluge of Club stock news, Putin-Xi ..."
2022-09-15,"Las acciones suben ligeramente el miércoles, luego de una venta masiva"
2022-09-14,Retail investors bought big during Tuesday’s sell-off. What’s on their buy list
2022-09-14,"Volvo starts series production of heavy-duty electric trucks, targets 50% of sales by 2030"
2022-09-14,"Cathie Wood still believes deflation is on the horizon, says the Fed is making a ..."
2022-09-13,"Here are Tuesday’s biggest analyst calls: Amazon, Apple, Dow, Chipotle, Tyson, Bank of America & ..."
2022-09-13,"Startup makes pre-fab high rises like Boeing makes airplanes, aiming to reduce emissions"
2022-09-12,"Some corporate titans are coming up short on supporting voting and democracy, watchdog report says"
2022-09-12,Twitter calls Elon Musk’s third attempt to scrap acquisition invalid ahead of key shareholder vote
2022-09-12,"Ford expands hands-free driving system to $40,000 Lincoln Corsair crossover"
2022-09-10,"Stocks making the biggest moves midday: Zscaler, DocuSign, Virgin Galactic, Kroger and more"
2022-09-08,"Biden’s climate change bill may produce your next job, and a half-million careers in all"
2022-09-08,"GM is betting on its electric Equinox, starting at $30,000, to kick-start ‘massive adoption’ of ..."
2022-09-07,Delaware court denies Musk request to delay Twitter trial but approves request to add whistleblower ...
2022-09-07,"As Elon Musk backs fossil fuels, one strategist sends a warning over EV sales"
2022-09-06,"What the Club is watching Tuesday — OPEC+ cuts output, banks downgraded, top industrial picks"
2022-09-06,"Tesla can surge 30% on Inflation Reduction Act, Wolfe Research says in upgrade to buy"
2022-09-06,Jim Cramer’s Guide to Investing: Principles to help you manage your portfolio
2022-09-03,Where’s the value? Weighing effective ETF strategies
2022-09-03,"You may qualify for over $10,000 in climate incentives from the Inflation Reduction Act. Here’s ..."
2022-09-02,"Here are Friday’s biggest analyst calls: AMC, Apple, Tesla, Bed Bath & Beyond, Nvidia, Exxon ..."
2022-09-02,Thursday’s losses bring the S&P 500 to a critical juncture that could signal what’s next ...
2022-09-02,Retail traders are rushing into Apple as they seek shelter after Powell’s ‘pain’ warning
2022-09-01,Chinese EV stocks tank after Li Auto and Xpeng report plunge in August deliveries; Nio ...
2022-09-01,Goldman Sachs says mutual funds have been on a tear this year. Here’s what they’re ...
2022-08-31,"Toyota pledges up to $5.6 billion for EV battery production, ramps up investment in North ..."
2022-08-31,Autonomous delivery company Gatik wins new pilot program with Pitney Bowes in Dallas
2022-08-30,Elon Musk cites whistleblower claims in latest effort to scrap Twitter deal
2022-08-29,Elon Musk says world still needs oil and gas
2022-08-27,Coming clean: Playing the sustainable energy transition
2022-08-26,"Ford hikes price of electric Mustang Mach-E by as much as $8,475 due to ‘significant’ ..."
2022-08-26,"Meta to debut new VR headset in October, Mark Zuckerberg tells Joe Rogan"
2022-08-24,Cathie Wood doubles down on Zoom after shares erase entire pandemic advance
2022-08-24,"Here are Wednesday’s biggest analyst calls of the day: Tesla, Amazon, Meta, Uber, Twitter & ..."
2022-08-24,"Shares of Tesla are too high despite tailwinds from latest climate bill, Bernstein says"
2022-08-24,Twitter whistleblower could help Musk by adding ‘volatility’ to legal battle
2022-08-24,Cramer’s lightning round: Nokia is ‘the definition of dead money’
2022-08-24,The comeback rally was halted at this key technical level almost to the exact tick
2022-08-23,"Cathie Wood makes smart trade in Signify Health, selling some after a 30% runup on ..."
2022-08-23,"Twitter whistleblower alleges execs misled board and public on spam, security"
2022-08-23,"Stocks making the biggest moves midday: AMC, Signify Health, Netflix and more"
2022-08-22,"Stocks making the biggest moves in the premarket: Signify Health, Bed Bath & Beyond, AMC ..."
2022-08-22,Cramer: 3 things need to happen to keep the Fed on a slow course to ...
2022-08-21,Single-stock ETFs have created new ways to bet on Tesla. Here’s what investors need to ...
2022-08-20,Motor City meets a new test in the EV transition: Keeping gearheads behind the wheel
2022-08-20,"Musk approaches brain chip startup Synchron about deal amid Neuralink delays, sources say"
2022-08-20,How China’s strict Covid policies led to supply chain bottlenecks
2022-08-20,How China’s Covid shutdowns keep hitting global supply chains
2022-08-19,"This is a ‘textbook’ bear market bounce that will fail, Bank of America says"
2022-08-19,"16 dead, 18 missing in flash flood in western China"
2022-08-19,‘Tactical trading vehicles’: The case for single-stock ETFs
2022-08-18,"The retail trader is back led by the meme gang, and these are their favorite ..."
2022-08-18,Top tech investor reveals why he thinks PayPal is a buy
2022-08-18,Frenzied trading in meme stocks is a warning sign for the broader market
2022-08-17,Manchester United shares briefly pop 17% in premarket after Elon Musk jokes about buying the ...
2022-08-17,Nuclear waste recycling startup wants to solve the ‘ball and chain’ problem holding back nuclear
2022-08-16,The U.S. supply chain is now facing two trade hurdles
2022-08-16,Apple reportedly lays off 100 contract recruiters after committing to hiring on a ‘deliberate basis’
2022-08-16,Dodge will discontinue its Challenger and Charger muscle cars next year
2022-08-16,"S&P 500 cierra al alza el lunes, aprovechando su racha ganadora de cuatro semanas"
2022-08-16,"Philippe Laffont’s Coatue shuffles tech bets in second quarter with big buys of Amazon, JD.com"
2022-08-15,Tesla hedging: New ETF gears up to attract hesitant investors
2022-08-13,Biden is set to sign the largest climate bill in history. These stocks could see ...
2022-08-13,Transportation Department is losing top auto safety regulator after a few months on the job
2022-08-12,Zoom investor tells startup founders: ‘Forget the past three years’ and accept 50% valuation hit
2022-08-11,"Here are Thursday’s biggest analyst calls of the day: Lowe’s, Tesla, Shopify, Amazon, Apple & ..."
2022-08-11,How the Inflation Reduction Act could impact our auto and drug stocks
2022-08-11,Ford CEO doesn’t expect electric vehicle battery costs to drop anytime soon
2022-08-10,How the EV tax credits in Democrats’ climate bill could hurt electric vehicle sales
2022-08-10,"Buying a car and want to go electric? Inflation Reduction Act extends $7,500 tax credit ..."
2022-08-10,"What Cramer is watching Wednesday — Musk sells more Tesla, plus a bunch of big ..."
2022-08-10,A wave of single stock and leveraged ETFs is coming — assessing the risks and ...
2022-08-10,"Stocks making the biggest moves premarket: Wendy’s, Coinbase, Buzzfeed and more"
2022-08-10,CNBC PRO Talks: Fund manager Paul Meeks on what’s next for the tech sector
2022-08-10,Elon Musk sells 7.92 million Tesla shares worth $6.88 billion
2022-08-10,Citi’s stocks to play the biggest themes of our time like automation and AI
2022-08-09,"Ford raises price of electric F-150 Lightning by up to $8,500 due to ‘significant’ battery ..."
2022-08-09,There are several pockets of strength in the market right now — and not just ...
2022-08-09,"Here are Tuesday’s biggest analyst calls: Bed Bath & Beyond, Tesla, Target, Netflix, Palantir & ..."
2022-08-09,Cramer’s week ahead: Hot inflation numbers could push Fed to raise rates in August
2022-08-09,How to invest behind the sweeping climate and health care package that could soon become ...
2022-08-08,"What Cramer is watching Monday — IRA lifts EV and solar stocks, Pfizer’s buy"
2022-08-08,The market’s biggest winners and losers in the Inflation Reduction Act
2022-08-07,Buffer or bet against? Here are some new strategies for single-stock ETFs
2022-08-07,"Albemarle blows past estimates as lithium prices stay elevated, CEO urges easier permitting process"
2022-08-05,Cramer’s lightning round: I like E.L.F Beauty over Coty
2022-08-05,"Job growth was likely strong in July, but it could slow in coming months with ..."
2022-08-04,Automakers press Senator Manchin for changes to EV tax credit proposal
2022-08-03,Asia markets mostly higher as investors monitor Pelosi’s visit to Taiwan
2022-08-03,These stocks are the key to the market going higher for the rest of the ...
2022-08-02,These are the companies racing to dominate the fragmented auto dealership industry
2022-08-02,How these companies are taking over the U.S. auto dealership industry
2022-08-02,Ford stock notches its best month since the Great Recession — and keeps rising
2022-07-30,Elon Musk and Twitter trial will start Oct. 17
2022-07-29,"Amazon, Apple, Google and Tesla have all done it. Here’s why companies split their stock"
2022-07-28,"Vietnam’s VinFast EV brand is new, unknown, and taking on the U.S."
2022-07-28,Pricing buoys Stellantis as fight for electric markets heats up
2022-07-28,"Bitcoin jumps above $23,000 as it attempts another rally following Fed rate hike"
2022-07-28,Self-driving start-up Pony.ai plans to mass produce robotrucks in China
2022-07-28,"Ford’s great quarter, dividend hike are why we’re willing to weather a tough year for ..."
2022-07-28,Cramer’s lightning round: Archer-Daniels-Midland is a buy
2022-07-27,These stocks won big after the last three Fed rate hikes
2022-07-27,Microsoft and Alphabet earnings are signaling one thing: A lot of bad news has been ...
2022-07-27,"What you need to know ahead of Ford’s earnings, especially after GM’s profit miss"
2022-07-27,China’s industrial profits bounce back in June as Covid curbs ease
2022-07-27,Wall Street pros think there’s more inflation pain ahead — and reveal how to trade ...
2022-07-27,Twitter to hold vote on Musk merger on Sept. 13
2022-07-27,Twitter says it significantly slowed hiring during the second quarter
2022-07-27,Apple’s earnings will give a peek into the mindset of the high-end consumer
2022-07-26,‘Huge’ cash generators: Analyst names the stocks to buy right now
2022-07-25,"What Cramer is watching Monday — Snap cuts, chip stock reset, financials slashed"
2022-07-25,Facebook’s stumbling ad business lies at the center of tech earnings week
2022-07-25,"Stocks making the biggest moves premarket: Newmont, Squarespace, Philips and more"
2022-07-22,"Twitter misses earnings expectations, partially blames revenue drop on Elon Musk takeover bid"
2022-07-22,"CEOs say they are raising prices, cutting costs as inflation dominates post-earnings conversations"
2022-07-22,Volkswagen-backed Northvolt to develop wood-based batteries for EVs
2022-07-22,Asia-Pacific markets mixed as inflation in Japan inches up
2022-07-22,"S&P 500 sheds nearly 1% Friday on Snap-led tech sell-off, but finishes higher on week"
2022-07-22,What Tesla’s bitcoin sale means for the crypto outlook
2022-07-22,3 takeaways from the Investing Club’s ‘Morning Meeting’ on Thursday
2022-07-21,"Thursday, July 21, 2022: Cramer and Marks on their largest stock position and why they ..."
2022-07-21,"Investors should buy these ‘deflation enablers’ to counter an inflationary era, Morgan Stanley says"
2022-07-21,"What Cramer is watching Thursday — Tesla crushes, Amazon buys and Ford upgraded"
2022-07-21,"Stocks making the biggest moves premarket: AT&T, DR Horton, Travelers and more"
2022-07-21,"Analysts react to Tesla’s latest earnings, break down what’s next for electric car maker"
2022-07-21,Toyota plans to roll out hydrogen fuel-cell trucks for the Japanese market next year
2022-07-21,Euro rises vs dollar after ECB hikes faster than flagged
2022-07-21,"Stocks making the biggest moves after hours: Carnival, United Airlines, Las Vegas Sands and more"
2022-07-21,Mattel inks deal with Elon Musk’s SpaceX to produce line of toys
2022-07-20,Morningstar reveals cheap stocks in the ‘overvalued’ oil sector — and says one is ’a ...
2022-07-20,"Stocks rise, fueled by tech rally, as all major averages touch highest since early June"
2022-07-20,"El Dow sube más de 750 puntos en un rebote, mientras los inversionistas apuestan que ..."
2022-07-20,Twitter-Musk trial on $44 billion deal set to begin in October after Musk loses effort ...
2022-07-19,"Here are Tuesday’s biggest analyst calls: Meta, Chipotle, Apple, Tesla, Exxon, Netflix, Sunrun & more"
2022-07-19,"GM reveals electric Chevrolet Blazer priced starting at $45,000"
2022-07-19,Dow rallies more than 750 points as traders bet that the bottom is in
2022-07-19,El Dow pierde más de 200 puntos en un retroceso al final del día
2022-07-19,"Comeback could get fuel from earnings before running into Fed turbulence again, chart analysts say"
2022-07-19,4 takeaways from the Investing Club’s ‘Morning Meeting’ on Monday
2022-07-18,"What Cramer is watching Monday — Delta’s big buy, solid bank results, the Micron effect"
2022-07-18,"Deutsche Bank downgrades General Motors, cites looming pricing risks to automakers"
2022-07-18,Microsoft president sees ‘new era’ of stagnating labor pool
2022-07-18,"Tesla’s bitcoin holdings could result in a $460 million hit for the carmaker, Barclays says"
2022-07-18,Dow sheds more than 200 points in late-day pullback as a busy week of earnings ...
2022-07-17,"These options plays can help investors navigate Big Tech earnings, UBS says"
2022-07-17,Earnings playbook: Netflix and Goldman Sachs headline a big week of corporate reports
2022-07-16,Investors bet on meat grown in a lab as interest in plant-based foods cools
2022-07-16,Here’s the earnings season headwind that could cue a sell-off
2022-07-16,Elon Musk asks court to reject Twitter’s request for speedy trial
2022-07-16,"Investing Club: The week in review, the week ahead — July 15, 2022"
2022-07-14,SEC letter to Musk questions tweet about Twitter acquisition
2022-07-14,"Here are Thursday’s biggest analyst calls: Tesla, Amazon, Twitter, Qualcomm, Costco, Apple & more"
2022-07-14,"Rosenblatt upgrades Twitter to buy, sees heightened leverage over Elon Musk"
2022-07-14,"Truist initiates coverage of Tesla with a buy rating and $1,000 price target"
2022-07-14,El Dow cae 200 puntos a medida que la inflación alcanza su nivel más alto ...
2022-07-13,Here are Twitter’s biggest accusations against Musk in its lawsuit
2022-07-13,CNBC PRO Talks: Morningstar’s chief U.S. strategist on stocks to beat the volatility
2022-07-13,"What Cramer is watching Wednesday — inflation soars, stocks tumble, yields and dollar pop"
2022-07-13,Canaccord Genuity says Rivian’s stock can double from here
2022-07-13,"Dow slides 200 points, stocks dip as inflation hits highest level since 1981"
2022-07-13,Twitter sues Elon Musk to enforce original merger agreement
2022-07-12,OnePlus co-founder makes smartphone comeback with a quirky iPhone competitor
2022-07-12,Chinese EV maker XPeng’s robotics arm raises $100 million to bring robots to households in ...
2022-07-12,El S&P 500 pierde un 1% y el Nasdaq rompe una racha vencedora de 5 ...
2022-07-12,Twitter says Musk’s request to terminate the deal is invalid
2022-07-12,"Prepare for the U.S. dollar hit on S&P 500, big tech earnings"
2022-07-11,Evercore ISI says these ‘gazumped growth growers’ could do well in a potentially tough earnings ...
2022-07-11,Twitter shares sink 11% after Elon Musk terminates $44 billion deal
2022-07-11,"S&P 500 loses 1%, Nasdaq breaks 5-day win streak ahead of earnings season"
2022-07-10,The economic case for EVs is getting better as gas prices surge
2022-07-10,"Mars, birth rates, but no Twitter: Elon Musk captivates Sun Valley moguls"
2022-07-09,Elon Musk has been expressing buyer’s remorse over Twitter for months
2022-07-09,Nasdaq sube por quinto día consecutivo después de un sólido informe de empleo mientras Wall ...
2022-07-08,Nasdaq rises for fifth-straight day after strong jobs report as Wall Street notches winning week
2022-07-07,"IBM, Netflix, and Disney are some of today’s stocks: Pro Market Movers July 6"
2022-07-07,CNBC Pro Talks: Tech investor Gene Munster on stock picks for the beaten-up sector
2022-07-06,Wall Street believes these beaten-down global stocks are set for a rebound
2022-07-06,"Stocks making the biggest moves midday: Oil stocks, Ford, Crocs and more"
2022-07-05,Why driving big rig trucks is a job fewer Americans dream about doing
2022-07-05,"What Cramer is watching Tuesday — Q3 stumble, crypto gutted, Tesla trepidation"
2022-07-05,"Stocks making the biggest moves premarket: Tesla, Occidental Petroleum, Exxon Mobil and more"
2022-07-05,"Jim Cramer: To understand this year’s vile market, study the dot-com crash of 2000"
2022-07-04,British Army’s Twitter and YouTube accounts hacked to promote cryptocurrency scams
2022-07-01,2022’s downturn is testing active equity ETFs. Find out if yours still belongs in a ...
2022-06-30,"What Cramer is watching Thursday — market terrible again, trying to price in a recession"
2022-06-30,"Stocks making the biggest moves midday: Bed Bath & Beyond, Carnival, Upstart and more"
2022-06-29,Goldman picks stocks poised to benefit from the multitrillion-dollar ESG opportunity ahead
2022-06-29,"What Cramer is watching Wednesday — mass chip price-target cuts, lots of C-suite changes"
2022-06-29,"Stocks making the biggest moves premarket: General Mills, Carnival, Bed Bath & Beyond and more"
2022-06-29,"Job loss is a ‘reality’ of the business cycle, says labor expert. Take these 6 ..."
2022-06-29,"New car quality declined sharply this year with supply chain problems, says J.D. Power"
2022-06-28,"Cathie Wood explains her bear market strategy, slashes portfolio to just 34 holdings"
2022-06-28,"What Cramer is watching Tuesday — Nike drops, Morgan Stanley pops, Goldman likes beer stocks"
2022-06-28,Siemens to invest in Volkswagen’s North American charging network
2022-06-28,Op-ed: Hiring freezes have started and job losses are coming. Take these 5 steps now ...
2022-06-27,Tencent wants to be foreign automakers’ go-to company for tech in China’s electric car market
2022-06-27,These global stocks look oversold — and analysts are expecting a rebound
2022-06-25,"Tech hiring slowdown not happening, recruiters say"
2022-06-24,Toyota issues recall for its flagship electric SUV following concerns about wheels coming off
2022-06-24,"What Cramer is watching Friday — Papa leaves Bausch board, Citi likes Microsoft"
2022-06-24,"‘Strong growth ahead’: Bank names its top EV battery stocks, giving one over 60% upside"
2022-06-23,Nikola founder Trevor Milton faces new federal fraud charge tied to ranch purchase
2022-06-23,"Morgan Stanley’s Jonas cuts Tesla price target, warns cars deliveries may fall short"
2022-06-22,U.S. regulators to propose new tougher vehicle emissions rules by March
2022-06-22,Best trades on CNBC Tuesday: How the pros are playing the big market bounce
2022-06-22,"Stocks making the biggest moves midday: Exxon Mobil, Alphabet, Kellogg, Charles Schwab and more"
2022-06-21,"Stocks making the biggest moves premarket: Kellogg, Lennar, Spirit Airlines and others"
2022-06-20,Volvo says it has started testing trucks with fuel cells powered by hydrogen
2022-06-18,"El S&P 500 subió ligeramente el viernes, pero aún así registró su peor semana desde ..."
2022-06-18,GM is raising the price of its electric Hummer starting this weekend
2022-06-17,SpaceX fires at least 5 employees over internal letter criticizing CEO Elon Musk
2022-06-17,"S&P 500 rises slightly Friday, but still posts worst week since 2020"
2022-06-17,"Dow pierde 700 puntos, cayendo por debajo de 30,000 — su nivel más bajo en ..."
2022-06-17,SpaceX employees denounce CEO Musk as ‘distraction’ in letter
2022-06-16,What to watch today: Wall Street set to plunge as post-Fed rate hike rally vanishes
2022-06-16,"Stocks making the biggest moves premarket: Jabil, Commercial Metals, Tesla and more"
2022-06-16,"Dow sinks 700 points, dropping back below 30,000 to the lowest level in more than ..."
2022-06-16,Las acciones subieron luego de que Powell declarará que la Fed mantendrá mano dura contra ...
2022-06-16,GM investing $81 million to hand build ultra-exclusive Cadillac Celestiq electric cars
2022-06-15,What Cramer is watching Wednesday — it’s go big or go home day for the ...
2022-06-15,"Here are Wednesday’s biggest analyst calls: Snowflake, Apple, Amazon, Nike, Robinhood, Rivian & more"
2022-06-15,"Stocks jump after Powell signals Fed will stay tough on inflation, Dow snaps 5-day slide"
2022-06-15,"S&P 500 cae por quinto día consecutivo, cayendo aún más en territorio de mercado bajista"
2022-06-14,What to watch today: Wall Street set to rise after S&P 500 officially closed in ...
2022-06-14,Coinbase lays off 18% of workforce as executives prepare for recession and ‘crypto winter’
2022-06-14,"S&P 500 falls for a fifth day, slips deeper into bear market territory ahead of ..."
2022-06-14,El S&P 500 cae casi un 4% a un nuevo mínimo del año
2022-06-13,"CEOs of GM, Ford and other automakers urge Congress to lift electric vehicle tax credit ..."
2022-06-13,What to watch today: S&P 500 poised to fall back into a bear market
2022-06-13,"Stocks making the biggest moves premarket: Coinbase, DocuSign, Microstrategy and more"
2022-06-13,"RBC upgrades Tesla to outperform, says automaker can fend off competition for years to come"
2022-06-13,"S&P 500 tumbles nearly 4% to new low for the year, closes in bear market ..."
2022-06-13,Cramer: 15 things I learned about the changing tech sector from my week in Silicon ...
2022-06-11,The biggest mall owner in the U.S. hopes to create a new sales holiday as ...
2022-06-10,"What Cramer is watching Friday — white-hot inflation, AMD gains, Devon makes a buy"
2022-06-09,"Here are Thursday’s biggest analyst calls of the day: Apple, Tesla, Take-Two, FedEx, Best Buy ..."
2022-06-09,"What Cramer is watching Thursday — Five Below sinks, Devon gets upgrades, restaurant stocks see ..."
2022-06-09,"Stocks making the biggest moves premarket: Target, Novavax, Nio and more"
2022-06-07,Elon Musk says an IPO of SpaceX’s Starlink satellite internet business is still 3 or ...
2022-06-06,"What Cramer is watching Monday — Eli Lilly’s big weekend, Apple event kicks off, AMD ..."
2022-06-06,Musk accuses Twitter of ‘resisting and thwarting’ his right to information on fake accounts
2022-06-06,What to watch today: Stocks set to bounce after Wall Street’s losing week
2022-06-04,Los principales índices registran pérdidas semanales - el Dow cae 300 puntos y el Nasdaq ...
2022-06-04,Best trades on CNBC Friday: Pros made these stock moves after more CEO warnings of ...
2022-06-04,Investors set their sights on upcoming inflation report as the bear market rally falters
2022-06-03,"What Cramer is watching Friday — a big call on Apple, Okta beats the shorts"
2022-06-03,"Stocks making the biggest moves premarket: Turning Point Therapeutics, Lululemon, RH and others"
2022-06-03,Cruise gets green light for commercial robotaxi service in San Francisco
2022-06-03,"Dow falls 300 points, Nasdaq drops 2%, as major indexes notch weekly losses"
2022-06-03,Dow sube 400 puntos y el Nasdaq suma más de 2% para terminar racha perdedora ...
2022-06-03,"Santoli: Stocks brush off Fed worries and Microsoft concerns, but the rally may soon face ..."
2022-06-02,Self-driving car companies’ first step to making money isn’t robotaxis
2022-06-02,"Dow jumps 400 points, Nasdaq adds more than 2% to cut two-day losing streak"
