Date,News Title
2024-05-19,China’s hot EV market is no longer focused solely on lower sticker prices. Which stocks ...
2024-05-18,How Toyota took on America’s trucks
2024-05-18,Mercedes-Benz workers in Alabama vote against UAW union membership
2024-05-18,Nvidia’s earnings will be in focus next week as stocks try to sustain record levels
2024-05-17,Here’s how critiquing Elon Musk’s pay package cost Charles Elson his consulting gig
2024-05-17,"As Tesla layoffs continue, here are 600 jobs the company cut in California"
2024-05-17,"Here are Friday’s biggest analyst calls: Nvidia, Tesla, Robinhood, Salesforce, Netflix, Roblox, Chevron, Walmart & ..."
2024-05-16,Japan’s Honda raises electrification investment to $65 billion through 2030
2024-05-16,"Stocks making biggest moves premarket: Under Armour, Walmart, AMC, GameStop, Canada Goose and more"
2024-05-16,"Here are Thursday’s biggest analyst calls: Nvidia, Netflix, Tesla, Intel, Robinhood & more"
