Date,News Title
2024-05-23,Elon Musk predicts smarter-than-humans AI in 2 years. The CEO of China’s Baidu says it’s ...
2024-05-23,Nvidia crushes sky-high expectations and charts continued AI-driven dominance for years to come
2024-05-23,Nvidia shows no signs of AI slowdown after over 400% increase in data center business
2024-05-23,Nvidia announces 10-for-1 stock split after AI-driven boom in share price
2024-05-23,"As S&P 500 reaches fresh highs, experts say generative artificial intelligence will create new investment ..."
2024-05-23,"Rollback in IRA’s EV incentives would benefit China, says GM board member"
2024-05-23,"Stocks making the biggest moves midday: Target, Urban Outfitters, Tesla, Shopify and more"
2024-05-23,GM all-electric Chevy Equinox goes on sale as the latest test for EV production and ...
2024-05-22,Why Tesla is losing share in Europe
2024-05-22,"Here are Wednesday’s biggest analyst calls: Nvidia, Meta, Tesla, Chipotle, Ferrari and more"
