Date,News Title
2022-02-16,Bill Gates and Chris Sacca invest in energy storage start-up Antora to help heavy industry ...
2022-02-16,"Investing Club: What Cramer is watching Wednesday — Wynn’s mixed quarter, Tesla’s ‘big bet,’ Airbnb’s ..."
2022-02-16,"Best trades on CNBC Tuesday: Pros’ stock picks as the market bounces, favorite retail names"
2022-02-16,"Viking Global makes big bets on Uber and Rivian, dumps Zoom Video and Netflix in ..."
2022-02-15,What to watch today: Stock futures jump after Russia says its pulling back some troops
2022-02-15,"Dow jumps 400 points and snaps 3-day losing streak, Nasdaq pops 2.5%"
2022-02-15,"The stock market has become more perilous, but there are ways for investors to play ..."
2022-02-15,"68% of investment execs don’t think clients should own crypto, survey finds"
2022-02-14,Investing Club: What Cramer is watching Monday — potential buys in this chaotic market
2022-02-12,"Elon Musk, defending the value of space travel, presents SpaceX’s Starship as the ‘holy grail’"
2022-02-11,Fund manager says he’s staying clear of EV makers — and names other ways to ...
2022-02-11,Senate passes bill ending forced arbitration in sexual misconduct cases
2022-02-11,Chinese EV maker Xpeng to open first retail store in Europe in biggest international push ...
2022-02-09,"Stocks outperform after share splits and more may follow Alphabet, Bank of America says"
2022-02-09,"What to watch today: Stocks set to continue Tuesday’s rally at the open, bond yields ..."
2022-02-09,Xpeng shares jump as much as 11% as EV maker is added to mainland China ...
2022-02-09,Facebook falls behind Nvidia in market cap and is now eighth most valuable U.S. company
2022-02-08,"Here are Tuesday’s biggest analyst calls of the day: Ferrari, Uber, Microsoft, Spotify, Lowe’s & ..."
2022-02-08,"What to watch today: Wall Street looks steady after an uncommon, quiet start to the ..."
2022-02-08,CNBC Pro Talks: Emerging markets fund manager Roderick Snell shares his winning strategies
2022-02-07,"Sequoia makes a big bet on Web3, leading $450 million investment in Polygon blockchain"
2022-02-07,Spotify CEO apologizes to staff for Joe Rogan controversy as episodes get removed
2022-02-07,Canada police seen getting tough as trucker protests continue
2022-02-06,"Thousands protest vaccine mandates in Canada, further fraying nerves"
2022-02-05,Cutting-edge gallium nitride tech could help EVs charge three times faster
2022-02-04,Chip giants are ramping up spending by the billions as semiconductor demand booms
2022-02-04,Facebook’s $232 billion fall sets record for largest one-day value drop in stock market history
2022-02-04,"Alpha is back with most hedge funds outperforming in January, Bank of America says"
2022-02-03,"Retail investors are buying the January dip in force, especially these four stocks"
2022-02-03,Op-ed: Here’s how investors who lost their mojo in 2021 can get back in sync ...
2022-02-02,Cramer says he likes most of the Ark Innovation ETF’s top holdings after growth stock ...
2022-02-02,Ford reportedly plans to increase EV spending by up to $20 billion
2022-02-02,Alphabet reports big fourth-quarter beat; stock pops
2022-02-01,What to watch today: Wall Street looks to start new month steady after terrible January
2022-01-31,Investing Club: What Cramer is watching Monday — The Fed guessing game is hurting the ...
2022-01-31,"Stocks rally to end a dismal January, but S&P 500 still posts worst month since ..."
2022-01-30,"Earnings playbook: An investor’s guide to reports from Alphabet, Amazon, Meta and more"
2022-01-29,Why electric vehicle fires are so challenging
2022-01-29,Tech’s big Friday rally helps Nasdaq avoid first five-week losing streak since 2012
2022-01-28,"Here are Friday’s biggest analyst calls of the day: Walmart, Apple, Tesla, Goldman Sachs & ..."
2022-01-28,Jim Cramer says the SARK ETF is trying to benefit from the struggles of high-growth ...
2022-01-28,Kelly Evans: Where the strength is in this market
2022-01-28,The fund that made $700 million on GameStop knew it was time to sell after ...
2022-01-27,Renault-Nissan to do more together in $26 billion electric bet
2022-01-27,EV car manufacturing jumps in the UK but overall production sinks to 65-year low
2022-01-27,Investing Club: What Cramer is watching Thursday — Behind the wild trading on Wall Street
2022-01-27,"What to watch today: Stock futures turn positive, reversing big overnight losses"
2022-01-27,OpenAI co-founder Sam Altman ridicules start-up fundraising process
2022-01-27,"Stocks making the biggest moves premarket: McDonald’s, Blackstone, Netflix and others"
2022-01-27,Beaten-down cloud software stocks get boost as ServiceNow and Qualtrics top estimates
2022-01-27,"S&P 500 closes lower, gives up earlier gains as volatility continues"
2022-01-27,"Goldman says buy these beaten-up innovative stocks, with some down 50%"
2022-01-26,What to watch today: Stocks set to jump at open as Wall Street’s wild swings ...
2022-01-26,Goldman Sachs has some new ESG stock picks to cut through the noise
2022-01-26,"‘Take a chill pill, stay long’ — Anthony Scaramucci says bitcoin’s recent plunge won’t last"
2022-01-26,"Stocks making the biggest moves midday: American Express, General Electric, IBM and more"
2022-01-25,Best trades on CNBC Monday: Jim Cramer on why beaten-down stocks like DocuSign have growth ...
2022-01-25,Here’s why one solar industry veteran is betting big on clean hydrogen
2022-01-25,"Stocks making the biggest moves midday: Netflix, Kohl’s, Wynn Resorts, General Motors and more"
2022-01-23,Top Wall Street analysts are bullish on these stocks heading into earnings
2022-01-23,"Earnings playbook: A complete guide to this week’s reports, including the first of tech"
2022-01-23,"Lithium hits record in EV boom, spurring a ‘land grab’ among miners. These stocks could ..."
2022-01-22,Cramer’s Investing Club: Stocks sink this week ahead of Big Tech earnings next
2022-01-22,Amazon stock just had its worst week since 2018
2022-01-21,Taxes on stock trades may surprise new investors
2022-01-20,"Jefferies downgrades Ford to hold, says it’s too early for stock to trade like an ..."
2022-01-20,"Dow falls 300 points, gives up earlier gains as Wall Street’s struggles persist"
2022-01-20,Three former SpaceX engineers are designing self-powered electric freight train cars
2022-01-19,Investing Club: What Jim Cramer is watching Wednesday — Some buying opportunities developing
2022-01-19,The world is hungry for lithium. Geothermal energy could transform how it’s sourced
2022-01-19,"Larry Fink says the next 1,000 unicorns will be green energy companies"
2022-01-18,"Autonomous driving start-up Wayve bags $200 million from Microsoft, Virgin and Baillie Gifford"
2022-01-18,"Dow drops 540 points, Nasdaq falls 2.6% as 10-year yield rises to 2-year high"
2022-01-17,Ford signs five-year payments deal with Stripe for e-commerce drive
2022-01-17,Morgan Stanley thinks time spent in cars will jump by 25% by 2030 and these ...
2022-01-17,Hedge fund manager says Ark ETF stocks are a potential ‘time bomb’
2022-01-16,Bitcoin millionaires are moving to Puerto Rico for lower taxes and island living
2022-01-14,What to watch today: Stocks set to drop as Dow stock JPMorgan falls after quarterly ...
2022-01-14,"Bill Miller’s personal portfolio had a banner year thanks to his bitcoin craze, but his ..."
2022-01-14,"Santoli: Energy and banks roar to start the year, but are they due for a ..."
2022-01-14,Ford’s market cap tops $100 billion for first time ever
2022-01-13,Op-ed: These big names propelled the S&P 500 last year. Here’s what’s ahead for 2022
2022-01-13,"Here are Thursday’s biggest analyst calls of the day: Tesla, Apple, SolarEdge, Netflix, Target & ..."
2022-01-13,"Hedge fund manager gives tips for trading Apple, other Big Tech stocks right now"
2022-01-13,"Dow falls nearly 200 points, Nasdaq snaps three-day winning streak as tech rally stumbles"
2022-01-13,CNBC PRO Talks: Top hedge fund manager David Neuhauser shares his investment insight and top ...
2022-01-12,Investing Club: What Jim Cramer is watching Wednesday — Did Powell outwit the critics?
2022-01-12,"Stocks rise, Nasdaq gains for third straight day despite red-hot inflation report"
2022-01-12,"Stocks making the biggest moves midday: General Electric, Rivian, Illumina and more"
2022-01-11,"Investing Club: What Jim Cramer is watching Tuesday, including big calls on Apple and IBM"
2022-01-10,"Nasdaq rallies on Monday afternoon to snap losing streak, erasing loss of more than 2%"
2022-01-09,Wall Street’s top analysts like these stocks for the long term as a new year ...
2022-01-07,Here’s how much money Apple CEO Tim Cook made in 2021
2022-01-07,Berkshire Hathaway is breaking out and may be on its way to becoming the next ...
2022-01-07,Sell-off in Cathie Wood’s ARK Innovation fund reached 48% at low point Thursday
2022-01-06,"Nasdaq falls for a third day as tech stocks struggle, Dow loses 170 points"
2022-01-06,"Best trades on CNBC Wednesday: Cramer on Alibaba, pros’ semiconductor and tech picks amid volatility"
2022-01-05,"Here are Wednesday’s biggest analyst calls: Apple, Tesla, Beyond Meat, Chevron, Boeing & more"
2022-01-05,"What to watch today: Stocks are set to dip at open after Dow’s record close, ..."
2022-01-05,"Stocks making the biggest moves premarket: Beyond Meat, Pfizer, Nikola and others"
2022-01-05,Sony looks to electric cars for its next big hit
2022-01-05,Morgan Stanley says a new type of battery will give EVs a boost — and ...
2022-01-05,Jim Cramer’s 2022 outlook for the best-performing Nasdaq 100 stocks last year
2022-01-04,"What to watch today: Dow, S&P 500 set to rise, one day after closing at ..."
2022-01-04,"Apple stock will continue to grow faster than the economy, investor says"
2022-01-04,Cramer says investors shouldn’t rule out another strong stock rally in 2022 after last year’s ...
2022-01-04,Ford beats out Tesla to become the auto industry’s top growth stock in 2021
2022-01-03,What Jim Cramer is watching Monday — Our investing mantra for 2022
2022-01-03,What to watch today: First trading day of 2022 looks to pick up where last ...
2022-01-03,"Stocks making the biggest moves in the premarket: Tesla, McDonald’s, Nio and more"
2021-12-31,"S&P 500 ends 2021 with a nearly 27% gain, but dips in final trading day"
2021-12-30,Wealthy millennial investors plan to sell stocks in 2022. Here’s why
2021-12-29,Battleground stocks: Analysts are most torn about GameStop and these other names heading into 2022
2021-12-29,"Stocks making the biggest moves premarket: Cal-Maine, Tesla, Alibaba and others"
2021-12-29,"Best trades on CNBC Tuesday: The pros favorite semiconductors, Big Tech, retail stocks and more"
2021-12-28,Nasdaq is poised to underperform S&P 500 for first time since 2016 as investors shun ...
2021-12-27,Alphabet was the top Big Tech stock of the year — here’s why
2021-12-26,Where four-legged robot dogs are finding work in a tight labor market
2021-12-24,Here are the top-performing technology stocks of 2021
2021-12-24,Three out-of-the-box ways to trade the rise of electric vehicles in 2022
2021-12-24,Jim Cramer’s stock market winners and losers for 2021
2021-12-24,"Best trades on CNBC Thursday: Cramer’s metaverse stock pick, the pros’ favorite transports, EV and ..."
2021-12-24,"Investing Club: Micron, Biden and Santa contribute to comeback — What to watch in the ..."
2021-12-24,"Stocks making the biggest moves midday: Nikola, Las Vegas Sands, Stitch Fix, Crocs and more"
2021-12-24,"Meme stocks, SPAC craze and a $100 million deli: It was a wild year in ..."
2021-12-23,What to watch today: Stock futures point to third straight day of gains
2021-12-23,Jack Dorsey blocked on Twitter by Marc Andreessen after Web3 comments
2021-12-23,"Stocks making the biggest moves premarket: Novavax, Tesla, JD.com Nikola and others"
2021-12-23,Wall Street analysts are backing these global stocks to beat Big Tech next year
2021-12-23,"Santoli’s Wednesday market notes: Market laggards get a boost this week, but will it stick ..."
2021-12-23,"Options trading activity hits record powered by retail investors, but most are playing a losing ..."
2021-12-22,What to watch today: Wall Street looks steady after breaking three-day losing streak
2021-12-22,"Here are Wednesday’s biggest analyst calls: Tesla, Salesforce, Coinbase, Apple, Rivian & more"
2021-12-22,"Stocks making the biggest moves premarket: CarMax, Tesla, BlackBerry and others"
2021-12-22,"Dow jumps 260 points, rising for a second day as investors look past omicron threat"
2021-12-21,SEC cracks down on SPAC claims as electric truck maker Nikola agrees to pay $125 ...
2021-12-21,"Best trades on CNBC Monday: Cramer’s key to buying this market, the pros love this ..."
2021-12-21,Informe CNBC: lunes 20 de diciembre
2021-12-21,"Santoli’s Monday market notes: Dip buyers shun big cap tech, stay-at-home stocks in latest sell-off"
2021-12-20,Investing Club: What Cramer is watching Monday — Time to get back into this reliable ...
2021-12-20,"Here are Monday’s biggest analyst calls of the day: Amazon, Apple, Nike, Disney, Peloton & ..."
2021-12-20,What to watch today: Dow futures sink on omicron concerns after rough week
2021-12-18,"Chinese electric car start-up Nio reveals a new sedan, augmented reality glasses"
2021-12-18,"Kickstarter, Discord and others are raving about ‘Web3.’ Their users give them a reality check"
2021-12-18,Asana CEO Moskovitz is buying the dip in his software company’s stock during a roller-coaster ...
2021-12-18,Cathie Wood stays the course as Ark Innovation loses a fifth of its value: ’Truth ...
2021-12-17,"GM to start shipping $113,000 electric Hummer pickups to customers"
2021-12-17,Rivian shares slide after company cuts 2021 EV production expectations
2021-12-16,"Best trades on CNBC Wednesday: Cramer’s health-care stock favorite, pros’ Big Tech Fed decision winners, ..."
2021-12-16,The IRS wants to know about your crypto transactions this tax season
2021-12-15,SEC Chair Gary Gensler wants stronger insider trading rules as executive stock sales hit records
2021-12-14,"What to watch today: Wall Street set to drop after hot inflation data, ahead of ..."
2021-12-14,"Stocks making the biggest moves premarket: GameStop, AMC, Beyond Meat and others"
2021-12-14,"Stocks fall ahead of key Fed decision, Nasdaq drops 1.1% as software names slide"
2021-12-13,"These are the best chip stocks to ride the auto industry’s EV race, Cowen says"
2021-12-13,"What Jim Cramer is watching Monday, including why being long is about to get tougher"
2021-12-12,The biggest bear on tech IPOs has no regrets about his bad calls: ’Crazy stuff ...
2021-12-12,Top Wall Street analysts are bullish on these stocks heading into the end of the ...
2021-12-11,Stocks head for a rare third-straight year of double-digit returns. What happens next?
2021-12-11,This new fund excludes certain industries that may harm people or the planet
2021-12-11,Santoli’s Friday market notes: Stocks shake off inflation data. Will seasonal tailwinds finally take indexes ...
2021-12-10,What to watch today: Wall Street set to open higher despite another hot inflation report
2021-12-10,GM CEO Mary Barra says electric Chevy Silverado will be ‘unmatched’
2021-12-09,"Investing Club: What Jim Cramer is watching Thursday, including Ford, Lucid and GameStop"
2021-12-09,What to watch today: Wall Street set for lower open after 3-day winning streak
2021-12-09,Top investment strategist sees ‘massive’ value in metals
2021-12-08,Beyond Meat taps Tyson Foods veterans as it prepares for fast-food growth next year
2021-12-08,Investors really bought the dip as stock inflows last week were the highest since 2017
2021-12-07,"What Jim Cramer is watching Tuesday, including the disappearance of the bozo sellers"
2021-12-07,What to watch today: Wall Street set to continue rally as omicron fears recede
2021-12-07,Elon Musk says ‘civilization is going to crumble’ if people don’t have more children
2021-12-07,"Stocks making the biggest moves premarket: American Airlines, AutoZone, GlaxoSmithKline and others"
2021-12-07,"Tech stocks lead the markets higher for a second day, Nasdaq notches its best day ..."
2021-12-07,Sell-off in risky tech stocks feels a lot like the 2000 bubble and may not ...
2021-12-06,"Major Wall Street firms including Goldman and JPMorgan initiate Rivian at neutral, citing sky-high valuation"
2021-12-06,"Dow jumps nearly 650 points, erasing last week’s losses as investors shake off omicron worries"
2021-12-04,"Bitcoin loses $10,000, or 17%, in 24 hours after overnight rout"
2021-12-04,All of the stocks in Cathie Wood’s Ark Innovation fund are in a bear market ...
2021-12-04,The worst-performing tech stocks this week suggest the U.S. is done with Covid lockdowns
2021-12-04,Santoli’s Friday market notes: Disruptive tech darlings implode as indexes put their lows to the ...
