Date,News Title
12/22/2020,"Tesla stock has ‘very strong signs of being overpriced and in a bubble,’ says researcher"
12/23/2020,"Tesla poised for correction after S&P inclusion, but it’s a long-term buy: Fund manager"
12/23/2020,Elon Musk says he tried to sell Tesla to Apple in 2018
12/23/2020,How Apple may have missed an opportunity to buy Tesla
12/30/2020,Former Ford CEO Mark Fields on what Tesla needs to focus on in 2021
1/1/2021,Why this investor doesn’t see the ‘luster’ coming off Tesla in 2021
1/1/2021,"Stocks making the biggest moves midday: Tesla, Western Digital, Enphase Energy and more"
1/4/2021,Tesla fell 450 vehicles short of sales target in 2020
1/4/2021,Cramer on Tesla shares rising following record deliveries in 2020
1/5/2021,Why Bernstein’s Toni Sacconaghi has an underperform rating on Tesla
1/5/2021,"Stocks making the biggest moves midday: Quantumscape, Tesla, Boeing, McDonald’s & more"
1/6/2021,Jim Cramer: There’s room for both Ford and Tesla
1/9/2021,Ally Invest’s Lindsey Bell on why Tesla is surging despite markets
1/13/2021,"Stocks making the biggest moves midday: Tesla, General Motors, Wells Fargo and more"
1/22/2021,Cramer’s lightning round: I like Tesla over Nio and expect a strong quarter for GoodRx
1/23/2021,"Trading Nation: Tesla, Apple set to report earnings next week"
1/24/2021,Germany’s motor transport authority investigating Tesla touchscreen failures
6/23/2021,Chinese Tesla rival Xpeng Motors to raise up to $2 billion in Hong Kong listing
6/25/2021,"Santoli’s Thursday market notes: S&P 500 trots to new highs, and the game is back ..."
6/25/2021,"Here are Friday’s biggest analyst calls of the day: Tesla, FedEx, Nike, Netflix, Uber & ..."
7/6/2021,"Here are Tuesday’s biggest analyst calls of the day: Tesla, Apple, Domino’s, Coinbase, Nvidia & ..."
7/7/2021,How Tesla’s stock has historically performed after releasing quarterly delivery numbers
7/13/2021,"Here are Tuesday’s biggest analyst calls of the day: Apple, Disney, Tesla, Microsoft, Boeing & ..."
7/15/2021,"Here are Thursday’s biggest analyst calls: Facebook, Apple, Netflix, Twitter, Tesla & more"
7/16/2021,Crypto exchange Binance stops selling digital versions of stocks like Tesla and Apple as regulators ...
7/23/2021,"Here’s what Tesla CEO Elon Musk said about crypto that drove up bitcoin, ethereum prices"
7/26/2021,Former Ford CEO on what he’s looking for in Tesla’s earnings report
7/27/2021,"What to look for in Tesla’s earnings, according to this analyst"
7/27/2021,"Stocks making the biggest moves midday: Tesla, Zoom, Hasbro, Philips and more"
7/27/2021,Tesla’s quality of earnings was poor: GLJ Research founder
7/27/2021,Jim Cramer: Tesla’s recent quarter lacked any ‘wizardry’
7/28/2021,"Here are Wednesday’s biggest analyst calls of the day: Amazon, Apple, Tesla, GE, MGM & ..."
3/2/2022,Cramer weighs in on Ford’s electric vehicle split: This is the ‘destroy Tesla’ plan
3/3/2022,"Paul Polman talks Tesla, ESG and climate"
3/10/2022,"Tesla, Marriott, and Disney are some of today’s stock picks: Pro Market Movers Mar. 9"
3/10/2022,Chinese Tesla rival Xpeng launches its mass market P5 electric car in Europe
3/11/2022,"Danielle Shay likes Tesla, Amazon, Microsoft, Airbnb and Cloudflare"
3/22/2022,"Here’s which car stock you should buy over Tesla in 2022, according to Metzler Research"
3/23/2022,"Steve Weiss buys Dick’s Sporting Goods, Moderna, Tesla"
3/23/2022,"Tesla, Nike, and JPMorgan are some of today’s stocks: Pro Market Movers Mar. 22"
3/23/2022,"Best trades on CNBC Tuesday: Pros on Tesla’s new Germany factory, Nike’s earnings, and ETF ..."
3/29/2022,"Tesla, AMD, and Chevron are some of today’s stock picks: Pro Market Movers Mar. 28"
3/29/2022,Best trades on CNBC Monday: Adam Jonas and other pros comment on Tesla’s potential stock ...
4/1/2022,"Tesla, Apple, and more: CNBC’s ‘Halftime Report’ traders answer your questions"
4/5/2022,"Tesla, Twitter, and Morgan Stanley are some of today’s stocks: Pro Market Movers April 4"
7/27/2021,Loup’s Gene Munster breaks down Tesla’s numbers
7/27/2021,A final look at Tesla’s earnings
1/5/2021,Tesla hits record high after delivering record number of vehicles in Q4
10/17/2023,"Final Trades: BIIB, XRT, TSLA & GILD"
2/27/2024,Hybrids lead Consumer Reports’ top 10 new vehicle picks
2/28/2024,"U.S. law on domestic abuse should cover carmakers, FCC chair says"
3/19/2024,Jim Cramer defends Elon Musk’s use of ketamine for depression: The CEO ’saved a lot ...
4/4/2024,Elon Musk and X sued by ex-Twitter GM Nick Caldwell over millions in unpaid severance
4/4/2024,CNBC Daily Open: Disney wins proxy showdown
4/4/2024,"Inside Alef Aeronautics, the company trying to build a car you can both drive and ..."
4/23/2019,"Elon Musk claims Tesla will have 1 million robotaxis on roads next year, but warns ..."
5/4/2019,Here’s the email Tesla sent employees telling them to stop leaking info
5/6/2019,Morgan Stanley: Tesla is going to need big China sales next year in order to ...
11/14/2019,Credit Suisse says Tesla is running out of time as the major electric car maker ...
11/19/2019,"Forget ‘Ford v Ferrari,’ the Mustang Mach-E takes a shot at Tesla"
11/21/2019,Amazon and Tesla are among Morgan Stanley’s top ‘secular growth’ ideas
11/22/2019,"Tesla unveils its first electric pickup, the Cybertruck, starting at $39,900"
11/22/2019,Tesla claimed its pickup truck was ‘bulletproof’ — then smashed its windows with a metal ...
11/22/2019,Wall Street analysts say Tesla’s pickup is ‘really weird’ and Ford can ’breathe a sigh ...
12/2/2019,Tesla has rallied 55% in the last 3 months—here’s where two investing pros would buy ...
2/14/2020,Tesla shares jump after a $2 billion stock offering—Here’s what could happen now
2/19/2020,"Piper Sandler hikes Tesla price target to $928, highest on Wall Street"
2/19/2020,"This stock is outdoing even Tesla this year, but traders have a warning"
2/19/2020,Forget Tesla. Wall Street has found a new favorite speculative stock as Virgin Galactic surges ...
2/20/2020,"Stocks making the biggest moves midday: Virgin Galactic, Tesla, Groupon, Blue Apron & more"
2/23/2020,This is who is actually challenging Tesla
2/23/2020,‘Tesla killers’ aren’t killing Tesla at all
2/25/2020,"Here are Tuesday’s biggest analyst calls of the day: Tesla, Micron, Nvidia & more"
3/3/2020,General Motors to provide in-depth look at its all-electric vehicle plans in bid to convince ...
3/6/2020,General Motors takes ‘shot across the bow’ at Tesla with new all-electric vehicles
3/10/2020,Elon Musk says Tesla has now produced 1 million electric vehicles
3/19/2020,"Tesla memo: Essential employees, including production, should still come to work"
3/25/2020,"Tesla and one other auto stock are good bets as the group rebounds, traders say"
4/3/2020,Chanos says he is still ‘maximum short’ Tesla even with drop in last month
4/6/2020,"Jefferies upgrades Tesla, predicts nearly 30% comeback and return to energy efficiency post crisis"
4/9/2020,"Tesla’s China sales hit record high in March, industry association says"
4/14/2020,"Tesla shares pop after Credit Suisse upgrades stock, says company will increase electric car lead"
5/1/2020,Elon Musk says stay-at-home orders ‘fascist’ in expletive-laced rant during Tesla earnings call
5/1/2020,Coronavirus could help Tesla retain EV lead as traditional automakers pare electric investments
5/9/2020,"Stocks making the biggest moves midday: Tesla, Uber, MGM Resorts & more"
5/12/2020,"Wish there would be less drama around Tesla and Elon Musk, analyst says"
5/12/2020,Cramer: Elon Musk is ‘dead right’ to reopen Tesla’s auto manufacturing plant in California
5/16/2020,Tesla considers building its next factory in Austin or Tulsa
5/27/2020,Tesla to cut car prices in North America and China
6/6/2020,"Tesla is headed to $1,000, trader says. Here’s one way to ride the rally"
6/9/2020,"Top Tesla investor bets flying taxis are the future, taking a stake in German start-up ..."
6/11/2020,GM’s Cruise hires former Tesla and Lucid engineer to lead safety
6/12/2020,"Here are Friday’s biggest analyst calls of the day: Tesla, Caterpillar, airlines & more"
6/16/2020,Tesla plans to use Glencore cobalt in new Gigafactories
6/18/2020,Glass Lewis joins ISS in opposing Tesla chairwoman’s re-election to board
6/18/2020,Ford launching new driver system to compete with Tesla’s Autopilot and GM’s Super Cruise
6/18/2020,"Jefferies says momentum is building in Tesla, nearly doubles forecast to a Wall Street high ..."
6/20/2020,Elon Musk tweets Tesla will have to postpone its annual shareholder meeting
6/30/2020,Tesla hits 10-year milestone. Here’s where it heads next
7/3/2020,Options traders set to cash in on Tesla’s big delivery beat
7/3/2020,"Tesla stock hits record high and smashes Wall Street expectations, plus everything else you missed ..."
7/6/2020,Tesla mocks short-sellers with a sale of red satin shorts
9/24/2020,Is Tesla stock overhyped? Here are both sides of the issue
9/25/2020,Options Action: Bullish bets on Tesla
9/29/2020,Spotify CEO backs Tesla rival after pledging to invest over $1 billion in European ‘moonshots’
10/2/2020,"Tesla Q3 deliveries 139,300 versus 136,350 estimated"
10/6/2020,"Chamath Palihapitiya on why stocks are headed higher, misunderstood Tesla, bitcoin and space mining"
10/8/2020,"Here are Thursday’s biggest analyst calls of the day: Tesla, Citi, Snowflake, Target, Roku & ..."
10/9/2020,Jon Najarian’s call of the day: Tesla
10/9/2020,Tesla upgraded to Buy at New Street
10/9/2020,"Tesla could be on its way to $500, trader says. How to play the stock ..."
10/19/2020,"Here are Monday’s biggest analyst calls of the day: Tesla, Hershey, RH & more"
10/21/2020,Options Action: Tesla earnings
10/22/2020,Why this Tesla analyst expects earnings to show improvement in margins
10/22/2020,Tesla beats on top and bottom line in Q3
10/22/2020,Fmr. Ford CEO: Tesla has to prove they have a sustainable business model
10/22/2020,"Stocks making the biggest moves after hours: Tesla, Peloton, Align & more"
10/22/2020,Analyst explains why his price target for Tesla is only one third of the current ...
10/22/2020,Tesla not stuck in ‘zero-sum game’ of electric transition: Jefferies
10/22/2020,Tesla bear reacts to what Elon Musk calls the company’s ‘best quarter in history’
10/22/2020,Tesla shares can go higher if you believe its more than just a car company: ...
10/22/2020,Why this analyst has an outperform rating on Tesla: ‘It’s about the process tech’
10/23/2020,Two traditional auto stocks are outpacing high-momentum Tesla shares this month
10/23/2020,"Jim Cramer on Tesla earnings: The doubters were wrong, the believers were right"
10/23/2020,"Here are Friday’s biggest analyst calls of the day: Virgin Galactic, Intel, Pfizer, Tesla & ..."
10/27/2020,Tesla could become an ecosystem to push software driven revenue: Morgan Stanley’s Jonas
11/7/2020,"The race between Tesla, GM, Rivian and others to dominate electric pickup trucks"
11/10/2020,Tesla provides refunds to some Model S and Model X owners over touchscreen
11/14/2020,Ford is ‘absolutely’ interested in producing EV batteries like Tesla and GM
11/17/2020,Tesla will join the S&P 500 effective prior to trading on Dec. 21
11/17/2020,What makes Tesla different from other auto companies?
11/17/2020,Jim Cramer on Tesla joining the S&P 500
11/18/2020,"Stocks making the biggest moves midday: Tesla, Walgreens, DraftKings, Square and more"
11/18/2020,"You can’t evade reality, it was only a matter of time for Tesla to be ..."
11/18/2020,Tesla to join the S&P 500 — two traders on what to do with the ...
11/18/2020,Why Tesla shares spiked after getting added to the S&P 500: CNBC After Hours
11/20/2020,"Stocks making the biggest moves midday: Shopify, L Brands, Tesla, GoPro & more"
11/20/2020,"Another 20% rally is in store for Tesla, trader predicts after his last money-making bet"
11/24/2020,Tesla tops $500 billion market value as shares hit all-time high
11/25/2020,"Stocks making the biggest moves midday: Tesla, Dollar Tree, Carnival, Best Buy and more"
4/28/2021,"Tesla’s strong Q1 earnings boosted by EV credits, bitcoin sale"
5/12/2021,Cramer on sales of Tesla’s made-in-China cars tumbling 27% in April
5/13/2021,Ford plans to launch technology for over-the-air upgrades to millions of cars — just like ...
5/14/2021,"Tesla’s Model Y slumps in China sales rankings, data shows"
5/14/2021,"Here are Friday’s biggest analyst calls of the day: Tesla, Zoom, Disney, Walmart, Target & ..."
5/25/2021,Tesla CEO Elon Musk says he talked to ‘North American bitcoin miners’ about sustainability
6/1/2021,China Tesla rival Nio sees deliveries fall in May as chip shortage bites
6/3/2021,Tesla’s dominance of China’s EV market could ‘dissipate’ as local manufacturers catch up: China Renaissance
6/11/2021,"Here are Friday’s biggest analyst calls of the day: Exxon, Apple, JPMorgan, Bed Bath & ..."
6/11/2021,Top analyst Toni Sacconaghi on his concerns about Tesla’s valuation
6/12/2021,Jay Leno tries to break record in Tesla’s new Model S Plaid on ’Jay Leno’s ...
6/14/2021,"Here are Monday’s biggest analyst calls of the day: Wendy’s, Microsoft, FedEx, Peloton, Tesla & ..."
1/24/2022,"Tesla has the ability to follow Amazon’s path, says Canaccord Genuity analyst"
1/25/2022,"Bitcoin, Zoom, and Tesla are some of today’s investments: Pro Market Movers Jan. 24"
1/28/2022,"Tesla, Apple, and Intel are some of today’s picks: Pro Market Movers Jan. 27"
1/28/2022,"TD Ameritrade chief strategist breaks down shares of Apple, Microsoft and Tesla"
1/29/2022,"Tesla, Apple, and Robinhood are some of today’s picks: Pro Market Movers Jan. 28"
1/31/2022,"Tesla investors are committed to the company for the long-term, says Interactive Brokers’ Peterffy"
2/3/2022,"Technology is where they are king, says Pete Najarian regarding Tesla"
2/4/2022,Volvo and Northvolt to build gigafactory in Sweden with a former Tesla exec in charge
2/9/2022,"Transportation Sec. Pete Buttigieg weighs in on Tesla, EV infrastructure"
2/16/2022,"Tesla, Chipotle, and Wynn are some of today’s stock picks: Pro Market Movers Feb. 15"
2/23/2022,From Tesla to Jeep: The end of 3G networks is a problem for millions of ...
2/24/2022,"Elon Musks says Biden administration ignores Tesla, wants seat at the table"
2/25/2022,Judge rejects Tesla CEO Elon Musk’s attempt to bring SEC before the court
1/26/2023,"Nasdaq closes 1.7% higher as Tesla pops, Dow adds 200 points"
3/6/2024,Elon Musk reportedly met with Donald Trump in Florida
3/18/2024,‘Find growth’: Strategist tells investors not to worry about high stock valuations
3/18/2024,"Stocks making the biggest moves premarket: Google, HashiCorp, Nvidia and more"
3/19/2024,"China’s BYD pushes into emerging markets amid policy uncertainty in the U.S., Europe"
3/19/2024,"China’s military, state media slam U.S. after report on SpaceX spy satellites"
4/3/2024,5 things to know before the stock market opens Wednesday
4/4/2024,"Stocks making the biggest moves midday: Intel, Spotify, Ulta Beauty and more"
1/23/2019,Tesla downgrade by RBC means more analysts on Wall Street have ‘sell’ ratings than ‘buy’ ...
4/24/2019,"Elon Musk sent a two-line email telling employees how great Tesla’s autonomy day was, but ..."
11/22/2019,"Watch Tesla unveil its electric pickup, Cybertruck, in a demo gone awry"
11/27/2019,"Cramer, outspoken about Tesla stock and Elon Musk, says he’s ready to buy his wife ..."
12/4/2019,Porsche attracting Tesla owners with all-electric Taycan sports car
12/6/2019,"Tesla cars built in China have been recommended for government subsidies, report says"
12/12/2019,Jim Cramer turns bullish on Tesla — ‘I’m a true believer’
12/20/2019,Here’s who’s actually putting down orders for Tesla’s Cybertruck
12/30/2019,Tesla delivers first China-made Model 3 sedans in just under a year
1/3/2020,"Stocks making the biggest moves midday: Tesla, AMD, Peloton Interactive, United Airlines & more"
1/7/2020,Elon Musk says will design a future Tesla car in China for global market
1/8/2020,"Tesla moves into China as shares double and market cap nears value of GM, Ford ..."
1/10/2020,"Chinese vehicle registration data shows big Tesla potential, Piper says as it hikes target by ..."
1/14/2020,"Stocks making the biggest moves midday: Tesla, Lululemon, General Electric, Nvidia & more"
1/14/2020,Past trends indicate Tesla shares have room to run beyond $500
1/14/2020,"Tesla is an ‘existential threat’ to automakers, says analyst with $612 price target"
1/23/2020,"Here are Thursday’s biggest analyst calls of the day: Tesla, General Electric, Micron & more"
2/3/2020,"Tesla jumps 19.9%, biggest one-day gain in 6 years"
2/4/2020,Ron Baron: Tesla could hit $1 trillion in revenue in 10 years
2/5/2020,"Elon Musk is as if ‘Thomas Edison and Henry Ford made a baby,’ analyst says ..."
2/5/2020,Tesla makes a run at biggest market ‘bubble’ ever
2/5/2020,Tesla climbs 14% in another monster session—here’s what Wall Street sees ahead
2/5/2020,Elon Musk asks Twitter fans to vote on new Tesla Gigafactory in Texas
2/10/2020,Tesla’s parabolic trading may be a warning about a broader stock market sell-off
2/11/2020,"Tesla Model 3 sales could be ‘cannibalized’ by Model Y crossover, Bernstein says"
2/14/2020,"Stocks making the biggest moves midday: Tesla, Equifax, Kraft Heinz, Cisco & more"
2/18/2020,Tesla’s biggest bull: Wall Street skepticism is ‘the best wall of worry’ I’ve experienced
2/19/2020,Here are the hedge funds making a killing on Tesla’s wild rally this year
2/21/2020,Tesla gets green light from German court to chop down trees for its new Gigafactory
2/22/2020,Free trading fuels rampant speculation in stocks like Tesla and Virgin Galactic
3/18/2020,"Tesla’s Fremont factory is still running after county orders ‘minimum basic operations’ only, says report"
3/24/2020,"Analysts upgraded a bunch of stocks as markets look for a rebound, including Nvidia, Tesla, ..."
3/28/2020,Tesla to slash 75% of staff at Nevada factory due to coronavirus
4/3/2020,Tesla pops on better-than-expected delivery numbers
4/14/2020,"Analysts are bullish on stocks like Tesla, Netflix and Zoom as earnings season gets underway"
4/15/2020,"Stocks making the biggest moves midday: Amazon, Roku, Tesla, JPMorgan and more"
7/21/2020,There are cracks in the Tesla story: CFRA senior equity analyst
7/21/2020,"Stocks making the biggest moves after hours: IBM, Moderna, Tesla and more"
7/22/2020,Why this analyst downgraded Tesla to ‘market perform’
7/22/2020,Options traders bet Tesla could add $75 billion in market cap by Friday
7/22/2020,"Tesla valuation might start to ‘shift’ when rivals launch electric models, analyst says"
7/23/2020,Former Ford CEO Mark Fields on what to expect from Tesla earnings
7/23/2020,Tesla joining the S&P 500 would mean prestige: WSJ’s Tim Higgins
7/23/2020,"Tesla beats on Q2 EPS, $2.18 adjusted vs. $0.03 expected"
7/23/2020,Tesla cruises past earnings and revenue expectations—Four experts on what they’re watching now
7/23/2020,"Tesla shares keep climbing, but a reversal could hit in fourth quarter: Barclays"
7/23/2020,"Tesla’s stock is decoupled from underlying fundementals, says CFRA’s Nelson"
7/23/2020,Kulina: You’re getting in front of a freight train with Tesla
7/23/2020,SEC Chair Clayton says he’s worried about short-term trading in stocks like Tesla
7/23/2020,Jim Cramer: Tesla CEO Elon Musk is a ‘big thinker’
7/25/2020,Why the complete version of Tesla Full Self-Driving will take longer than Elon Musk says ...
7/28/2020,"Here are the biggest analyst calls of the day: Shopify, Tesla, Alphabet & more"
7/31/2020,Chinese Tesla rival Xpeng Motors in talks over $300 million in funding ahead of U.S. ...
8/4/2020,Toni Sacconaghi on why his price target for Tesla is $900
8/5/2020,"The electric vehicle bubble, minus Tesla, has ‘started to burst,’ Jim Cramer says"
8/10/2020,Chinese Tesla rival Xpeng Motors files for New York IPO
8/11/2020,Wall Street is worried China will retaliate against companies like Apple and Tesla after TikTok ...
8/13/2020,Great idea Apple and Tesla split their stocks: JJ Kinahan
8/15/2020,"Stocks making the biggest moves midday: DraftKings, Tesla, Macy’s & more"
8/15/2020,BofA analyst on why he upgraded Tesla to neutral
8/18/2020,"Here’s why Morgan Stanley is raising its price target on Tesla to $1,360"
8/18/2020,Morgan Stanley’s Adam Jonas: Tesla has potential to be a large battery supplier
8/19/2020,"Three reasons why Tesla stock keeps rising, even without big headlines: CNBC After Hours"
8/21/2020,"Stocks making the biggest moves midday: L Brands, Estee Lauder, CureVac, Tesla & more"
8/21/2020,China Tesla rival Nio is up 240% this year and the company is revamping plans ...
8/21/2020,Tesla is worth more than Toyota and Volkswagon combined
8/22/2020,Tesla breaks through $2K but chartmaster says you should pump the brakes
8/24/2020,"‘I really can’t explain Tesla,’ says Gotham Asset’s Joel Greenblatt"
8/24/2020,Hightower’s Stephanie Link on record moves from Tesla and Apple
8/24/2020,Jim Cramer: Tesla is the ‘greatest momentum story every told’
8/25/2020,"Stocks making the biggest moves midday: Apple, Tesla, Deere, Delta & more"
8/25/2020,"Jim Cramer on how investors should value the stocks of Apple, Tesla"
8/26/2020,Jefferies analyst hikes Tesla price target to new Street high
8/27/2020,Trading Nation: Jefferies raises Tesla price target to Street high—Two experts on whether you should ...
8/31/2020,"Ives on Tesla, Apple: Stock split “was the smart move at the right time”"
8/31/2020,Tesla shares to start at $442 following 5-for-1 stock split
9/1/2020,"Stocks making the biggest moves midday: Apple, Tesla, Beyond Meat, Amazon & more"
9/1/2020,NYU’s ‘Dean of Valuation’ Aswath Damodaran on Apple and Tesla surge
9/1/2020,Here’s what’s driving the price of Tesla
9/1/2020,"Stocks making the biggest moves after hours: Zoom Video, Eastman Kodak, Tesla & more"
9/1/2020,How Tesla’s stock split has impacted investors shorting the stock
9/3/2020,"Tesla will do well, but there are better opportunities across the sector: Craig Irwin"
9/3/2020,JMP Securities Joe Osha: Tesla should raise more than $5 billion
9/3/2020,Market analysts discuss Tesla stock correction
9/4/2020,"Stocks making the biggest moves midday: Tesla, Facebook, Apple, Beyond Meat & more"
9/4/2020,Why this analyst is giving Tesla a neutral rating with a $150 price target
9/4/2020,"Tesla could be the most dangerous stock on Wall Street, investment researcher says"
9/4/2020,Here’s how much Elon Musk’s wealth has shrunk as Tesla shares slide
9/8/2020,Tesla completes sale of $5 billion in common stock
9/8/2020,Why Tesla was not included in the S&P 500
9/9/2020,"Stocks making the biggest moves midday: Tesla, Nikola, Disney, Apple and more"
9/9/2020,"Baillie Gifford ‘very optimistic’ on Tesla, Chinese entrepreneurship"
9/9/2020,Two experts discuss Tesla as shares plunge more than 30%
9/9/2020,"Tesla is a ‘technology on wheels’ company, bull says"
9/9/2020,Why this Roth Capital analyst is bearish on Tesla
9/11/2020,Oppenheimer’s Colin Rusch talks about why Tesla would benefit from a Joe Biden win
9/11/2020,Does the S&P need rules? Unpacking the index’s Tesla snub
9/11/2020,"Tesla plans to export China-made Model 3 vehicles to Asia and Europe, sources say"
9/11/2020,Top-ranked analyst on breaks down his underperform rating on Tesla
9/16/2020,"Stocks making the biggest moves midday: Netflix, Tesla, Nikola, Lennar and more"
9/16/2020,"Here are Wednesday’s biggest analyst calls of the day: Apple, Tesla, Overstock.com, Tapestry & more"
9/22/2020,Here’s what to expect from Tesla’s Battery Day
9/23/2020,Tesla will remain king of the market for the foreseeable future: Investor
9/23/2020,Canaccord Genuity analyst on what to watch for in Tesla’s annual meeting
9/23/2020,Major Tesla bear reacts to Battery Day promises
9/23/2020,Jim Cramer on the market’s reaction to Tesla’s Battery Day
9/23/2020,Competitors are narrowing battery gap on Tesla: Needham’s Raj Gil
9/24/2020,Tesla sues U.S. over certain China tariffs
9/24/2020,"Tesla’s battery announcement was ‘underwhelming,’ says early Tesla investor"
9/24/2020,Tesla Battery Day garners mixed reactions from Wall Street. Where two traders stand
9/24/2020,ARK Invest analyst says Tesla’s cost reductions promise success for the company’s future
3/4/2021,Jim Cramer reacts to Ron Baron selling 1.8 million Tesla shares
3/9/2021,Here’s a glimpse at Tesla’s Model Y production line at Shanghai Gigafactory
3/10/2021,"Stocks making the biggest moves midday: Tesla, Stitch Fix, Dick’s Sporting Goods & more"
4/8/2021,Goldman shows how to play the global economic comeback – with Tesla and more
4/19/2021,Automakers battle to top Tesla at the Shanghai Auto Show
4/22/2021,"Here are Thursday’s biggest analyst calls of the day: Tesla, Amazon, Alphabet, Microsoft & more"
4/23/2021,"Here are Friday’s biggest analyst calls of the day: Tesla, Schwab, Amazon, Microsoft & more"
4/27/2021,CFRA senior analyst Garrett Nelson and CNBC’s Lora Kolodny on Tesla’s Q1
4/27/2021,Canaccord Genuity analyst discusses what he’s looking for in Tesla’s earnings call
4/27/2021,Fullcycle’s Ibrahim Alhusseini on Tesla’s bitcoin sale and U.S. infrastructure
12/16/2021,"Tesla, Amazon, and Uber are some of today’s top stock picks for investors: Pro Market ..."
12/21/2021,"AT&T, Amazon, and Tesla are today’s top stock picks for investors: Pro Market Movers Dec. ..."
12/24/2021,"Tesla, Nikola shares pop — Two traders’ top EV bets for 2022"
