Date,News Title
1/7/2020,Cramer: I’m a believer in Tesla because of what Musk accomplished in China
1/7/2020,"Here are Tuesday’s biggest analyst calls of the day: Tesla, Micron, Pfizer, PayPal, Boeing & ..."
1/8/2020,Tesla hits new highs as Model 3 deliveries roll out in China—Three experts on the ...
1/8/2020,Why this expert says China is a gamechanger for Tesla
1/8/2020,Venture capitalist compares Elon Musk’s Tesla strategy in China to Sun Tzu’s ‘Art of War’
1/8/2020,"This is the way to buy and hold Tesla, according to one investing pro"
1/8/2020,"Wake me up when Tesla’s double the value of Ford and GM put together, Jim ..."
1/8/2020,Ex-GM executive Bob Lutz finally has something encouraging to say about Elon Musk and Tesla
1/9/2020,Elon Musk could be in for a big pay day if Tesla stock continues to ...
1/10/2020,"Alphabet health group Verily scoops up Tesla’s former CFO, among other key hires"
1/10/2020,"Stocks making the biggest moves midday: Apple, Tesla, Goldman Sachs, Costco, AMD & more"
1/10/2020,How to trade Tesla during rebound
1/10/2020,"Here are Friday’s biggest analyst calls of the day: Nvidia, Facebook, Tesla, Amazon & more"
1/11/2020,Greycroft’s Alan Patricof on why Tesla isn’t in a bubble
1/13/2020,Porsche logs record global sales ahead of 2020 Tesla showdown
1/13/2020,‘I love sitting’ in my Tesla — Cramer praises Elon Musk for making cars an ...
1/14/2020,Wall Street’s biggest Tesla bull said the electric carmaker is a huge threat to competitors
1/14/2020,Jed Dorsheimer: Tesla will remain leader in electric vehicle market despite competition
1/14/2020,"There are meaningful reasons why Tesla, Beyond Meat and Lululemon are rallying, Cramer says"
1/15/2020,"ARK Invest CEO Cathie Wood on why she believes Tesla can surge to $6,000"
1/16/2020,New Tesla registrations in California nearly halved in the fourth quarter
1/18/2020,Why this expert says Tesla will continue to do well
1/20/2020,‘You’re stealing our water:’ Germans protest against Tesla gigafactory
1/22/2020,Former Ford CEO Mark Fields on Tesla and electric vehicle demand
1/22/2020,"Stocks making the biggest moves midday: Morgan Stanley, Beyond Meat, Uber, Tesla and more"
1/22/2020,Tesla crosses $100 billion stock market valuation in extended trading
1/23/2020,Wedbush’s Dan Ives breaks down his bull case for Tesla
1/23/2020,Large part of Tesla rally has been retail: Analyst
1/23/2020,"Jim Cramer calls Tesla a ‘tech company,’ says 2020 is its ‘breakout year’"
1/23/2020,"Jim Cramer: Investors must stop comparing Tesla to Ford, GM"
1/24/2020,Tesla to $1 trillion? One think tank sees it getting there
1/24/2020,Wall Street plays catch up as Tesla hits new highs
1/29/2020,GM upgrades Super Cruise driver-assist system to better match Tesla’s Autopilot
1/29/2020,Options traders bet $2 million on a monster post-earnings Tesla rally
1/29/2020,"If Tesla fails to meet expectations, the stock could sell off hard: Cramer"
1/29/2020,"Everything Jim Cramer said about the stock market on ‘Mad Money,’ including Apple’s quarter, Tesla’s ..."
1/30/2020,Tesla just beat on earnings and revenues by a wide margin—Here’s what three experts are ...
1/30/2020,"Stocks making the biggest moves after hours: Facebook, Microsoft, Tesla, PayPal and more"
1/30/2020,"Investing in Tesla isn’t the only way to play the EV market, analyst says"
1/30/2020,This stock could be another way to play Tesla’s boom
1/30/2020,"Jim Cramer explains how Tesla’s rise is similar to Amazon, Netflix"
1/31/2020,Tesla trying to go from luxury vehicle to GM of its time: WSJ reporter
2/1/2020,Ask the Athletes: Hottest new car in NFL: Tesla
2/1/2020,An ‘electric’ Tesla trade
2/4/2020,Kelly Evans: Back in the saddle! And Tesla’s off to the races
2/4/2020,"Newton Advisors technical analyst on Tesla, energy markets and credit spreads"
2/4/2020,Jim Cramer: Tesla is a tech company and must be valued as one
2/5/2020,Tesla shares trade above $900 for the first time
2/5/2020,"Stocks making the biggest moves midday: Tesla, Alphabet, Clorox, Ralph Lauren and more"
2/5/2020,Here’s why New Street Research’s Pierre Ferragu downgraded Tesla shares
2/5/2020,Tesla can play powerful role in future of renewable energy: Analyst
2/5/2020,Tesla shares rocket higher—Here’s what Wall Street thinks of the stock’s wild ride
2/5/2020,"Tesla’s stock surge ‘feels like a mania,’ strategist says"
2/5/2020,Strategic Wealth’s Tepper: Tesla is the most dangerous stock in the S&P 500 right now
2/5/2020,‘Take your foot off the accelerator’—Analyst explains his hold rating on Tesla
2/6/2020,Investors slam the brakes on Tesla as shares drop
2/6/2020,"Stocks making the biggest moves midday: Ford, Tesla, Coty, Snap, Spotify & more"
2/6/2020,Tesla shares slammed day after surge—What four experts are watching now
2/6/2020,Tesla is the ‘last thing’ retail investors should be touching: WSJ’s Charley Grant
2/6/2020,Tesla’s pullback ‘natural’ but stock not at risk of a total collapse: Jim Cramer
2/6/2020,"Investors shouldn’t feel pressured to buy Tesla, strategist says"
2/6/2020,Vanity Fair’s McLean explains why some say Tesla stock is ‘easy to manipulate’
2/7/2020,Why this investing pro says Tesla one of most dangerous stocks in the world
2/7/2020,Ibrahim Alhusseini: Tesla stock caught up in a hype cycle
2/8/2020,Tesla unseats Apple as millennials’ favorite stock
2/8/2020,Here’s the anatomy of Tesla’s parabolic move
2/8/2020,Jim Press of McLarty Companies on Tesla and Ford
2/10/2020,Tesla shares pop in pre-market as Shanghai production is set to resume
2/12/2020,Here’s how much pain the Tesla short sellers are feeling
2/13/2020,Tesla recalling 15K Model X SUVs: Reuters
2/13/2020,"Tesla’s new $2 billion offering eliminates cash worries, says bull Dan Ives"
2/13/2020,Jim Cramer: It was a good decision for Tesla to issue a secondary stock offering
2/14/2020,NYU’s ‘dean of valuation’ on valuing Tesla
2/14/2020,Berkshire Hathaway’s Charlie Munger: I’d never buy Tesla
2/13/2020,"Stock market live Thursday: Comeback fails, Tesla surges, Microsoft under pressure"
2/14/2020,Tesla shares jumped after a $2 billion stock offering—Here’s what five pros think about the ...
2/14/2020,Tesla stock likely to hold value until end of 2020: Former board member
2/14/2020,"Tesla surges on stock issuance, but options traders bet on Valentine’s Day heartbreak for the ..."
2/14/2020,Is Google-Tesla a match made in heaven?
2/14/2020,"Caterpillar, Tesla stocks trade by different rules: Jim Cramer"
2/14/2020,Loup Ventures’ Gene Munster and Roth Capital’s Craig Irwin debate Tesla’s bear and bull cases
2/19/2020,"Stocks making the biggest moves midday: Apple, Legg Mason, Virgin Galactic, Tesla and more"
2/19/2020,"Tesla ordered to halt work on planned German factory, here’s what it means"
2/20/2020,Tesla just got its highest price target on the Street
2/20/2020,"Sell some Tesla and ‘let the rest run,’ says Jim Cramer"
2/20/2020,Cramer Remix: Why it could be time to take profits in Tesla
8/29/2020,"Stocks head into September in high gear as Apple and Tesla split, and markets await ..."
9/1/2020,Apple and Tesla’s stock split will take effect today—Here’s what five experts are watching now
9/4/2020,Tesla’s fundamental story hasn’t changed despite sell-off: Former board member
9/5/2020,"New Street’s Pierre Ferragu on Apple, Tesla’s sell-off"
9/5/2020,"Stocks making the biggest moves midday: Tesla, Wayfair, Moderna & more"
9/9/2020,Why Baillie Gifford remains ‘very optimistic’ about Tesla’s future
9/9/2020,"Stocks making the biggest moves midday: Slack, Tiffany, Tesla, Lululemon, United Airlines & more"
9/10/2020,Former Ford CEO Mark Fields on Tesla’s stock swings
9/11/2020,"Mike Santoli’s market notes: Indecisive action, Tesla and Zoom bounce, investors cut risk"
9/16/2020,Jim Cramer on Tesla’s annual shareholder meeting “Battery Day”
9/19/2020,"Stocks making the biggest moves midday: U.S. Steel, Tesla, Unity Software, Beyond Meat & more"
9/22/2020,What Morgan Stanley’s Adam Jonas expects from Tesla’s battery event
9/22/2020,Wedbush: Tesla’s Battery Day is a potential paradigm-changer
9/22/2020,Analyst on what he expects out of Tesla’s Battery Day
9/22/2020,"Former Chrysler CEO: Tesla faces challenge of building infrastructure to support EV, favorable pricing and ..."
9/23/2020,"Stocks making the biggest moves midday: Amazon, Carvana, Tesla, Peloton and more"
9/23/2020,"Tesla’s Battery Day is significant in the battle for auto industry dominance, says analyst"
9/23/2020,Analysts: Tesla’s Battery Day ‘failed to deliver’
9/23/2020,Top-ranked analyst Toni Sacconaghi on Tesla’s Battery Day
9/24/2020,"Stocks making the biggest moves midday: Nike, Tesla, Stitch Fix, Peloton, Nikola & more"
