Date,News Title
9/24/2020,Tesla’s former principal Roadster battery designer on the Battery Day announcement
9/24/2020,"Stocks making the biggest moves after hours: Tesla, Dollar Tree, Jefferies Financial Group & more"
9/24/2020,"Cramer sees positives from Tesla’s Battery Day, but tells investors to be patient before buying"
9/24/2020,Cramer breaks down the stock moves after Tesla’s Battery Day and Nike’s strong earnings report
9/26/2020,"Stocks making the biggest moves midday: Tesla, Costco, Royal Caribbean & more"
9/30/2020,"These clean-energy stocks including Tesla could benefit from a Biden win, says Baird"
10/2/2020,"Stocks making the biggest moves midday: Tesla, Twilio, Peloton & more"
10/11/2020,Inside Lucid Motors’ plan to take on Tesla
10/16/2020,"Here are Friday’s biggest analyst calls of the day: Tesla, Costco, Chipotle, Netflix & more"
10/22/2020,Tesla’s autonomous driving could displace $8 trillion worth of enterprise value in the market: Analyst
10/22/2020,Belpointe Asset Management’s David Nelson on Tesla’s Q3 earnings
10/22/2020,"Tesla’s profitability significantly improved, but doesn’t change long-term view: Analyst"
10/22/2020,"Cramer: Tesla’s financials are ‘as clean as can be,’ it’s doing incredibly well"
10/23/2020,"Cramer breaks down Tesla’s third quarter: clean top, bottom line beats"
10/27/2020,"Here are Tuesday’s biggest analyst calls of the day: Foot Locker, Live Nation, UPS, Tesla ..."
8/5/2021,‘I’m not sure’: Buttigieg on why Tesla wasn’t invited to Biden EV event
8/18/2021,"Missed out on Tesla? Here’s how you can ride on the EV boom, says one ..."
8/20/2021,Tesla boosts government relations staff as China passes new cyberspace regulation
8/24/2021,Bulls bet on Tesla
8/24/2021,What it’s like to take a non-Tesla electric car on a road trip
8/25/2021,"Battery pioneer Akira Yoshino on Tesla, Apple and the electric future"
1/2/2020,"Here are Thursday’s biggest analyst calls of the day: Tesla, Ford, Wells Fargo, Advanced Micro ..."
4/1/2024,"Stocks making the biggest moves premarket: Micron Technology, 3M, AT&T, Delta Airlines and more"
4/2/2024,"Stocks making the biggest moves midday: Micron Technology, Cameco, MicroStrategy, Universal Health Services and more"
4/2/2024,"Five stocks to buy and hold for the long term, according to the pros"
4/3/2018,"Tesla is facing an ‘existential crisis,’ says market watcher"
4/19/2018,California workplace safety agency opens probe into Tesla
5/15/2018,"Tesla Model S was on Autopilot, Utah driver tells police"
5/16/2018,"As Tesla hits the skids, one market watcher sees a ‘line in the sand’ for ..."
6/6/2018,"Tesla factories reportedly struggling with high scrap volume, and low vehicle production rate per employee"
9/18/2017,"This investor is short Tesla, long BMW – here’s why"
12/27/2017,Elon Musk asked his Twitter followers for Tesla feedback – here’s what they said
12/27/2017,Elon Musk promises to make a Tesla pickup truck and said he is ’dying to ...
12/28/2017,Elon Musk promises new features and upgrades are coming to Tesla
7/10/2018,Tesla hikes prices in China as trade war hits carmakers
7/20/2018,Tesla’s battery maker suspends cobalt supplier amid sanctions concern
12/10/2018,Elon Musk ‘thinks he’s above the law’: Cramer on the Tesla CEO’s combative ’60 Minutes’ ...
1/19/2019,Tesla sinks after cutting 7% of its workforce. Five experts weigh in on what’s next
1/31/2019,Trader bets Tesla could see a double-digit surge post-earnings
2/13/2019,Morgan Stanley: Why GM and Amazon may be investing in ‘the next Tesla’
2/27/2019,"Tesla has ‘no transparency’ and should be avoided, says strategist"
3/5/2019,This Tesla-heavy ETF is crushing the market this year
3/19/2019,"Stocks making the biggest moves premarket: General Motors, Tesla, Netflix, Boeing & more"
4/25/2019,"Tesla will find it difficult to find scale in European and Chinese markets, autos expert ..."
4/30/2019,"Ark Invest’s Cathie Wood defends her Tesla to $4,000 call"
5/2/2019,We went inside Tesla’s first Gigafactory
9/10/2019,Twitter video appears to show driver asleep at the wheel of self-driving Tesla
9/10/2019,Boeing suspends load test on new 777X aircraft; Tesla driver asleep at wheel?
9/25/2019,Musk on Twitter: Tesla building major engineering team in China
10/23/2019,Options traders say Tesla could be on the road to a turnaround
10/24/2019,Here’s what investors should look for in Tesla’s earnings
10/24/2019,Tesla soars on earnings
10/24/2019,Eberle: Still neutral on Tesla despite improved Q4 outlook “it’s a contentious stock”
11/21/2019,Tesla trucks higher
11/22/2019,Key question: Will Tesla’s Cybertruck will create volume for company: Analyst
11/22/2019,"Apple’s lobbyist contradiction, Tesla’s big reveal and the odd player out in the streaming wars"
11/22/2019,Tesla’s unveiling of its new Cybertruck didn’t go as planned
11/22/2019,"Tesla’s cybertruck won’t gain market share against Ford or GM, analyst says"
11/23/2019,Tesla reveals its electric Cybertruck — Five experts on what it does to the stock
11/22/2019,Cramer compares the Tesla Cybertruck to the spectacular failure of the Ford Edsel 60 years ...
11/23/2019,Why this early Tesla investor says there’s going to be a big market for Cybertruck
11/23/2019,A Tesla takedown
11/25/2019,"Tesla CEO Elon Musk: There have been 200,000 Cybertruck reservations"
11/25/2019,"Cramer: ‘I’m a bull on Tesla,’ because I want to make my life easier on ..."
11/26/2019,Ford challenged Tesla to an ‘apples to apples’ tug-of-war between pickup trucks — Musk says ...
11/27/2019,‘Bring it on’—Tesla’s Cybertruck battles Ford’s F-150 in a pickup truck showdown
11/27/2019,"Jim Cramer: Once Elon Musk stopped tweeting, Tesla started doing better"
11/27/2019,"Tesla beat Ford because people are talking about it, says Defy Partners’ Neil Sequeira"
11/27/2019,Jim Cramer on Tesla: I know my wife wants to buy a Model X
6/29/2020,"Tesla’s ‘hyper-growth’ narrative will fall apart in second half of 2020, analyst says"
6/30/2020,Watch a timeline of Tesla’s biggest milestones from the past 10 years
7/2/2020,Analyst on what Tesla’s Q2 delivery beat means for the stock
7/3/2020,Former Ford CEO explains why Tesla’s stock is growing
7/8/2020,"Stocks making the biggest moves midday: Novavax, Shake Shack, Tesla & more"
7/11/2020,Nasdaq stocks led by Tesla continue their blistering run while chill envelops rest of the ...
7/16/2020,Tesla registrations in California nearly halved in second quarter
7/20/2020,Chinese Tesla rival Xpeng Motors raises $500 million as it begins deliveries of new sedan
7/23/2020,Wedbush’s Dan Ives: Tesla’s earnings are a ‘jaw-dropper’
7/23/2020,"Tesla’s valuation is ‘almost ridiculous,’ strategist says"
7/23/2020,"Tesla’s growth is about renewable energy components, not electric cars, says Chamath Palihapitiya"
7/24/2020,Texas Gov. Greg Abbott on Tesla’s new Austin factory
7/25/2020,Austin mayor Steve Adler on Tesla’s move to Texas
7/25/2020,"Stocks making the biggest moves midday: Advanced Micro Devices, Tesla, Intel & more"
7/27/2020,GLJ Research’s Gordon Johnson on whether Tesla’s tax credits appear too good to be true
7/29/2020,Tesla’s ‘current valuation is mind-boggling’: Bernstein’s Sacconaghi
7/29/2020,"Here are Wednesday’s biggest analyst calls of the day: Tesla, Apple, L Brands, Netflix & ..."
7/29/2020,Move over Tesla: Robinhood day-trading crowd finds a new speculative favorite in Kodak
8/3/2020,"Here are Monday’s biggest analyst calls of the day: Nikola, Merck, Yum! Brands, Tesla & ..."
8/5/2020,"Tesla’s Chinese rival Xpeng raises $400 million ahead of U.S. IPO, sources say"
8/12/2020,"Stocks making the biggest moves after hours: Tesla, Eastman Kodak, Shutterstock and more"
8/12/2020,Here’s what Tesla’s stock split could mean for small investors
8/12/2020,Jim Cramer: Tesla’s stock split helps young investors enter the market
8/13/2020,"Stocks making the biggest moves midday: Tesla, Roku, Brinker International, Target & more"
8/13/2020,We’re seeing a fair amount of support for Tesla’s valuation: Oppenheimer’s Rusch
8/18/2020,"Stocks making the biggest moves midday: Barrick Gold, Tesla, Teladoc, Home Depot & more"
8/21/2020,Should investors worry about Tesla’s valuation?
8/21/2020,Whale Rock picked some of the biggest winners of the year like Tesla — Here ...
8/21/2020,"Stocks making the biggest moves midday: Deere, Foot Locker, Tesla & more"
8/22/2020,"Tesla’s stock is being treated like a biotech, says GGV Capital’s Richards"
8/22/2020,Part of Tesla’s success has been vibrant retail investor base: Tech reporter
8/26/2020,"Here are Wednesday’s biggest analyst calls of the day: Tesla, Roku, Apple, Nikola, Shopify & ..."
8/27/2020,Xpeng Motors debuts at NYSE—Here’s what to know about the Tesla competitor
6/25/2021,Chinese Tesla rival Xpeng to raise up to $2 billion from Hong Kong listing
6/25/2021,Tesla sued in California over fees at supercharger stations
6/28/2021,"Here are Monday’s biggest analyst calls of the day: Micron, Tesla, GameStop, Microsoft & more"
6/29/2021,"Which would you buy: Square, Tesla or Twitter? #AskHalftime"
6/30/2021,"UBS cuts its Tesla price target, boosts Ford, GM — what traders see ahead"
6/30/2021,A top designer wants to build an air-purifying Tesla rival that you can sleep and ...
6/30/2021,"Here are Wednesday’s biggest analyst calls of the day: Tesla, Virgin Galactic, Gap, Apple & ..."
7/7/2021,Shares of Chinese Tesla rival Xpeng close flat in Hong Kong debut
7/10/2021,Cramer’s lightning round: Ford and Tesla are at buying levels
7/12/2021,The Sharpe Angle: TPG’s Jim Coulter says Tesla might be the AOL of electric vehicles
7/12/2021,"TPG’s Jim Coulter says Tesla is the AOL of electric vehicles, but won’t necessarily end ..."
7/19/2021,"RBC’s Silverman: Options movement in names like Apple, Tesla, shows a flight to safety"
7/21/2021,"Here are Wednesday’s biggest analyst calls of the day: Peloton, McDonald’s, Amazon, Apple, Tesla & ..."
7/24/2021,Ford vs. Tesla
7/24/2021,Jim Cramer previews earnings reports from Tesla and Big Tech companies
7/27/2021,Options traders bet against Tesla ahead of earnings
7/27/2021,Why this analyst continues to be bullish on Tesla after earnings beat
7/28/2021,Toni Sacconaghi on China risk to Apple and Tesla
7/28/2021,"Stocks making the biggest moves midday: UPS, Moderna, Tesla and more"
7/30/2021,"Stocks making the biggest moves midday: Hilton, Yum Brands, Tesla and more"
10/8/2019,Tesla gets a boost after companies take a bet on electric semi trucks
10/15/2019,Tesla surges higher on Chinese EV law
10/24/2019,Loup Ventures founder Gene Munster reacts to Tesla earnings
3/13/2024,EV euphoria is dead. Automakers are scaling back or delaying their electric vehicle plans
4/5/2018,"A major disconnect between Tesla shares and bonds is signaling problems for the stock, says ..."
2/8/2018,Elon Musk’s Tesla overshot Mars’ orbit but it won’t reach the asteroid belt as claimed
6/6/2017,One trader’s plan to triple his money by betting on Tesla
12/1/2017,JPMorgan has a new short idea: Tesla shares to fall 40 percent in 12 months
7/18/2018,Seven experts debate the future of Tesla and Elon Musk
8/1/2018,Eight experts debate the future of Tesla ahead of earnings
8/28/2018,Tesla owner frustrated so repairs his own Model S and says it’s easy as ‘Legos’
9/21/2018,What ever happened to Tesla’s Solar Roof tiles?
10/2/2018,Unraveling a Tesla mystery: Lots (and lots) of parked cars
10/25/2018,Tesla mum on replacing Elon Musk as chairman
11/7/2018,Tim Draper says Elon Musk probably should have taken Tesla private
11/28/2018,"WM Motor CEO: Tesla China sales number ‘misleading,’ firm doing fine"
12/12/2018,"Some freelance hackers can get paid $500,000 a year to test defenses of companies like ..."
12/29/2018,"Tesla board pick of Larry Ellison is a clone of CEO Elon Musk, says Jeff ..."
1/31/2019,ARK Invest: China could be one of the biggest markets for Tesla
6/13/2019,"The viewers ask about XPO, Tesla and Waste Management in #AskHalftime"
6/14/2019,"Tesla’s annual shareholder meeting, Juul sales remain strong, Mark Zuckerberg gets “deepfaked” and why your ..."
6/21/2019,"The demise of work emails, Tesla slides, extreme discounters soar, Alexa could detect a heart ..."
6/27/2019,"The battle for streaming content, Chevy’s new $100K pickup truck, Tesla’s Q2 delivery bottleneck and ..."
7/1/2019,Here’s what to expect from Tesla’s Q2 deliveries
7/2/2019,"Tesla’s problem is cash burn, WSJ reporter says"
7/2/2019,Two experts break down Tesla’s recent troubles
7/3/2019,Tesla just reported second-quarter delivery numbers — Here’s what six experts say to watch now
7/3/2019,Loup Ventures’ Gene Munster: Tesla’s delivery record marks a ‘turning point’ for the automaker
7/6/2019,"Big movers in the trader blitz, including McKesson and Tesla"
7/20/2019,"Tesla up 45% from June low, but here’s why it’s time to tap the breaks"
7/23/2019,"Tesla, Stitch Fix and more in the blitz"
7/25/2019,Here’s what to look for in Tesla’s earnings report
7/25/2019,"Latest Tesla earnings release is ‘extremely demoralizing’ for the company, analyst says"
7/25/2019,Tesla earnings: Six experts break down Tesla’s rough quarter
8/21/2019,"Beyond Meat surges, “Tesla killers” fail to live up to the name and cashing in ..."
8/22/2019,Tesla shares rise on report Volkswagen CEO is interested in stake
8/28/2019,How Tesla’s SolarCity factory in Buffalo is affecting the community
8/30/2019,Tesla to be exempt from China auto purchase tax
8/30/2019,"GM, Tesla, Big Lots and Campbell Soup in the blitz"
4/10/2020,"Coronavirus pushes auto dealers to embrace online sales like Tesla, Carvana"
4/14/2020,"Stocks making the biggest moves after hours: Roku, AMC, Tesla and more"
4/16/2020,"Stocks making the biggest moves midday: JC Penney, Tesla, Netflix, Bank of America & more"
4/28/2020,"Stocks making the biggest moves after hours: Keurig Dr Pepper, F5 Networks, Tesla and more"
4/29/2020,"China’s battered Tesla rival Nio brushes off coronavirus impact, says the worst is over"
5/1/2020,"Stocks making the biggest moves midday: Tesla, Facebook, Dunkin’ Brands, Boeing, Moderna & more"
5/2/2020,"Stocks making the biggest moves midday: Tesla, Amazon, Clorox & more"
5/4/2020,"Here are Monday’s biggest analyst calls of the day: Tesla, Disney, Qualcomm & more"
5/9/2020,Trader lays out how to play Tesla’s wild moves this month
5/12/2020,Musk’s threat about getting a few more manufacturing days in: Fmr. Tesla board member
5/22/2020,Cramer’s lightning round: I prefer Tesla to Ford
6/9/2020,Oppenheimer’s Colin Rusch on Tesla’s production uncertainty and sales data
6/10/2020,Market baking in Tesla’s future domination: Expert
6/10/2020,"Here are Wednesday’s biggest analyst calls of the day: Tesla, Alphabet, Chevron, airlines & more"
6/11/2020,"Stocks making the biggest moves midday: Tesla, AMC Entertainment, Five Below, Starbucks & more"
6/13/2020,"Stocks making the biggest moves midday: Hertz, Tesla, Adobe & more"
4/20/2021,How Peloton and Tesla could navigate recent criticism
4/24/2021,"Cramer’s week ahead: Tesla, Microsoft, Starbucks, Facebook and more earnings"
4/27/2021,Santoli’s Monday market notes: The market is quiet ahead of big expectations for Tesla earnings
4/28/2021,"Ford takes steps toward making battery cells for electric vehicles, following Tesla and GM"
4/30/2021,Miami Heat’s Andre Iguodala chooses Tesla in 2nd round of CNBC’s 2021 Stock Draft
5/1/2021,"Final Trades: Tesla, Mondelez, XPO Logistics & more"
5/11/2021,"Jim Cramer breaks down Larry Williams’ ‘Memorial Day trade’ in Tesla, GM"
5/15/2021,"Trading Nation: Tesla, Micron lag market in wild week for stocks"
5/20/2021,"Stocks making the biggest moves midday: Target, Lowe’s, Tesla and more"
6/2/2021,"Don’t count out Tesla’s dominance in the EV space, traders suggest"
7/3/2019,Tesla reports record deliveries for Q2
7/25/2019,Tesla tanks on earnings
7/25/2019,Loup Ventures Gene Munster breaks down Tesla earnings
2/3/2024,Why parts of the ‘Magnificent 7’ are losing their luster
2/15/2024,Dan Niles is long 4 and short 3 of the Magnificent 7 stocks
2/15/2024,SpaceX files to move incorporation site from Delaware to Texas
3/13/2024,Forget the Magnificent 7 — Top tech analyst Mahaney recommends the ‘Electric Eleven’
4/1/2024,"Fed must get ‘more aggressive’ with rate cuts due to weakening jobs market, Canaccord’s chief ..."
3/22/2018,Elon Musk could earn $55 billion at Tesla under his new pay plan—here’s what he ...
5/19/2018,"ISS sides against two Tesla directors, backs split of Musk’s roles"
2/23/2017,Traders discuss how to trade Tesla’s stock after earnings
6/9/2017,Elon Musk: People betting against Tesla ’want us to die so bad they can taste ...
8/3/2017,Elon Musk: Tesla is not considering raising more equity at this point
8/4/2017,"Tesla could burn more than $1 billion per quarter from weak Model 3 margins, Toni ..."
11/11/2017,Tesla investor Ron Baron still believes he can make 20 times his money
7/11/2018,"New Shanghai factory does not mean better growth for Tesla, experts say"
8/2/2018,FT: Many positive takeaways from Tesla and Elon Musk’s conference call
8/8/2018,Why does Elon Musk want to take Tesla private?
8/9/2018,It’s been 24 hours and Tesla still hasn’t said where its secured financing is coming ...
8/15/2018,Growing competition will be a challenge for Tesla and Elon Musk: Analyst
8/15/2018,"There’s a pretty good change Tesla doesn’t go private, says expert"
8/17/2018,Tesla board members reportedly concerned about Elon Musk’s use of Ambien
8/24/2018,"Meet Russia’s answer to Tesla, the Kalashnikov CV-1"
8/27/2018,Sonnenfeld: Elon Musk risks losing the confidence of Tesla constituents
8/28/2018,Judge dismisses lawsuit against Tesla over Model 3 production
8/31/2018,This is why Jay Leno owns and drives a Tesla
9/28/2018,Elon Musk’s departure might not be so bad for Tesla - he needs to grow ...
9/28/2018,Tesla is ‘on the precipice of financial collapse’
9/28/2018,"Without Musk, Tesla is just a car company with too much debt: Analyst"
10/1/2018,"This is the growing up moment for Tesla, says CEO"
10/3/2018,New electric SUVs can give Tesla a run for its money: Expert
10/19/2018,"A rare metal called neodymium is in your headphones, cellphone and electric cars like Tesla’s ..."
10/22/2018,How government policies and taxpayer money have helped Elon Musk and Tesla
2/26/2019,Canada’s cut-price answer to Tesla just officially opened its factory in China
3/12/2019,"Stocks making the biggest moves in the premarket: Boeing, Microsoft, Tesla, Amazon & more"
3/14/2019,"Stocks making the biggest moves premarket: Boeing, Tesla, General Electric, Facebook & more"
3/21/2019,The court can rein in Tesla CEO Elon Musk with one of these three move
4/12/2019,"The day’s biggest movers in the trader blitz, including JetBlue, Tesla & more"
4/25/2019,Eberle: Hold on Tesla
4/26/2019,Longtime Tesla bull downgrades the stock to neutral
5/4/2019,"Cramer: Tesla made the right call to borrow money. Occidental, not so much"
1/14/2020,Tesla’s biggest bull explains why his price target is $612
1/14/2020,"Jim Cramer breaks down the rallies behind Tesla, Beyond Meat and Lululemon"
1/15/2020,Ark Invest’s Cathie Wood on what’s behind Tesla’s record run
1/17/2020,"Stocks making the biggest moves midday: Morgan Stanley, Tesla, Alcoa & more"
1/23/2020,"Stocks making the biggest moves midday: Tesla, Capital One, Northern Trust, IBM & more"
1/25/2020,Tesla’s moment of truth
1/28/2020,American World War II bombs found at Tesla’s new German site have been defused
1/29/2020,Cramer: Tesla’s stock may sell off hard if it fails to meet earnings expectations
1/31/2020,Morningstar’s David Whiston explains the risks to Tesla’s record run
1/31/2020,Jim Cramer says Tesla’s recent run reminds him of how Amazon and Netflix found success
1/31/2020,Tesla’s recent run reminds Jim Cramer how AMZN and NFLX found success
2/3/2020,"Stock market updates Monday: Dow rebound loses steam as day goes on, Tesla pops 19%"
2/5/2020,Morgan Stanley’s Adam Jonas on Tesla’s soaring stock
2/5/2020,Tesla’s really big day and Disney moves after earnings
2/5/2020,Tesla’s options skyrocketing even faster than the stock
2/6/2020,Ralph Nader sounds a warning on Tesla shares’ massive run
2/6/2020,Jim Cramer says Tesla’s pullback was ‘natural’ but the stock is not at risk of ...
2/6/2020,Cramer Remix: Tesla’s “too legit to quit”
2/6/2020,"Stock market live Thursday: Dow hits record, Twitter soars, Tesla recovers"
2/7/2020,Tesla’s current stock value is hard to justify: Kelley Blue Book
2/8/2020,Trader lays out how to play Tesla’s turbulent week for profits
2/10/2020,"Here are the best stocks besides Tesla to play the electric vehicle boom, Morgan Stanley ..."
2/11/2020,"Tesla’s stock is a ‘cult-like situation’, says Roger McNamee"
2/11/2020,Why Tesla’s expected to have lowest battery costs for years
2/13/2020,Tesla announces $2 billion common stock offering
2/13/2020,Tesla says ‘health epidemics’ are a risk as US confirms 15th coronavirus case
2/14/2020,"Stock market live Friday: Stocks close little changed, utilities record, Tesla swings"
2/18/2020,This speculative space stock is outstripping even Tesla’s rally since the year began
2/18/2020,"Stock market live Tuesday: Dow drops 165, Apple closes off lows, Tesla jumps"
2/20/2020,"Everything Jim Cramer said about the stock market on ‘Mad Money,’ including trimming Tesla, Everbridge ..."
2/22/2020,Mattel’s remote-controlled Tesla Cybertruck comes with its own ‘cracked’ window sticker
2/28/2020,"Stocks making the biggest moves midday: Virgin Galactic, Square, Tesla, Box, Etsy & more"
3/3/2020,BMW releases details of its new electric car to rival Tesla
3/13/2020,"GM, Ford, Fiat Chrysler shares return to 52-week lows; Tesla down 10%"
3/20/2020,"Stocks making the biggest moves after hours: Crowdstrike, Ollie’s Bargain Outlet, Tesla and more"
4/3/2020,"Stocks making the biggest moves after hours: Tesla, Dave & Buster’s, Chewy and more"
2/22/2021,"Stock market live updates: Nasdaq drops 2%+, Big gains for airlines, Tesla under pressure"
2/26/2021,Dan Niles: Don’t know how anyone could think Tesla is ‘enticing’
2/27/2021,It’s going to be Apple vs. Tesla: Loup Ventures’ Gene Munster on EVs
3/6/2021,Why the Ark Innovation ETF and Tesla may be good sentiment indicators
3/9/2021,"Here are Tuesday’s biggest analyst calls of the day: Home Depot, Lowe’s, Tesla, Chipotle & ..."
3/10/2021,Options bulls see more upside in Tesla
3/10/2021,"Three factors are helping Tesla take the lead in EV race, report finds"
3/12/2021,"Stocks making the biggest moves midday: GE, Nio, Tesla, Bumble, Oracle & more"
3/26/2021,"What the market technicals say about investing in PayPal, Zoom, Tesla"
3/30/2021,"Top analyst Toni Sacconaghi: If slowdown in Tesla, Apple is a buying opportunity"
4/2/2021,Cramer’s lightning round: Why Tesla stock stopped going up
4/7/2021,"Here are Wednesday’s biggest analyst calls of the day: Tesla, JPMorgan, ViacomCBS, AMC & more"
8/24/2022,Chinese Tesla rival Xpeng tanks 12% after wider-than-expected loss and weak car delivery guidance
4/5/2018,Tesla has ‘phenomenal record in creating value for shareholders’: Pro
4/5/2018,Trade war with China may adversely affect Tesla
5/4/2018,Short-seller Mark Spiegel says Tesla stock is worth ‘zero’
5/4/2018,5 outrageous Elon Musk moments from the bizarre Tesla call
11/23/2017,"Rebuilding the Caribbean will be pricey, but Tesla and China want to help"
5/3/2018,"Tesla’s earnings were better than expected, but Elon Musk still has a lot on his ..."
5/3/2018,‘Effectiveness’ of Tesla self-driving system was not assessed in probe: US traffic safety agency
5/3/2018,Tesla call sparks chaos on ETFs
4/26/2018,Elon Musk’s big ambitions may be killing Tesla
5/31/2018,Consumer reports reverses Tesla Model 3 opinion
7/22/2016,Execution still an open question after new Tesla master plan
9/23/2016,Tesla is suing Michigan officials for not letting it sell cars directly to consumers
10/21/2016,Tesla bans use of self-driving cars to make money with Uber or Lyft as it ...
11/13/2017,"Tesla will reveal its semi this Thursday, and Musk promises to ‘blow your mind’ with ..."
11/14/2017,Here’s why I still don’t trust Tesla Autopilot
6/18/2018,Tesla fire sparks investigation
7/2/2018,If Tesla can combine real manufacturing with the brand they will sustain value for a ...
7/5/2018,Tesla stock under pressure after eliminating ‘brake and roll’ test
7/6/2018,"Gambling & retail in the blitz. Plus, Tesla’s rough ride"
11/15/2018,Why the short seller who ‘hated’ Tesla decided to buy the stock
1/3/2019,Why Tesla’s electric slide could be a buying opportunity
2/12/2019,Tesla has grand ambitions in China but the electric vehicle maker faces steep competition there
10/25/2019,"Not sure Tesla’s profits are sustainable, says energy technology analyst"
11/18/2019,"Here are the biggest analyst calls of the day: Five Below, Tesla, Workday & more"
11/22/2019,Top-rated tech analyst Toni Sacconaghi on Tesla’s push into pickup trucks
11/22/2019,"Tesla’s Cybertruck is not designed for truck owners, says New Yorker’s Duhigg"
11/22/2019,"Tesla’s Cybertruck reveal was a brand building event, analyst says"
11/22/2019,Jim Cramer: Tesla’s Cybertruck looks like a ‘bit of a bust’
11/23/2019,Why Tesla’s Cybertruck may be a hit with consumers
11/23/2019,Tesla’s new Cybertruck seemed incomplete: Kelly Blue Book’s Muzio
11/23/2019,Tesla’s cybertruck has unique and futuristic design: analyst
