Date,News Title
10/19/2023,"Tesla should be seen as both an automotive and an AI play, says KKM Financial’s ..."
10/19/2023,Tesla Q3 earnings: Here’s what to expect
10/19/2023,Tesla and Netflix earnings: Here’s what to expect
10/19/2023,Tesla and Netflix Q3 earnings: What to expect
10/19/2023,"Ultimately Tesla needs to improve its margins, says Deepwater Asset’s Gene Munster"
10/19/2023,"The near-term is quite challenging for Tesla, says Wells Fargo’s Colin Langan"
10/20/2023,Here’s why Guggenheim’s Ron Jewsikow makes the bearish case for Tesla
10/20/2023,Tesla tumbles after posting quarterly results. Here’s what the pros say
10/20/2023,Tesla bull Gary Black and bear Dan Nathan debate what’s next after Q3 earnings
12/12/2023,"Here are Tuesday’s biggest analyst calls: Apple, Tesla, Boeing, Airbnb, GM, Coinbase, Target, Macy’s and ..."
12/13/2023,"Here are Wednesday’s biggest analyst calls: Tesla, Apple, Amazon, Microsoft, Ferrari, Roblox, Disney and more"
12/14/2023,"Stock Movers: J&J, Vertex Pharma and Tesla"
9/18/2023,"Goldman Sachs analyst lowers earnings forecast on Tesla, cites price cuts and slimmer margins"
9/30/2023,How Tesla is at the center of the UAW strikes
10/13/2023,"U.S. electric-vehicle sales hit record high, Tesla loses market share: Report"
10/14/2023,"Tesla is the ev gorilla that makes money, says EMJ’s Eric Jackson"
12/8/2023,"No automaker has made an EV that can keep up with Tesla, says Jim Cramer"
8/7/2023,Tesla CFO Zach Kirkhorn steps down
8/16/2023,"Tesla makes further price cuts in China, reducing models S and X by $7,400 to ..."
9/13/2023,"Ron Baron stands by Tesla, sees the EV maker 4 to 5 times bigger in ..."
9/20/2023,Cathie Wood says Tesla is the ‘biggest AI opportunity in the world’ today
10/7/2023,"Three-Stock Lunch: Disney, Tesla and Exxon"
8/3/2023,Tesla faces California class action on its EV range claims
8/11/2023,US probing Virginia fatal crash involving Tesla suspected of running on automated driving system
9/4/2023,"BMW, Mercedes launch biggest EV push yet to catch Tesla with new models"
9/7/2023,"Tesla to install charging stations at 2,000 Hiltons in North America"
9/8/2023,UBS loves these electric vehicle stocks — and says one offers China’s ’answer to Tesla ...
9/9/2023,How Elon Musk set Tesla on a new course for self-driving
9/30/2023,Options Action: Tesla jumps ahead of Q3 production and delivery numbers
10/3/2023,"We’re in the middle phases of the Tesla growth story, says Wedbush’s Dan Ives"
10/3/2023,Cramer’s Stop Trading: Tesla
10/4/2023,"Veterans from Tesla, Northvolt hatch plan to mass-produce huge batteries to store solar and wind ..."
12/1/2023,"Cybertruck ‘does move the needle’ for Tesla, says Wedbush’s Dan Ives"
12/1/2023,"Stocks making the biggest moves premarket: Pfizer, Disney, Tesla, Alibaba and more"
12/1/2023,"Here are Friday’s biggest analyst calls: Tesla, Boeing, Amazon, Delta, Spotify, Alibaba, Johnson & Johnson ..."
12/2/2023,"Stocks making the biggest moves midday: Tesla, Disney, Alibaba, Ulta Beauty and more"
7/27/2023,"Tesla under investigation by California attorney general over Autopilot safety, marketing"
7/27/2023,Tesla created secret team to suppress thousands of driving range complaints
8/14/2023,"Tesla cuts prices again in China for Model Y, Model 3"
8/15/2023,"Tesla launches lower-range Model X and Model S that are $10,000 cheaper"
9/28/2023,"EV makers such as Tesla could fall under Europe’s subsidy probe into China, EU’s trade ..."
11/29/2023,"Here are Wednesday’s biggest analyst calls: Apple, Amazon, Tesla, Schwab, Pinterest, Exxon, Disney and more"
4/9/2024,5 things to know before the stock market opens Tuesday
4/9/2024,Elon Musk is trying to highlight the value that robotaxis could bring: RBC Capital’s Tom ...
7/17/2023,"Elizabeth Warren urges SEC to investigate Tesla over Twitter ties, corporate governance"
7/18/2023,Tesla directors pay $735 million to settle lawsuit over excess compensation
7/21/2023,Why Tesla investors should care about Elon Musk’s multiplying ventures
8/1/2023,Tesla faces new NHTSA probe over loss of steering control in Model 3 and Y ...
9/19/2023,"Tesla may open factories in Turkey, where Ford has a long history: Atlantic Council CEO ..."
9/19/2023,"There’s a definite cost advantage for Tesla using non-union plants, says Gabelli’s Brian Sponheimer"
9/19/2023,‘Elon Musk’ author Walter Isaacson talks reports of a Saudi Arabia Tesla factory
9/19/2023,ARK CEO Cathie Wood on self-driving taxis: It’s a ‘winner take most’ market for Tesla
10/19/2023,"Tesla’s margin pressure weighing on revenue and earnings, says Vital Knowledge’s Adam Crisafulli"
10/19/2023,"Ford should be worried about Tesla’s Cybertruck, says ARK’s Tasha Keeney"
10/19/2023,"Stocks making the biggest moves after hours: Netflix, Tesla, Lam Research, Las Vegas Sands and ..."
10/19/2023,"Tesla’s near-term results ‘a dissapointment’, says Deepwater’s Gene Munster"
10/19/2023,Tesla will probably be able to achieve its goal of 1.8 million deliveries by end ...
10/19/2023,"Stocks making the biggest moves premarket: Tesla, Netflix, Peloton and more"
10/19/2023,"Here are Thursday’s biggest analyst calls: Tesla, Netflix, Best Buy, Amazon, First Solar, Disney & ..."
10/19/2023,"Tesla’s Q3 conference call was the definition of a disaster, says Wedbush’s Dan Ives"
10/20/2023,"Stocks making the biggest moves midday: Tesla, Netflix, American Airlines, AT&T and more"
7/12/2023,Tesla settles class-action Solar Roof lawsuit for $6 million
7/15/2023,"Elon Musk plans Tesla and Twitter collaborations with xAI, his new startup"
7/20/2023,Tesla shares dip after hours as earnings call disappoints
9/11/2023,Morgan Stanley upgrades Tesla
9/13/2023,"Tesla price cuts will continue as mid- and lower-end EV competition grows, says Chris Pierce"
10/10/2023,"Here are Tuesday’s biggest analyst calls: Apple, Tesla, Microsoft, Rivian, Amazon, Skechers, Block and more"
10/13/2023,"Here are Friday’s biggest analyst calls: Nvidia, Tesla, Dollar General, Amazon, Meta, SolarEdge & more"
11/18/2023,"Tesla can still grow its volumes by 30-35 percent a year, says Future Fund’s Gary ..."
11/20/2023,"Here are Monday’s biggest analyst calls: Nvidia, Apple, Amazon, Boeing, Tesla, Dell, Microsoft & more"
6/29/2023,Polestar is the latest EV maker to announce a move to Tesla’s North American charging ...
7/3/2023,"Tesla reported 466,140 deliveries for the second quarter, and production of 479,700 vehicles"
7/6/2023,NHTSA presses Tesla for more records in Autopilot safety probe
7/7/2023,"EV sales: Hyundai overtakes GM, but Tesla’s U.S. dominance continues"
7/21/2023,"Netflix and Tesla stock will work their way back up after Thursday’s plunge, Cramer says"
8/9/2023,Indian automaker Mahindra says competition from Tesla ‘does not faze us’
8/11/2023,A totaled Tesla was sold for parts in the U.S. but came back online in ...
9/4/2023,Mercedes and BMW want to take on Tesla. Check out their new electric concept cars
11/14/2023,"Here are Tuesday’s biggest analyst calls: Nvidia, Tesla, Apple, Disney, Microsoft, AMD, Amazon, Adobe & ..."
11/17/2023,"Elon Musk’s behavior and damage to Tesla brand is ‘absolutely outrageous’, says investor Ross Gerber"
6/28/2023,Volvo just became the latest EV maker to move to Tesla’s charging standard
7/3/2023,Here’s what analysts are saying after Tesla’s second-quarter vehicle deliveries report
9/30/2023,"Stocks making the biggest moves midday: Tesla, Nike, Carnival, Nvidia and more"
11/9/2023,"Here are Thursday’s biggest analyst calls: Nvidia, Disney, Tesla, Instacart, Arm, Rivian, Target & more"
11/10/2023,"Not being a union shop gives Tesla ‘flexibility’, says Craft Ventures’ David Sacks"
