Date,News Title
4/27/2021,"‘Tesla is egregiously overvalued,’ says analyst"
4/27/2021,"Q1 margins likely weak, but investors will look past, says Tesla analyst"
4/27/2021,Tesla and Alphabet are set to report earnings — what Wall Street expects to see
4/27/2021,Former Tesla board member on earnings and China competition
4/27/2021,Tesla beats top and bottom line in Q1
4/27/2021,"Stocks making the biggest moves after the bell: Tesla, Snap, GameStop & more"
4/27/2021,Higgins: Tesla is still the company to beat in the EV space
4/27/2021,Tesla earnings show ‘definitional growth story’: Loup Ventures’ Munster
4/27/2021,Dan Niles on Tesla earnings and the names he’s watching
4/27/2021,Dan Niles explains why he shorted Tesla despite loving EV space
4/28/2021,"Stocks making the biggest moves midday: Tesla, Crocs, UBS & more"
4/28/2021,Tesla stock slumps despite record quarter: CNBC After Hours
5/8/2021,"Cathie Wood talks about her top disruptive ideas, including Netflix and Tesla"
5/11/2021,"Tesla, GM and Visa among the ‘Memorial Day trade’ stocks to play, Jim Cramer says"
5/12/2021,"Stocks making the biggest moves midday: Roblox, Palantir, Tesla, Virgin Galactic & more"
5/13/2021,Tesla suspends use of bitcoin as payment over environmental concerns
10/4/2021,Missed out on Tesla? Wall Street analysts name their top EV stocks for this quarter
10/4/2021,"Here are Monday’s analyst calls of the day: Wendy’s, Southwest Airlines, Tesla, Boeing, Amazon & ..."
10/8/2021,Previewing Tesla’s 2021 shareholder meeting
10/8/2021,Watch CNBC’s full interview with Canaccord’s Dorsheimer on Tesla’s upcoming shareholder meeting
10/8/2021,Here are key takeaways from Tesla’s annual investor meeting
10/8/2021,"Jim Cramer on September jobs report, Tesla’s move to Texas and more"
10/12/2021,"Here are Tuesday’s biggest analyst calls of the day: Tesla, Alphabet, Caterpillar, DraftKings & more"
10/16/2021,"Earnings are the big catalyst for stocks in the week ahead, as Tesla and Netflix ..."
10/19/2021,Kelly Evans: The lure of Tesla
10/20/2021,This is what one global automotive analyst will be looking for in Tesla’s Q3 results
10/21/2021,This analyst’s Tesla’s price target is $150 with a ‘neutral’ rating
10/21/2021,Tesla’s solid Q3 beat on both the top and bottom lines
10/21/2021,Canaccord’s Jed Dorsheimer says Tesla numbers strong across the board
10/21/2021,"Stocks making the biggest moves after hours: IBM, CSX, Tesla, Lam Research & more"
10/21/2021,CFRA’s Garrett Nelson breaks down Tesla’s record quarterly results
10/21/2021,Tesla’s unit growth is insufficient to match valuation: GLJ’s Johnson
10/21/2021,Needham’s Raj Gill breaks down Tesla’s strong Q3 earnings
10/22/2021,"Stocks making the biggest moves midday: IBM, Tesla, Crocs, Digital World Acquisition and more"
10/24/2021,Chinese EV maker Xpeng launches upgraded semi-autonomous driving features in a challenge to Tesla
10/25/2021,"Here are Monday’s biggest analyst calls of the day: Disney, Amazon, Tesla, Microsoft & more"
10/25/2021,"Dow, S&P 500 close at records ahead of Big Tech earnings, Tesla jumps 12% to ..."
10/26/2021,Watch CNBC’s full interview with Wedbush’s Dan Ives on Tesla’s new market cap
10/26/2021,"The best trades on CNBC Monday: Facebook, Alphabet, Tesla and more"
10/26/2021,NTSB chair on why Tesla’s self-driving technology is ‘misleading’
10/28/2021,"Here are Thursday’s biggest analyst calls of the day: Apple, Boeing, Tesla, Ford, GM, Uber ..."
10/29/2021,"Stocks making the biggest moves midday: Ford, eBay, Apple, Tesla, Merck and more"
10/30/2021,"Best trades on CNBC Friday: Cramer’s energy pick, Tesla’s $2 trillion growth prediction, Apple, and ..."
11/2/2021,"Jim Cramer discusses Tesla’s Hertz deal, Paypal and more"
5/13/2022,"‘Musk has to focus on Tesla the stock, not just the Twitter deal,’ says Margins’ ..."
5/16/2022,"Here are Monday’s biggest analyst calls: Tesla, SoFi, Target, Netflix, Boeing, Cigna, Nio & more"
5/20/2022,"Cisco, Tesla, and Ally are some of today’s stocks: Pro Market Movers May 19"
6/4/2022,"Tesla, Apple, and Netflix are some of today’s stocks: Pro Market Movers June 3"
3/11/2024,A ‘$28 trillion opportunity’: Ark Invest reveals its top AI plays right now
4/5/2024,"Poor resale values of EVs threaten adoption, warn some experts"
11/23/2019,Tesla’s plan to leave the auto industry behind on in-car infotainment
11/24/2019,"Elon Musk says Tesla has received 200,000 orders for its Cybertruck despite botched debut"
12/5/2019,"Tesla promises Roadster owners dedicated service advisors, technicians and repair centers"
12/9/2019,"A Tesla on Autopilot rear-ended a parked police car, renewing safety concerns"
12/13/2019,Tesla loses its third general counsel in the last year
12/14/2019,"Tesla’s Musk says solar, energy storage will grow faster than electric cars, and there’s some ..."
12/17/2019,Tesla puts up tents to hide its ‘solar test house’ in California
1/1/2020,US auto safety agency to probe fatal Tesla crash in Los Angeles
1/3/2020,"Tesla tops Wall Street estimates with a record 112,000 vehicle deliveries in fourth quarter"
1/8/2020,"With Tesla at all-time highs, Cramer and other pros see more runway"
1/13/2020,Tesla stock closes at an all-time high over $524
1/14/2020,Cramer on BlackRock’s climate change investing shift: ‘Tesla is the ultimate Larry Fink stock’
1/15/2020,Tesla stock surge positions Elon Musk for $346 million payout
1/16/2020,Tesla sales employees petition for higher base pay after commission cuts in 2019
1/17/2020,"Apple and Tesla may be market darlings, but hedge funds are betting big they’ll collapse"
1/18/2020,Federal agency looking into Tesla driver complaints of sudden unintended acceleration
1/23/2020,Tesla short sellers could help Elon Musk score a payday worth hundreds of millions
1/23/2020,"UBS recommends selling Tesla, says stock is ‘over-shooting right now’"
1/24/2020,"Tesla could eventually reach a trillion-dollar valuation, think tank says"
1/29/2020,Jim Cramer: Expect Tesla’s stock to fall hard on an earnings miss
1/30/2020,"Tesla spikes on earnings beat, says Model Y production underway"
2/4/2020,Tesla shares end Tuesday 13% higher after surging as much as 23% earlier in the ...
2/5/2020,Tesla draws comparisons to past speculative bubbles: ‘Stock is going to get absolutely clobbered’
2/5/2020,Tesla shorts lost more than $5 billion in two days while Elon Musk’s net worth ...
2/5/2020,Analyst who downgraded red-hot Tesla: ‘We’re certainly not saying short this stock’
2/5/2020,Tesla is up 76% this year. Here’s how the other electric carmakers makers are doing
2/6/2020,Even ‘Big Short’ Steve Eisman is giving up on betting against Tesla
2/6/2020,"Jim Cramer: Tesla’s pullback was inevitable, but the stock remains ‘too legit to quit’"
2/7/2020,"Tesla looks like bitcoin and there’s one way to benefit, trader says"
2/8/2020,Wall Street analysts have never been this bearish on Tesla
2/12/2020,Apple engineer killed in 2018 Tesla crash had complained about Autopilot
2/13/2020,"Tesla shares rise, reversing early losses following $2 billion stock offering"
2/13/2020,"Analyst with $1,000 bull case on Tesla: New $2 billion offering eliminates ‘doomsday’ cash worries"
2/14/2020,Why Elon Musk’s controversial $2 billion Tesla stock offering makes sense
2/14/2020,‘Dean of valuation’ says Tesla would need VW-like sales and Apple-like margins to justify stock
2/15/2020,Tesla aims to revitalize its solar energy and storage business this year after 2019 slump
2/19/2020,"Leon Cooperman says the market has become too pessimistic on energy stocks, too euphoric on ..."
2/20/2020,"Investors should consider selling some Tesla shares and ‘let the rest run,’ Jim Cramer says"
2/20/2020,Investor Ron Baron is making a killing on Tesla. Here’s what else his fund is ...
2/25/2020,Jefferies downgrades Tesla as analyst says valuation at unsustainable levels
2/26/2020,"NTSB calls out Tesla and Apple for neglecting driver safety, calls Tesla Autosteer ‘completely inadequate’"
2/26/2020,Tesla share price has dropped by more than $100 in two days
2/28/2020,"Speculative stocks Virgin Galactic, Tesla and Plug Power are cratering"
3/14/2020,Tesla shareholder trial delayed by judge due to coronavirus concerns
3/16/2020,"Tesla is still not cheap after 40% plunge, Bernstein says"
3/18/2020,Tesla stock drops after hours as county says Fremont factory is not an ‘essential business’
4/6/2020,"Here’s how Tesla stock swings 18% higher, trader says"
4/22/2020,"Investors pick Tesla over GM, Toyota to lead emerging auto tech post-coronavirus crisis"
4/27/2020,Tesla asks employees to resume production at Fremont car plant despite coronavirus health orders
5/2/2020,"History shows when Elon Musk gets negative on Tesla’s stock, you should too"
7/9/2020,"Oppenheimer’s Colin Rusch on Tesla’s fair value, potential competition and more"
7/25/2020,Elon Musk keeps changing when Tesla Full Self-Driving will be complete — here’s why it ...
8/8/2020,NYU’s ‘dean of valuation’ says Nikola exists ‘to make Tesla look cheap’
8/12/2020,Cramer says Tesla’s stock split is good for the market because it appeals to young ...
8/13/2020,Tesla shares surge day after stock split announced
8/14/2020,"GM should spin off its electric unit to capture some of that Tesla market mojo, ..."
8/19/2020,"Three reasons why Tesla stock keeps rising, even without big headlines"
8/25/2020,Tesla’s Musk hints of battery capacity jump ahead of industry event
9/2/2020,"When it comes to Apple and Tesla stock splits, investors should tread lightly, advisors say"
9/2/2020,"Tesla shares fall as largest outside shareholder cuts holding, citing portfolio restrictions"
9/5/2020,"Tesla falls after S&P 500 adds Etsy and two others, bypassing carmaker"
9/8/2020,S&P’s Tesla snub shows the risks to this overheating Nasdaq trade
9/10/2020,"Tesla jumps nearly 11%, rebounding from worst day on record"
9/11/2020,"A Biden presidency could give a boost to Tesla, says Oppenheimer"
9/15/2020,"Tesla shares jump more than 12% amid tech rebound, Goldman comments"
9/23/2020,"‘Every auto company in the world is coming for Tesla’s neck,’ says Tesla bear"
9/24/2020,ARK Invest analyst expects Tesla to achieve its long-term goals
9/26/2020,"How Tesla, GM and others aim to fix electric vehicle range anxiety"
10/14/2020,Billionaire investor Ron Baron: Tesla will become a $2 trillion company
10/17/2020,Four years ago Elon Musk announced all Tesla cars have the hardware needed for full ...
10/20/2020,GM’s official run at Tesla starts with its electric Hummer debut Tuesday night
10/28/2020,Tesla’s Autopilot a ‘distant second’ to GM’s Super Cruise system in Consumer Reports testing
1/25/2021,Shares of Evergrande’s electric car unit pop 67% after raising billions to compete with Tesla ...
1/25/2021,"5 ways Biden can help Tesla, GM and others increase electric vehicle sales in the ..."
1/26/2021,What to watch ahead of Tesla and Apple quarterly earnings
1/28/2021,"Tesla had an ‘A+’ quarter, says Wedbush Securities’ Dan Ives"
1/28/2021,Tesla bear reacts to Q4 earnings miss
1/29/2021,"Stocks making the biggest moves midday: GameStop, AMC Entertainment, Tesla and more"
2/1/2021,Missed out on Tesla? Morgan Stanley picks 3 electric car stocks that could bring double-digit ...
2/2/2021,"Here are Tuesday’s biggest analyst calls of the day: Tesla, Dell, McAfee, Boeing & more"
2/8/2021,Tesla buys $1.5 billion in bitcoin: SEC filing
2/8/2021,"Tesla buying bitcoin will have ripple effect, says Wedbush’s Dan Ives"
2/8/2021,Muddy Waters’ Carson Block on Tesla buying $1.5 billion in bitcoin
2/8/2021,Full interview with Galaxy Digital’s Novogratz on Tesla buying $1.5 billion worth of bitcoin
2/8/2021,"Major shareholder Ron Baron says Tesla bitcoin investment ‘not surprising,’ wants to explore rationale"
2/8/2021,"Tesla plans to accept bitcoin as a form of payment, says SEC filing"
2/9/2021,"Stocks making the biggest moves midday: Tesla, Palantir, Hasbro, Target and more"
2/9/2021,How former SEC executives view Tesla buying bitcoin
2/9/2021,"PRO Microstrategy CEO on Tesla’s bitcoin bet, bitcoin going corporate and more"
2/9/2021,"Ark Invest’s Tasha Keeney on Tesla’s bitcoin bet, the future of bitcoin and more"
2/9/2021,Tesla’s China sales more than doubled in 2020
2/18/2021,"Ark’s Cathie Wood: Confidence growing in Tesla, buying more"
2/20/2021,"Tesla is a buy on recent weakness, trader says, and here’s why"
2/22/2021,Wedbush’s Dan Ives on his estimate that Tesla has made roughly $1 billion in profits ...
2/24/2021,How Tesla and bitcoin are tethered together
2/24/2021,Tesla stock falls more than 10% in two days as bitcoin also tumbles: CNBC After ...
2/24/2021,Here’s why Tesla shares are falling after a strong 2020
2/26/2021,Op-ed: Investors chasing bitcoin and Tesla should have real goals — and shouldn’t forget them
2/26/2021,Fisker CEO: Our goal is not to appeal to just Tesla drivers but all new ...
2/27/2021,Morgan Stanley’s Adam Jonas on investing in Tesla vs. General Motors
3/1/2021,Tesla bull and bear debate the stock’s major tumble
3/2/2021,Chinese Tesla rival Nio says global chip shortage will hit its electric car production
3/3/2021,Former Tesla board member on the electric vehicle race
3/3/2021,"Here are Wednesday’s biggest analyst calls of the day: Lyft, Roku, Tesla, Virgin Galactic & ..."
3/4/2021,Billionaire investor Ron Baron’s firm sold 1.8 million Tesla shares
3/5/2021,"Time to add to Tesla shares in latest Nasdaq sell-off, trader says"
3/6/2021,Roth Capital analyst weighs in what drives the valuation of Tesla
3/10/2021,Why this analyst increased Tesla’s price target to $900
3/10/2021,Options Action: Bet on Tesla
3/10/2021,Chinese electric carmakers add $13.65 billion in value as Tesla surges
3/11/2021,"Investors are trading momentum with Tesla, says Roth Capital’s Irwin"
3/11/2021,Roth Capital’s Craig Irwin on the trading frenzy surrounding Tesla
3/12/2021,This analyst explains his buy rating on Tesla with a $775 price target
3/12/2021,Why this analyst says Tesla is a ’100-year disruptor’
3/13/2021,Tesla CEO Elon Musk sued for tweeting in violation of SEC deal: Report
3/13/2021,"TD Ameritrade’s JJ Kinahan says people want to be involved in Tesla, Nio"
3/15/2021,Chinese Tesla rival Xpeng Motors gets $76 million investment from government
3/16/2021,"We want to overtake Tesla, Volkswagen’s CEO says"
3/16/2021,"Tesla valuation has created an ‘anti-bubble’ for these stocks, says fund manager"
3/17/2021,"‘I think Tesla is going down,’ says fund manager"
8/9/2021,"Here are Monday’s biggest analyst calls of the day: Amazon, Walmart, Tesla, Coinbase, Apple & ..."
8/9/2021,Bernstein’s Toni Sacconaghi on why Tesla’s growth in China faces challenges
8/12/2021,Chinese Tesla rival Nio narrows losses as revenue surges 127%
8/14/2021,"Beyond Meat, Tesla make list of stocks with problems to avoid or short, says Wolfe ..."
8/16/2021,U.S. launches investigation into Tesla’s autopilot
8/17/2021,"Stocks making the biggest moves midday: Walmart, Tesla, Rocket, Sonos and more"
8/18/2021,Chinese Tesla rival Xpeng expands production capacity as competition heats up
8/19/2021,What investors need to know about Tesla’s AI day
8/20/2021,Andrew Hawkins of The Verge on the highlights from Tesla’s AI Day
8/20/2021,"Here are Friday’s biggest analyst calls of the day: Microsoft, Tesla, Peloton, Netflix, Dell & ..."
8/20/2021,Loup Ventures’ Gene Munster and GLJ Research’s Gordon Johnson on Tesla’s humanoid robot reveal
8/24/2021,"Here are Tuesday’s biggest analyst calls of the day: Tesla, Apple, FedEx, Zoom, First Solar ..."
9/8/2021,"Stocks making the biggest moves premarket: Coinbase, Tesla, Citrix PayPal and more"
9/16/2021,"Here are Thursday’s biggest analyst calls of the day: Tesla, Exxon, Chipotle, DoorDash, Uber & ..."
9/16/2021,"Direct indexing is like customizing a Tesla, but with your portfolio, investor says"
9/17/2021,"Here are Friday’s biggest analyst calls of the day: Tesla, Costco, GE, Plug Power, Facebook ..."
4/12/2022,CNBC Pro Talks: Tesla vs. Nio? Amazon vs. Alibaba? Investor Sid Choraria picks his favorites ...
4/13/2022,Big call buying in Tesla
4/13/2022,Cramer’s lightning round: I like Tesla over Sunrun
4/14/2022,"Tesla shareholders should be concerned with Elon’s bid for Twitter, says The Verge’s Patel"
4/15/2022,"When Musk tried to take Tesla private, he had no plan, says The New York ..."
4/15/2022,Jim Cramer gives his take on Tesla CEO Elon Musk’s bid to buy Twitter
4/21/2022,"Best trades on CNBC Thursday: Pros look at Dow and Tesla, and why Josh Brown ..."
4/21/2022,"U.S. stocks point to positive open following Tesla, United Airlines earnings"
4/22/2022,"Dow, Tesla and Twilio are some of today’s stocks: Pro Market Movers April 21"
4/22/2022,"Here are Friday’s biggest analyst calls of the day: WeWork, Amazon, Apple, Dow, United, Tesla ..."
4/23/2022,"Single-stock ETFs are on the rise: Amplifying bets on big names like Amazon, Apple and ..."
5/3/2022,"Musk seeking Twitter financing is a positive for Tesla stock, says Dan Ives"
1/28/2021,What Gene Munster expects to hear on the Tesla earnings call
1/28/2021,Tesla misses on earnings
4/4/2024,CNBC Daily Open: Disney wins proxy fight
4/4/2024,"Thursday’s analyst calls: Upside ahead for Amazon and Meta, but a ‘rate trap’ looms for ..."
4/4/2024,Why hybrid sales are surging
4/4/2024,"Trump defends Truth Social as media company’s skeptics grow, stock price whipsaws"
7/27/2019,JB Straubel wasn’t just Tesla’s CTO — he invented the carmaker’s core technologies
8/6/2019,"Tesla has started a new anti-fraud department, according to a recent job listing"
9/5/2019,"Tesla Model S crash result of user error and Autopilot design, says NTSB"
10/7/2019,Tesla reportedly bought a company that specializes in high-speed battery manufacturing
11/11/2019,Jefferies: Tesla will climb to $400 after third quarter showed path of ‘sustained profitability’
11/21/2019,Tesla and Uber draw scrutiny at Senate hearing on self-driving cars: ‘That’s not safe!’
11/23/2019,Tesla Cybertruck: 5 important questions about the polarizing EV
11/27/2019,"Elon Musk suggests Tesla has received 250,000 pre-orders for its Cybertruck"
11/30/2019,"Tesla, GE and Uber make list of the most divisive stocks on Wall Street"
12/4/2019,"Tesla is poised to deliver Model Y crossover in first quarter of 2020, says Deutsche ..."
12/6/2019,"A top Tesla analyst raised his ‘bull case’ for the stock to $500, or 50% ..."
12/16/2019,Wall Street bear concedes Tesla is way ahead of others in one key area of ...
12/19/2019,"The last time Tesla reached these highs, it quickly got cut in half"
12/20/2019,"Mahjong, cartoons coming to Tesla car screens in China next year"
12/23/2019,"Tesla to take new $1.4 billion loan from Chinese banks for Shanghai factory, sources say"
12/23/2019,Tesla stock reaches $420 more than a year after Musk’s notorious ‘funding secured’ tweet
12/27/2019,Tesla set to begin deliveries of China-made Model 3 cars on December 30
12/30/2019,"Tesla to miss delivery forecast and stock to get cut in half, Cowen says"
1/7/2020,"Tesla bear is forced to hike price target after rally, but still expects a 25% ..."
1/7/2020,Watch Elon Musk dancing at Tesla’s Gigafactory in China
1/8/2020,Cramer: I believe in Tesla stock because of how quickly Elon Musk found success in ...
1/8/2020,"Tesla price target raised to $556 by Argus Research, highest on Wall Street"
1/8/2020,"‘Too late to buy, but too early to sell’: Traders grapple with Tesla’s roaring run"
1/10/2020,Tesla shares could dive into ‘deep pessimism’ after 100% rally in three months
1/14/2020,"Tesla rally won’t stop at $500, recent stock trading history suggests"
1/21/2020,"Tesla shares will rally 50% to $800, says Street’s biggest bull on the stock"
1/31/2020,Tesla spikes on earnings – here’s what to watch next
1/31/2020,"Tesla directors settle, isolating Musk as SolarCity trial looms"
2/4/2020,"Tesla short sellers are down $8 billion in 2020, including $2.5 billion alone from Monday’s ..."
2/6/2020,Ralph Nader says SEC should probe Tesla trading based on the stock’s recent spike higher
2/6/2020,Tesla shares slammed day after surge—what Cramer and others are watching now
2/8/2020,Tesla’s stock just had one of the wildest weeks ever — here’s what happened
2/12/2020,China and Tesla: Here’s what’s hot in the ETF space right now
2/13/2020,Cramer: Tesla’s new stock offering is smart because ‘the world’s changed’ since the coronavirus
2/14/2020,Tesla acknowledges ‘health epidemics’ as new risk in financial filing amid coronavirus outbreak
2/17/2020,Tesla ordered to halt work on German factory amid anger over chopping down trees
2/18/2020,Bill Gates bought himself a Porsche over a Tesla — and Elon Musk just called ...
2/20/2020,"Watch out for single-stock risk as Chinese equities slide, Tesla soars: ETF manager"
4/30/2020,Elon Musk says orders to stay home are ‘fascist’ in expletive-laced rant during Tesla earnings ...
5/8/2020,Tesla’s Fremont plant will resume ‘limited operations’ on Friday
5/8/2020,Tesla shares are up more than 7% since Elon Musk said the stock was ’too ...
5/9/2020,These experts think Tesla’s in a better position than other US automakers to survive the ...
5/12/2020,Elon Musk could save billions in taxes if Tesla moves its headquarters to Nevada or ...
5/12/2020,Chamath Palihapitiya defends Elon Musk’s decision to open Tesla production in defiance of local authorities
5/13/2020,Dispute over re-opening Tesla’s California factory may be over
6/12/2020,"Goldman Sachs and Morgan Stanley downgrade Tesla, saying the stock has gotten ahead of itself"
6/20/2020,"On the morning of Juneteenth, Tesla tells employees they can take the day off unpaid"
6/22/2020,Elon Musk says Tesla shareholder meeting and ‘Battery Day’ tentatively set for Sept. 15
6/24/2020,U.S. opens probe into Tesla Model S after touchscreen failure reports
6/30/2020,"Tesla and the science behind the next-generation, lower-cost, ‘million-mile’ electric-car battery"
7/1/2020,Tesla tops Toyota to become largest automaker by market value
7/2/2020,"Tesla delivers 90,650 vehicles in Q2, beating expectations"
7/9/2020,EV related stocks surge as Tesla shares continue to rise
7/10/2020,Tesla stock surges more than 200% in 2020 – three experts on what comes next
7/13/2020,Elon Musk is now worth more than Warren Buffett as Tesla stock continues to break ...
7/14/2020,"Tesla stock went into reverse and took the Nasdaq with it, possibly signaling near-term top"
7/21/2020,Cramer says moves in tech stocks are ‘truly insane’ as Amazon and Tesla climb
7/23/2020,"Tesla, Porsche and Dodge create the most joy for owners, says J.D. Power"
7/23/2020,"Stocks making the biggest moves after hours: Microsoft, Tesla, Chipotle and more"
7/24/2020,Tesla trounces earnings expectations. What’s next for the stock
7/28/2020,"Bernstein downgrades Tesla, calls valuation ‘mind-boggling’ and ‘unprecedented’ since tech bubble"
7/29/2020,Why Bernstein’s Sacconaghi cut Tesla to underperform
8/4/2020,"Shares of electric vehicle makers Nio and Nikola could be a better bet than Tesla, ..."
8/7/2020,GM’s push to compete with Tesla begins with Cadillac Lyriq crossover debut Thursday
8/12/2020,"Electric vehicle company Nio could be the ‘Tesla of China,’ Piper Sandler says"
8/14/2020,"Here are Friday’s biggest analyst calls of the day: Tesla, CrowdStrike, Walmart, Marriott & more"
8/28/2020,"Apple, Tesla stock splits may keep the tech rally going: Market strategist"
8/31/2020,"Leon Cooperman says Apple, Tesla splits don’t create value and calls Robinhood traders ‘nuts’"
9/1/2020,"Mike Santoli’s market notes: Apple & Tesla ripping, Dow loses Apple boost, volatility rising"
9/1/2020,Apple and Tesla are doing stock splits. Here’s what that actually means to investors
9/1/2020,Bespoke Investment’s Paul Hickey discusses the Apple and Tesla stock splits
9/1/2020,Tesla to raise up to $5 billion in share offering
9/3/2020,"Stocks making the biggest moves midday: Tesla, AMC, DraftKings, Peloton & more"
11/27/2020,"U.S. agency opens probe into 115,000 Tesla vehicles over suspension issue"
11/28/2020,"Tesla isn’t dominating the electric bike market, but here are the players that might"
12/1/2020,Jim Cramer on finding the next Tesla
12/1/2020,Tesla exec leaves to join U.K. start-up trying to combat the world’s plastic crisis
12/2/2020,"Stocks making the biggest moves midday: Zoom Video, Nikola, Tesla and more"
12/4/2020,Why Goldman Sachs upgraded Tesla
12/4/2020,Tesla upgraded to Buy at Goldman
12/4/2020,Traders talk key buy and sell levels for Tesla
12/4/2020,Tesla and Roku shares help power this ETF to more than double in 2020
12/7/2020,"Tesla’s story is going to evolve in the years to come, says Loup Ventures’ Munster"
12/8/2020,"Stocks making the biggest moves midday: Tesla, Kodak, Lyft, Interactive Brokers & more"
12/8/2020,Cramer on Tesla’s plans to sell $5 billion in stock ‘from time to time’
12/9/2020,Tesla CEO Elon Musk says he has moved to Texas
12/9/2020,Jim Cramer: Why young investors love buying Tesla
12/15/2020,Tesla shows the impact of disruptive companies on index funds
12/18/2020,Wedbush’s Dan Ives: Tesla is not a car company
12/19/2020,Jay Leno discusses why Tesla’s vehicles are successful
12/21/2020,"Here are Monday’s biggest analyst calls of the day: Tesla, Walmart, Microsoft, FireEye & more"
12/22/2020,"Stocks making the biggest moves midday: Nike, Tesla, JPMorgan, American Airlines & more"
12/22/2020,These EV stocks will give you ‘Tesla-like returns’: Roth Capital
