Date,News Title
12/24/2021,"NVIDIA, Tesla, and UPS are today’s top stock picks for investors: Pro Market Movers Dec. ..."
12/30/2021,"Tesla, Starbucks, and PayPal are some of today’s top stocks for investors: Pro Market Movers ..."
12/30/2021,"Best trades on CNBC Wednesday: Tesla’s valuation debate, pros’ energy stock picks, and top metaverse ..."
12/31/2021,"Tesla, Microsoft, and Moderna are some of today’s top stocks for investors: Pro Market Movers ..."
1/3/2022,"Here are Monday’s biggest analyst calls of the day: Tesla, Citi, Amazon, Starbucks, Chevron and ..."
1/4/2022,"Tesla, UnitedHealth, and ON Semiconductor are some of today’s top stocks: Pro Market Movers Jan. ..."
1/6/2022,"Micron, Tesla, and Robinhood are some of today’s stock picks for investors: Pro Market Movers ..."
1/7/2022,"Oppenheimer’s Colin Rusch breaks down shares of EV makers Rivian, Tesla and more"
1/10/2022,"Here are Monday’s biggest analyst calls of the day: Tesla, Amazon, SolarEdge, Apple, Exxon & ..."
1/11/2022,"Here are Tuesday’s biggest analyst calls of the day: Amazon, Tesla, AT&T, IBM, Krispy Kreme ..."
1/12/2022,Bulls bet on Tesla
1/14/2022,"Snapchat, Amazon, and Tesla are some of today’s top investments: Pro Market Movers Jan. 13"
1/14/2022,"Best trades on CNBC Thursday: Amazon, Tesla and other tech stocks pros are buying on ..."
1/19/2022,"Here are Wednesday’s biggest analyst calls of the day: Apple, Netflix, PayPal, Exxon, Tesla & ..."
1/20/2022,California man charged after Tesla autopilot crash
12/29/2021,Should investors sell Tesla to switch to semiconductor names?
4/27/2021,Loup Ventures’ Gene Munster gives his take on Tesla’s quarter
4/27/2021,Reacting to Tesla’s earnings call
1/9/2023,Nasdaq notches second day of gains as investors buy beaten-up tech shares like Tesla
4/3/2024,CNBC Daily Open: Projections are not promises
4/3/2024,CNBC Daily Open: A projection is not a promise
9/7/2018,Tesla CTO JB Straubel has a stealthy recycling start-up and it’s expanding into Nevada
9/18/2018,UBS says Audi’s new electric car shows industry has a long way to go to ...
9/29/2018,Tesla’s Musk chose to ‘roll the dice’ with the SEC and that creates a huge ...
10/2/2018,Tesla will screen ‘Cars 3’ at Gigafactory as thank you to employees
11/20/2018,Tesla is turning to partners to help with a growing used-car business
11/18/2019,Tesla Supercharger catches fire at a Wawa store in New Jersey
11/21/2019,"Tesla has been ahead of the shift in technology, BlackRock’s Rieder says"
11/23/2019,Tesla falls more than 6% after Cybertruck flub—Cramer and other pros talk prospects
11/26/2019,Elon Musk’s tweets about Tesla’s Cybertruck ‘orders’ tell us very little about actual future sales
11/26/2019,Ford challenged Tesla to an ‘apples to apples’ tug-of-war between pickup trucks
11/28/2019,Tesla stock has been a ‘turkey’ this year-to-date: Investing pro
12/4/2019,"“Tesla is a must-own stock,” Piper Jaffray says"
12/9/2019,"Here’s why Tesla is a ‘faith stock,’ according to trader"
12/10/2019,Check out this footage of a Tesla Cybertruck driving on a Los Angeles freeway
12/20/2019,"Tesla, GM and others hyped up emerging technologies in autos. Now they have to deliver"
12/28/2019,No other automaker growing like Tesla: Former board member
1/3/2020,"Tesla delivered 367,500 vehicles in 2019"
1/7/2020,Tesla delivers China Model 3 to Chinese public
1/8/2020,"Everything Jim Cramer said about the stock market on ‘Mad Money,’ including preparation for a ..."
1/10/2020,Investors that are long Tesla should take some profits now: Investing pro
1/11/2020,"Facebook, Tesla and Netflix comebacks show how investors can overreact to headlines and miss out"
1/16/2020,Tesla shares fall after Morgan Stanley recommends dumping the stock. Here are the details
1/23/2020,"Everything Jim Cramer said about the stock market on ‘Mad Money,’ including stocks worth buying, ..."
1/23/2020,"Tesla is paving the way and we appreciate that, VW CEO says"
1/30/2020,Tesla Q4 earnings: $2.14 EPS VS. $1.72 estimated
1/30/2020,Tesla beats Wall Street estimates on Q4 earnings
1/31/2020,"Stocks making the biggest moves midday: Tesla, Penn National Gaming, Facebook, Microsoft & more"
1/31/2020,Jim Cramer: Tesla’s success is reminiscent of Amazon and Netflix
1/31/2020,"Everything Jim Cramer said about the stock market on ‘Mad Money,’ including coronavirus and recession ..."
2/4/2020,"Stocks making the biggest moves midday: Tesla, Gilead Sciences, Nike, Uber & more"
2/4/2020,"Dow soars more than 400 points, Tesla surge leads Nasdaq to all-time high"
2/4/2020,"Tesla’s surge is largely due to fear of missing out, says ROTH’s Irwin"
2/5/2020,Tesla CEO Elon Musk got $4.5 billion richer overnight
2/5/2020,"Cash dynamics at Tesla seem to be turning, strategist says"
2/6/2020,Why Greycroft’s Alan Patricof says Tesla may be a ‘cult story’
2/6/2020,"Ralph Nader: SEC should investigate Tesla for possible insider trading, market manipulation"
2/6/2020,"Everything Jim Cramer said about the stock market on ‘Mad Money,’ including Mayor Pete’s rise, ..."
2/10/2020,"One auto stock is a better bet than Tesla after head-spinning week, two traders say"
2/11/2020,Millennial clients small net buyers of Tesla in February: TD Ameritrade
2/11/2020,Tesla stock rises on Shanghai factory optimism—what to watch now
2/11/2020,"Trump budget would cut loan program for vehicle production used by Tesla, Ford"
5/9/2020,Tesla hasn’t received permission to resume production in Bay Area—Reuters
5/9/2020,Tesla secures $565 million loan for Shanghai factory
5/9/2020,Why some experts believe Tesla is better positioned to survive this recession than other US ...
5/11/2020,Elon Musk threatens to move Tesla HQ out of California over Covid-19 restrictions
5/12/2020,Elon Musk threatens to move Tesla headquarters out of Calif. over lockdown
5/12/2020,New UAL president; Musk tweets he will restart Tesla production today
5/12/2020,Tesla CEO Elon Musk defies stay-at-home order in Alameda County in California
5/13/2020,How Elon Musk could save billions by moving Tesla HQ out of California
5/13/2020,"Musk isn’t bluffing about moving Tesla out of California, says Recode’s Kara Swisher"
5/14/2020,"California AG Xavier Becerra on Tesla, lawsuit against Uber and Lyft"
5/16/2020,"Tesla planning to build factory in Austin, Texas: Electrek"
5/19/2020,GM is developing next-gen ‘Ultra Cruise’ semi-autonomous driving system to combat Tesla’s Autopilot
5/22/2020,Elon Musk and Jay Leno talk about the 2020 Tesla Roadster
5/22/2020,Elon Musk and Jay Leno get behind the 2021 Tesla Cybertruck
5/27/2020,Elon Musk and Jay Leno go for a spin in the 2021 Tesla Cybertruck
5/28/2020,Tesla CEO Elon Musk joins ‘Jay Leno’s Garage’
5/28/2020,What SpaceX’s historic NASA launch could mean for Elon Musk and Tesla
5/29/2020,Jim Cramer: Tesla will crush the high-end car market
6/5/2020,Tesla could be headed for more gains after triple-digit rally this year
6/9/2020,Ron Baron: There’s still plenty of room for growth for Tesla and SpaceX
6/9/2020,Why this Wireless Fund’s Paul Meeks says Tesla isn’t a good short-term investment
6/10/2020,Elon Musk: It’s time to bring Tesla Semi to volume production
6/13/2020,Tesla shares tumble after two analyst downgrades. How to trade the dip
6/18/2020,"Here are Thursday’s biggest analyst calls of the day: Tesla, Shopify, PayPal & more"
6/19/2020,"Tesla to $1,200? Traders share outlook after Jefferies call"
6/19/2020,"Newton Investment Management’s Seyi Bucknor on Tesla valuation, ESG"
6/23/2020,"Google, Apple, Amazon and Tesla slam Trump’s immigration crackdown"
6/25/2020,Tesla continues to struggle with handling volume increase: WSJ’s Higgins
6/26/2020,Tesla shares climb despite dismal survey results. Here’s where it’s headed next: Ark Invest
6/29/2020,Here’s a timeline of Tesla’s bull run over the past decade
6/29/2020,"Ark Invest: We expect further consolidation in traditional auto space, paving way for Tesla to ..."
6/30/2020,"Trading Nation: Tesla hits 10 years since IPO, here’s what could be next"
7/2/2020,Tesla hits record high—Here’s what investors should know
7/2/2020,Options traders bet on Tesla shares to hit the ‘gas’
7/3/2020,"Stocks making the biggest moves midday: Tesla, Avis Budget, Lemonade, Spotify & more"
7/3/2020,Tesla unlocking new customers with ongoing cost improvements: Analyst
7/3/2020,"Tesla stock hits record high and smashes Wall Street expectations, plus everything else you missed: ..."
7/3/2020,Tesla could deliver 10 million electric cars annually by 2030: Gene Munster
7/6/2020,"Stocks making the biggest moves midday: Uber, Spotify, Tesla, Dominion Energy, Zoom Video & more"
7/7/2020,"Stocks making the biggest moves after hours: Tesla, Red Rock Resorts, Fitbit and more"
7/7/2020,"Tesla’s future comes down to profitability, says Wedbush’s Dan Ives"
7/8/2020,Tesla shares hit another record high for the fifth day in a row
7/9/2020,Barclays to Tesla bears: ‘Stay in your caves’
7/9/2020,Tesla shares surge more than 200% in 2020—Watch three experts discuss what’s next for the ...
7/10/2020,Rivian raises $2.5 billion in aggressive plan to beat Tesla and Nikola with the first ...
7/11/2020,"Las Vegas’ losing bet, Tesla’s electric run, Uber’s pricing power and trouble for TikTok"
7/13/2020,Tesla CEO Elon Musk is now the seventh-richest person in the world
7/13/2020,"Tesla earnings will be a linchpin for the stock to move higher, analyst says"
7/14/2020,"Stocks making the biggest moves midday: Pfizer, Apple, Moderna, Tesla, PepsiCo & more"
7/14/2020,"Stocks making the biggest moves after hours: Tesla, BioNTech, Moderna and more"
7/14/2020,"Harrington: Tesla, for the markets, is the poster child of the irrational exuberance of 2020"
7/14/2020,"Tesla doesn’t create big return for shareholders, says former GM vice chair Bob Lutz"
7/14/2020,Jim Cramer: Investors are buying Tesla because of its battery technology
7/15/2020,Morgan Stanley’s Adam Jonas on his underweight rating for Tesla
7/15/2020,"Nearly 50,000 Robinhood accounts added Tesla to holdings in last 24 hours"
7/17/2020,"Stocks making the biggest moves after hours: Netflix, Tesla, J.B. Hunt and more"
1/4/2021,Former Ford CEO Mark Fields on Tesla’s outlook for 2021
1/5/2021,Tesla’s stock strength is surprising: Bernstein’s Sacconaghi
1/5/2021,Tesla’s 2021 challenge will be execution: WSJ’s Tim Higgins
1/6/2021,"Here are Wednesday’s biggest analyst calls of the day: Starbucks, Tesla, Foot Locker, Spotify & ..."
1/7/2021,"Stocks making the biggest moves midday: SunPower, Tesla, Beyond Meat, JPMorgan & more"
1/8/2021,Chinese EV startup Nio aims to become the Tesla of China
1/11/2021,Nio shares surge as much as 13% after getting a host of bullish Street calls ...
1/12/2021,Monday’s Tesla slide drops Elon Musk to second richest person
1/15/2021,"Here are Friday’s biggest analyst calls of the day: Apple, Spotify, Zoom, Snap, Tesla & ..."
1/22/2021,Cramer’s lightning round: ‘I am in the Tesla camp’ over Nio
1/23/2021,"Apple and Tesla earnings, along with the Fed and GDP will drive markets in the ..."
1/28/2021,"Stocks making the biggest moves after hours: Facebook, Tesla, GameStop and more"
1/28/2021,"Here are Thursday’s biggest analyst calls of the day: Tesla, Twitter, Bed Bath & Beyond ..."
2/7/2021,An Apple car would increase pressure on Tesla and other automakers
2/8/2021,"Tesla’s investment in bitcoin is a really big deal, says Galaxy Digital’s Novogratz"
2/8/2021,"Reaction to Tesla’s bitcoin investment will be all over the place, says Mohamed El-Erian"
2/10/2021,"Bitcoin soars above $48,000 to new record after Tesla’s $1.5 billion investment: CNBC After Hours"
2/10/2021,Tesla’s bitcoin investment could provide playbook for other companies to do the same
2/24/2021,"Stocks making the biggest moves midday: Tesla, Home Depot, AMC and more"
11/3/2021,"BMW’s fully electric car sales on track to double this year, but still way short ..."
11/10/2021,"Tesla opening up its charging network a ‘positive step forward’, says ABB’s Theodor Swedjemark"
11/10/2021,Jim Cramer on Tesla dip: Investors need cash ahead of Rivian IPO
11/11/2021,Bullpen Capital’s Duncan Davidson thinks Rivian will do just as well as Tesla
11/11/2021,Elon Musk sells more than $1.1 billion in Tesla stock
11/11/2021,"Rivian, Tesla point the way to a massive transformation: VC John Doerr"
11/19/2021,Chinese Tesla rival Xpeng unveils new electric SUV aimed at international markets
11/20/2021,"Boeing, Tesla, and Mastercard are some of today’s top stock picks: Pro Market Movers Nov. ..."
11/20/2021,"Best trades on CNBC Friday: Cramer backs Boeing, investors buy Bitcoin and a target hike ..."
11/24/2021,"Ark Invest’s Cathie Wood on testing new ‘Ark on steroids’ portfolio, Tesla"
11/24/2021,Tesla shares dip after Elon Musk offloads more stock
11/25/2021,"Zoom Video, Tesla, and Chevron are some of today’s top stock picks: Pro Market Movers ..."
12/4/2021,"Stocks making the biggest moves midday: DocuSign, Didi, Nvidia, Tesla and more"
12/7/2021,"Rivian can grow faster than Tesla, says RBC’s Joseph Spak"
12/8/2021,Missed out on Tesla? Bernstein flags a different way to play the EV trend — ...
12/9/2021,"Watch CNBC’s full interview with Morgan Stanley’s Adam Jonas, who says Rivian is the one ..."
12/14/2021,"Here are Tuesday’s biggest analyst calls of the day: Chevron, Disney, Apple, Tesla, Nike & ..."
3/2/2021,Why Reddit matters more to Tesla’s stock price than fundamentals
1/3/2023,"Stocks close lower on first trading day of 2023, hurt by slumping Apple, Tesla"
3/3/2024,The best EV plays are now in China. Analysts are raising price targets on this ...
4/2/2024,Jim Cramer’s top 10 things to watch in the stock market Tuesday
4/3/2024,"Tuesday’s market sell-off is what happens when stocks are ‘priced for perfection,’ says investor James ..."
4/3/2024,"Mercedes workers in Alabama to file for union vote as soon as this week, sources ..."
5/17/2018,Tesla driver in Utah crash kept taking her hands off wheel as car sped in ...
6/13/2018,Tesla CFO Deepak Ahuja has been through one of the worst rounds of Tesla layoffs ...
6/15/2018,"Cramer: Elon Musk ‘floats like a butterfly, stings like a bee’ versus investors betting against ..."
6/23/2018,Tesla is suing an ex-employee for hacking into its ‘MOS’ software — here’s what that ...
8/26/2018,Inside Elon Musk’s reversal on taking Tesla private
10/1/2018,"Tesla made a record 80,000 vehicles last quarter, report says"
2/11/2019,Tesla shares jump after Canaccord Genuity upgrades the stock and predicts 40% rally
2/21/2019,Tesla has lost more than 40 execs since 2016 — here’s an updated list
8/29/2019,Tesla needs Elon Musk as a thought leader: Energy technology analyst
10/4/2019,Demand for Tesla vehicles in doubt: JMP Securities analyst
10/24/2019,Tesla is one of the most overvalued stocks there is: Strategist
10/25/2019,Tesla shares surge after strong earnings and delivery numbers — Watch five experts debate the ...
10/25/2019,Watch CNBC’s full interview with Tesla Chairwoman Robyn Denholm
11/19/2019,Tesla’s presence could be a ‘positive catalyst’ for China’s electric vehicle market
11/19/2019,Core of Tesla is ‘new architecture’: Academic
11/21/2019,Tesla expected to reveal its new pickup truck model
2/20/2020,"Why retail investors are fueling Tesla, Virgin Galactic rallies"
2/22/2020,Double take on Tesla
2/28/2020,Tesla down 21 percent this past week as momentum stocks hit
3/4/2020,"Stocks making the biggest moves midday: Tesla, Uber, Target, Kohl’s and more"
3/20/2020,"Tesla to suspend production at Fremont, CA, & Buffalo, NY, facilities due to coronavirus"
4/3/2020,Billionaire investor Jim Chanos: Still ‘maximum short’ on Tesla even with recent market moves
4/3/2020,"Tesla Q1 deliveries beat, 88.4K vs. 79K estimated"
4/4/2020,"Stocks making the biggest moves midday: Disney, Peloton, Tesla & more"
4/4/2020,Here’s how high Tesla stock could climb
4/6/2020,Analysts continue to upgrade stocks like Tesla and eBay on hopes the rebound is for ...
4/7/2020,Tesla reveals prototype ventilator made from electric vehicle parts
4/10/2020,Options traders bet Tesla could throttle above $600
4/15/2020,Cramer’s lightning round: Tesla goes higher. Period
4/15/2020,"Stocks making the biggest moves in the premarket: Goldman Sachs, Bank of America, Tesla, Target ..."
4/24/2020,Tesla raises China-made Model 3 prices after EV subsidies cut
4/30/2020,Why this analyst says Tesla will emerge stronger than ever after the downturn
4/30/2020,Analyst on Tesla shares surging after Q1 profit
4/30/2020,Tesla bears should ‘shelter in cave’ until battery announcement: Barclays
5/2/2020,Tesla shares drop after Elon Musk tweets ‘stock price is too high’
5/2/2020,Tesla CEO Elon Musk’s coronavirus rant highlights just one of many hurdles automakers face in ...
5/5/2020,Former Tesla board member Steve Westly on Elon Musk’s tweets and electric car demand
5/6/2020,"Cramer: Tesla is an industry standout, stock will go much higher"
11/18/2020,Here’s what Tesla’s inclusion in the S&P 500 means for the company’s stock
11/18/2020,"Here are Wednesday’s biggest analyst calls of the day: Boeing, Tesla, Honeywell & more"
11/19/2020,"Stocks making the biggest moves midday: TJX, Lowe’s, Boeing, Target, Tesla & more"
11/27/2020,"Stocks making the biggest moves midday: Amazon, Tesla, AstraZeneca, Carnival & more"
12/3/2020,"Stocks making the biggest moves midday: Salesforce, Palantir, Zoom, Tesla & more"
12/3/2020,"Here are Thursday’s biggest analyst calls of the day: Tesla, Goldman Sachs, Tyson Foods & ..."
12/4/2020,"Stocks making the biggest moves midday: Crowdstrike, Tesla, Snowflake, Boeing & more"
12/4/2020,"British EV start-up Arrival has the ‘best claim to be the son of Tesla,’ Jim ..."
12/10/2020,"Here are Thursday’s biggest analyst calls of the day: Best Buy, Disney, Five Below, Tesla ..."
12/11/2020,"Here are Friday’s biggest analyst calls of the day: Nike, Tesla, Southwest, Disney, Delta & ..."
12/19/2020,"Stocks making the biggest moves midday: Tesla, FedEx, Airbnb, Winnebago & more"
12/21/2020,Tesla’s S&P 500 addition will lead to higher scrutiny: GLJ Research CEO
12/22/2020,Why this analyst says Tesla’s stock price has room to grow
12/22/2020,"Bitcoin’s gains don’t seem ‘so wild’ compared to stocks like Tesla, crypto strategist says"
12/22/2020,Albion’s Jason Ware on Tesla’s entry into the S&P 500
12/25/2020,Wells Fargo’s top predictions for 2021 includes a warning about Tesla
12/25/2020,"Tesla will become the new AOL, Wells Fargo’s Chris Harvey warns"
9/23/2021,"Here are Thursday’s biggest analyst calls of the day: Micron, Plug Power, Apple, Zoom, Tesla ..."
10/7/2021,"Goldman upgrades struggling Tesla rival Nio, predicts 60% comeback in the stock"
10/12/2021,"Tesla ‘at the top of the mountain’ in EV market, analyst says"
10/14/2021,"Here are Thursday’s biggest analyst calls of the day: McDonald’s, Apple, Tesla, AT&T, Avis & ..."
10/15/2021,"Here are Friday’s biggest analyst calls of the day: Tesla, Facebook, Amazon, Micron, Uber & ..."
10/16/2021,The Week Ahead: Netflix and Tesla earnings coming up
10/18/2021,Tesla’s Musk dials into Volkswagen executive conference
10/18/2021,"Here are Monday’s biggest analyst calls of the day: Tesla, Microsoft, Chipotle, Netflix & more"
10/21/2021,"GE, Facebook, and Tesla are among today’s top stock picks for investors: Pro Market Movers ..."
10/21/2021,"Here are Thursday’s biggest analyst calls of the day: Exxon, Robinhood, Chevron, Tesla & more"
10/26/2021,"Facebook, Alphabet and Tesla are some of the stock picks by the experts: Pro Market ..."
10/27/2021,"Lucid, Rivian considered potential challengers to Tesla"
10/27/2021,Hertz interim CEO Fields explains company’s massive Tesla order
10/30/2021,"Chevron, Apple, Tesla and more of today’s top stock picks for investors: Pro Market Movers ..."
10/30/2021,The Week That Was: Tesla hits $1 trillion valuation and Facebook becomes ‘Meta’
11/2/2021,Kilburg: Anything that’s related to Tesla in the EV space could be a good investment
11/2/2021,"Here are Tuesday’s biggest analyst calls of the day: Robinhood, Tesla, Exxon, Ulta, Dell & ..."
11/3/2021,"Tesla, McDonald’s, and Chevron are some of today’s top stock picks for investors: Pro Market ..."
10/8/2021,Loup’s Gene Munster on how to trade Tesla stock
9/12/2023,"3-Stock Lunch: TSLA, SJM & BABA"
2/14/2024,How Elon Musk’s war on Delaware could change the way corporations make some of their ...
3/2/2024,OpenAI says in memo that Musk’s claims ‘stem from Elon’s regrets’ that he’s not part ...
3/2/2024,Lawyers who voided Elon Musk’s pay as excessive want $6 bln fee
3/15/2024,"Not all AI players need to be a part of the Magnificent 7, says Alex ..."
3/16/2024,Watch CNBC’s full interview with DCLA’s Sarat Sethi and Bernstein’s Toni Sacconaghi
4/2/2024,Xiaomi shares pop 16% after the Chinese smartphone maker launches its first EV
4/2/2024,Here are Wells Fargo’s top trades for the second quarter
4/6/2018,Tesla production briefly halted by paint shop fire in Fremont factory
10/18/2017,Former Tesla factory workers allege racial harassment in new lawsuit
2/2/2018,How Tesla’s first truck charging stations will be built
3/31/2018,Tesla says crashed vehicle had been on autopilot prior to accident
5/22/2018,Elon Musk says making a cheaper Model 3 now would cause Tesla to ‘die’
7/4/2018,Tesla stopped a ‘brake and roll’ test as it pushed to hit Model 3 goals
8/16/2018,"Tesla whistleblower tweets details about allegedly flawed cars, scrapped parts"
8/28/2018,Five Tesla experts on what happens to the stock after Elon Musk gives up on ...
4/12/2019,"Stocks making the biggest moves premarket: JP Morgan, Apple, Disney, Boeing, Tesla & more"
6/11/2019,"Trade tensions represent a ‘big challenge’ for Tesla, analyst says"
7/1/2019,"Wall Street expects estimated 74,100 Tesla Model 3 deliveries in second-quarter"
7/2/2019,Here’s what analysts expect from Tesla’s Q2 deliveries
7/2/2019,Tesla expects to open a China plant later in 2019
7/3/2019,"Here’s why there’s no reason to buy Tesla at this level, pro says"
7/3/2019,Tesla shares soar following record deliveries
7/3/2019,Here’s what’s next for Tesla following its record Q2 deliveries
7/4/2019,"Tesla needs to be able to increase deliveries, says tech analyst"
7/25/2019,Analysts are concerned Tesla buyers will pick newer Model 3 over Model S: WSJ reporter
7/25/2019,"Tesla misses revenue estimates, reports loss of $1.12 per share vs. $0.40 expected"
7/25/2019,"Tesla is a long-term growth stock, says analyst"
7/27/2019,"Tesla 2nd quarter ‘a disaster,’ Model 3 a ‘lousy’ car: Hoffman"
8/20/2019,Why Ron Baron is betting on his long-term Tesla investment
8/21/2019,"Walmart sues Tesla after solar panels on stores catch fire, calls Tesla to remove them"
8/23/2019,Here’s why an automaker may want to partner with Tesla
8/23/2019,Could Tesla survive without Elon Musk at the helm? Experts discuss
8/24/2019,Meet the Tesla Roadster whisperer
12/3/2019,Tesla CEO Elon Musk heads to court for defamation trial over a tweet
12/4/2019,"Yale’s Sonnenfeld blasts Tesla, Facebook and Twitter boards for their ‘fear of founder issues’"
12/4/2019,Tesla CEO Elon Musk arrives in court for defamation hearing
12/4/2019,"Tesla is a “must-own stock,” tax turbulence for corporate jets, TikTok trouble & spiked seltzer’s ..."
12/4/2019,"Here are the biggest analyst calls of the day: Tesla, Target, Denny’s & more"
12/6/2019,How the Elon Musk defamation case could affect Tesla stock
12/7/2019,"Tesla will eventually obey a trading range, says investing expert"
12/9/2019,Tesla bull Cathie Wood gives her take on the Cybertruck
12/9/2019,How other automakers are trying to compete with Tesla’s autopilot features
12/9/2019,Tesla Model 3 on autopilot crashes into a police vehicle in Connecticut
12/10/2019,Elon Musk showed off his Tesla Cybertruck at an upscale Malibu restaurant this weekend
12/10/2019,Tesla on Autopilot rear-ended a parked state police car in Connecticut
12/10/2019,Tesla under scrutiny after Conn. autopilot crash
12/12/2019,"Everything Jim Cramer said about the stock market on ‘Mad Money,’ including bullish on Tesla, ..."
12/18/2019,Tesla considers cutting China-built Model 3 sedan prices next year: Bloomberg
12/18/2019,"Tesla has made it through its most difficult days, analyst says"
12/20/2019,"Here’s who actually pre-ordered the Tesla Cybertruck, and why"
12/24/2019,"Stocks making the biggest moves midday: Boeing, Tesla, CarMax, Apache & more"
12/27/2019,Tesla secures $1.29 billion loan from Chinese banks for Shanghai factory
12/27/2019,"Stocks making the biggest moves premarket: Apple, Boeing, Tesla & more"
12/28/2019,"A lot of upside to Chinese market for Tesla, says The Verge’s Patel"
12/28/2019,Alexander Stoklosa: Tesla pushing outside the US market
12/30/2019,Tesla delivers first cars built at Shanghai factory
12/30/2019,Execution risk for Tesla is not priced into the stock: Analyst
12/31/2019,"Stocks making the biggest moves midday: Tesla, Restaurant Brands, LendingTree & more"
12/31/2019,Tesla closes in red after bearish Cowen note
12/31/2019,"Bullish on Tesla because of Europe, China: Wedbush’s Dan Ives"
1/3/2020,Canaccord raises price target for Tesla
1/3/2020,Canaccord raises price target for Tesla to $515
1/3/2020,Tesla cuts price on Model 3 by 16% after receiving subsidies
1/4/2020,"Stocks making the biggest moves midday: L3Harris, Tesla, Apache & more"
1/7/2020,Gene Munster lays out the path for Tesla’s market cap to hit $150 billion
