Date,News Title
2024-05-14,What to expect for Tesla’s Supercharger network now that the team is dismantled
2024-05-14,How Tesla may have just killed its most important product — Superchargers
2024-05-14,One auto stock is quietly breaking out as Tesla struggles. Citi sees a double from ...
2024-05-14,"Tuesday’s analyst calls: Nvidia earnings preview, gym stock gets an upgrade"
2024-05-14,China drives EV boom this year amid strong demand for hybrid vehicles
2024-05-13,"Here are Monday’s biggest analyst calls: Nvidia, Apple, Netflix, Delta, Micron, Visa, Mastercard, Target, Tesla, ..."
2024-05-13,Google’s Demis Hassabis is the man tasked with turning bleeding-edge AI research into profits
2024-05-13,WSJ’s Tim Hggins: There’s general concern Elon Musk’s X usage have become a distraction for ...
2024-05-12,"In the EV future, Thailand, the ‘Detroit of Asia,’ could be a key China hedge ..."
2024-05-12,"‘Big Short’ trader Danny Moses is still betting against Tesla, says core business is ’falling ..."
